,Character(decimal),Name,Braille
371,𒅳,CUNEIFORM SIGN KA TIMES LU,13-1-5-236-123-136
372,𒅴,CUNEIFORM SIGN KA TIMES ME,13-1-5-236-134-15
373,𒅵,CUNEIFORM SIGN KA TIMES ME PLUS DU,13-1-5-236-134-15-5-235-145-136
374,𒅶,CUNEIFORM SIGN KA TIMES ME PLUS GI,13-1-5-236-134-15-5-235-1245-24
375,𒅷,CUNEIFORM SIGN KA TIMES ME PLUS TE,13-1-5-236-134-15-5-235-2345-15
376,𒅸,CUNEIFORM SIGN KA TIMES MI,13-1-5-236-134-24
377,𒅹,CUNEIFORM SIGN KA TIMES MI PLUS NUNUZ,13-1-5-236-134-24-5-235-1345-136-1345-136
378,𒅺,CUNEIFORM SIGN KA TIMES NE,13-1-5-236-1345-15
379,𒅻,CUNEIFORM SIGN KA TIMES NUN,13-1-5-236-1345-136-1345
380,𒅼,CUNEIFORM SIGN KA TIMES PI,13-1-5-236-1234-24
381,𒅽,CUNEIFORM SIGN KA TIMES RU,13-1-5-236-1235-136
382,𒅾,CUNEIFORM SIGN KA TIMES SA,13-1-5-236-234-1
383,𒅿,CUNEIFORM SIGN KA TIMES SAR,13-1-5-236-234-1-1235
384,𒆀,CUNEIFORM SIGN KA TIMES SHA,13-1-5-236-234-125-1
385,𒆁,CUNEIFORM SIGN KA TIMES SHE,13-1-5-236-234-125-15
386,𒆂,CUNEIFORM SIGN KA TIMES SHID,13-1-5-236-234-125-24-145
387,𒆃,CUNEIFORM SIGN KA TIMES SHU,13-1-5-236-234-125-136
388,𒆄,CUNEIFORM SIGN KA TIMES SIG,13-1-5-236-234-24-1245
389,𒆅,CUNEIFORM SIGN KA TIMES SUHUR,13-1-5-236-234-136-125-136-1235
390,𒆆,CUNEIFORM SIGN KA TIMES TAR,13-1-5-236-2345-1-1235
391,𒆇,CUNEIFORM SIGN KA TIMES U,13-1-5-236-136
392,𒆈,CUNEIFORM SIGN KA TIMES U2,13-1-5-236-136-26-3456-12
393,𒆉,CUNEIFORM SIGN KA TIMES UD,13-1-5-236-136-145
394,𒆊,CUNEIFORM SIGN KA TIMES UMUM TIMES PA,13-1-5-236-136-134-136-134-5-236-1234-1
395,𒆋,CUNEIFORM SIGN KA TIMES USH,13-1-5-236-136-234-125
396,𒆌,CUNEIFORM SIGN KA TIMES ZI,13-1-5-236-1356-24
397,𒆍,CUNEIFORM SIGN KA2,13-1-26-3456-12
398,𒆎,CUNEIFORM SIGN KA2 CROSSING KA2,13-1-26-3456-12-14-1235-135-234-234-24-1345-1245-13-1-26-3456-12
399,𒆏,CUNEIFORM SIGN KAB,13-1-12
400,𒆐,CUNEIFORM SIGN KAD2,13-1-145-26-3456-12
401,𒆑,CUNEIFORM SIGN KAD3,13-1-145-26-3456-14
402,𒆒,CUNEIFORM SIGN KAD4,13-1-145-26-3456-145
403,𒆓,CUNEIFORM SIGN KAD5,13-1-145-26-3456-15
404,𒆔,CUNEIFORM SIGN KAD5 OVER KAD5,13-1-145-26-3456-15-5-34-13-1-145-26-3456-15
405,𒆕,CUNEIFORM SIGN KAK,13-1-13
406,𒆖,CUNEIFORM SIGN KAK TIMES IGI GUNU,13-1-13-5-236-24-1245-24-0-1245-136-1345-136
407,𒆗,CUNEIFORM SIGN KAL,13-1-123
408,𒆘,CUNEIFORM SIGN KAL TIMES BAD,13-1-123-5-236-12-1-145
409,𒆙,CUNEIFORM SIGN KAL CROSSING KAL,13-1-123-14-1235-135-234-234-24-1345-1245-13-1-123
410,𒆚,CUNEIFORM SIGN KAM2,13-1-134-26-3456-12
411,𒆛,CUNEIFORM SIGN KAM4,13-1-134-26-3456-145
412,𒆜,CUNEIFORM SIGN KASKAL,13-1-234-13-1-123
413,𒆝,CUNEIFORM SIGN KASKAL LAGAB TIMES U OVER LAGAB TIMES U,13-1-234-13-1-123-0-123-1-1245-1-12-5-236-136-5-34-123-1-1245-1-12-5-236-136
414,𒆞,CUNEIFORM SIGN KASKAL OVER KASKAL LAGAB TIMES U OVER LAGAB TIMES U,13-1-234-13-1-123-5-34-13-1-234-13-1-123-0-123-1-1245-1-12-5-236-136-5-34-123-1-1245-1-12-5-236-136
415,𒆟,CUNEIFORM SIGN KESH2,13-15-234-125-26-3456-12
416,𒆠,CUNEIFORM SIGN KI,13-24
417,𒆡,CUNEIFORM SIGN KI TIMES BAD,13-24-5-236-12-1-145
418,𒆢,CUNEIFORM SIGN KI TIMES U,13-24-5-236-136
419,𒆣,CUNEIFORM SIGN KI TIMES UD,13-24-5-236-136-145
420,𒆤,CUNEIFORM SIGN KID,13-24-145
421,𒆥,CUNEIFORM SIGN KIN,13-24-1345
422,𒆦,CUNEIFORM SIGN KISAL,13-24-234-1-123
423,𒆧,CUNEIFORM SIGN KISH,13-24-234-125
424,𒆨,CUNEIFORM SIGN KISIM5,13-24-234-24-134-26-3456-15
425,𒆩,CUNEIFORM SIGN KISIM5 OVER KISIM5,13-24-234-24-134-26-3456-15-5-34-13-24-234-24-134-26-3456-15
426,𒆪,CUNEIFORM SIGN KU,13-136
427,𒆫,CUNEIFORM SIGN KU OVER HI TIMES ASH2 KU OVER HI TIMES ASH2,13-136-5-34-125-24-5-236-1-234-125-26-3456-12-0-13-136-5-34-125-24-5-236-1-234-125-26-3456-12
428,𒆬,CUNEIFORM SIGN KU3,13-136-26-3456-14
429,𒆭,CUNEIFORM SIGN KU4,13-136-26-3456-145
430,𒆮,CUNEIFORM SIGN KU4 VARIANT FORM,13-136-26-3456-145-0-1236-1-1235-24-1-1345-2345-0-124-135-1235-134
431,𒆯,CUNEIFORM SIGN KU7,13-136-26-3456-1245
432,𒆰,CUNEIFORM SIGN KUL,13-136-123
433,𒆱,CUNEIFORM SIGN KUL GUNU,13-136-123-0-1245-136-1345-136
434,𒆲,CUNEIFORM SIGN KUN,13-136-1345
435,𒆳,CUNEIFORM SIGN KUR,13-136-1235
436,𒆴,CUNEIFORM SIGN KUR OPPOSING KUR,13-136-1235-135-1234-1234-135-234-24-1345-1245-13-136-1235
437,𒆵,CUNEIFORM SIGN KUSHU2,13-136-234-125-136-26-3456-12
438,𒆶,CUNEIFORM SIGN KWU318,13-2456-136-26-3456-14-26-3456-1-26-3456-125
439,𒆷,CUNEIFORM SIGN LA,123-1
440,𒆸,CUNEIFORM SIGN LAGAB,123-1-1245-1-12
441,𒆹,CUNEIFORM SIGN LAGAB TIMES A,123-1-1245-1-12-5-236-1
442,𒆺,CUNEIFORM SIGN LAGAB TIMES A PLUS DA PLUS HA,123-1-1245-1-12-5-236-1-5-235-145-1-5-235-125-1
443,𒆻,CUNEIFORM SIGN LAGAB TIMES A PLUS GAR,123-1-1245-1-12-5-236-1-5-235-1245-1-1235
444,𒆼,CUNEIFORM SIGN LAGAB TIMES A PLUS LAL,123-1-1245-1-12-5-236-1-5-235-123-1-123
445,𒆽,CUNEIFORM SIGN LAGAB TIMES AL,123-1-1245-1-12-5-236-1-123
446,𒆾,CUNEIFORM SIGN LAGAB TIMES AN,123-1-1245-1-12-5-236-1-1345
447,𒆿,CUNEIFORM SIGN LAGAB TIMES ASH ZIDA TENU,123-1-1245-1-12-5-236-1-234-125-0-1356-24-145-1-0-2345-15-1345-136
448,𒇀,CUNEIFORM SIGN LAGAB TIMES BAD,123-1-1245-1-12-5-236-12-1-145
449,𒇁,CUNEIFORM SIGN LAGAB TIMES BI,123-1-1245-1-12-5-236-12-24
450,𒇂,CUNEIFORM SIGN LAGAB TIMES DAR,123-1-1245-1-12-5-236-145-1-1235
451,𒇃,CUNEIFORM SIGN LAGAB TIMES EN,123-1-1245-1-12-5-236-15-1345
452,𒇄,CUNEIFORM SIGN LAGAB TIMES GA,123-1-1245-1-12-5-236-1245-1
453,𒇅,CUNEIFORM SIGN LAGAB TIMES GAR,123-1-1245-1-12-5-236-1245-1-1235
454,𒇆,CUNEIFORM SIGN LAGAB TIMES GUD,123-1-1245-1-12-5-236-1245-136-145
455,𒇇,CUNEIFORM SIGN LAGAB TIMES GUD PLUS GUD,123-1-1245-1-12-5-236-1245-136-145-5-235-1245-136-145
456,𒇈,CUNEIFORM SIGN LAGAB TIMES HA,123-1-1245-1-12-5-236-125-1
457,𒇉,CUNEIFORM SIGN LAGAB TIMES HAL,123-1-1245-1-12-5-236-125-1-123
458,𒇊,CUNEIFORM SIGN LAGAB TIMES HI TIMES NUN,123-1-1245-1-12-5-236-125-24-5-236-1345-136-1345
459,𒇋,CUNEIFORM SIGN LAGAB TIMES IGI GUNU,123-1-1245-1-12-5-236-24-1245-24-0-1245-136-1345-136
460,𒇌,CUNEIFORM SIGN LAGAB TIMES IM,123-1-1245-1-12-5-236-24-134
461,𒇍,CUNEIFORM SIGN LAGAB TIMES IM PLUS HA,123-1-1245-1-12-5-236-24-134-5-235-125-1
462,𒇎,CUNEIFORM SIGN LAGAB TIMES IM PLUS LU,123-1-1245-1-12-5-236-24-134-5-235-123-136
463,𒇏,CUNEIFORM SIGN LAGAB TIMES KI,123-1-1245-1-12-5-236-13-24
464,𒇐,CUNEIFORM SIGN LAGAB TIMES KIN,123-1-1245-1-12-5-236-13-24-1345
465,𒇑,CUNEIFORM SIGN LAGAB TIMES KU3,123-1-1245-1-12-5-236-13-136-26-3456-14
466,𒇒,CUNEIFORM SIGN LAGAB TIMES KUL,123-1-1245-1-12-5-236-13-136-123
467,𒇓,CUNEIFORM SIGN LAGAB TIMES KUL PLUS HI PLUS A,123-1-1245-1-12-5-236-13-136-123-5-235-125-24-5-235-1
468,𒇔,CUNEIFORM SIGN LAGAB TIMES LAGAB,123-1-1245-1-12-5-236-123-1-1245-1-12
469,𒇕,CUNEIFORM SIGN LAGAB TIMES LISH,123-1-1245-1-12-5-236-123-24-234-125
470,𒇖,CUNEIFORM SIGN LAGAB TIMES LU,123-1-1245-1-12-5-236-123-136
471,𒇗,CUNEIFORM SIGN LAGAB TIMES LUL,123-1-1245-1-12-5-236-123-136-123
472,𒇘,CUNEIFORM SIGN LAGAB TIMES ME,123-1-1245-1-12-5-236-134-15
473,𒇙,CUNEIFORM SIGN LAGAB TIMES ME PLUS EN,123-1-1245-1-12-5-236-134-15-5-235-15-1345
474,𒇚,CUNEIFORM SIGN LAGAB TIMES MUSH,123-1-1245-1-12-5-236-134-136-234-125
475,𒇛,CUNEIFORM SIGN LAGAB TIMES NE,123-1-1245-1-12-5-236-1345-15
476,𒇜,CUNEIFORM SIGN LAGAB TIMES SHE PLUS SUM,123-1-1245-1-12-5-236-234-125-15-5-235-234-136-134
477,𒇝,CUNEIFORM SIGN LAGAB TIMES SHITA PLUS GISH PLUS ERIN2,123-1-1245-1-12-5-236-234-125-24-2345-1-5-235-1245-24-234-125-5-235-15-1235-24-1345-26-3456-12
478,𒇞,CUNEIFORM SIGN LAGAB TIMES SHITA PLUS GISH TENU,123-1-1245-1-12-5-236-234-125-24-2345-1-5-235-1245-24-234-125-0-2345-15-1345-136
479,𒇟,CUNEIFORM SIGN LAGAB TIMES SHU2,123-1-1245-1-12-5-236-234-125-136-26-3456-12
480,𒇠,CUNEIFORM SIGN LAGAB TIMES SHU2 PLUS SHU2,123-1-1245-1-12-5-236-234-125-136-26-3456-12-5-235-234-125-136-26-3456-12
481,𒇡,CUNEIFORM SIGN LAGAB TIMES SUM,123-1-1245-1-12-5-236-234-136-134
482,𒇢,CUNEIFORM SIGN LAGAB TIMES TAG,123-1-1245-1-12-5-236-2345-1-1245
483,𒇣,CUNEIFORM SIGN LAGAB TIMES TAK4,123-1-1245-1-12-5-236-2345-1-13-26-3456-145
484,𒇤,CUNEIFORM SIGN LAGAB TIMES TE PLUS A PLUS SU PLUS NA,123-1-1245-1-12-5-236-2345-15-5-235-1-5-235-234-136-5-235-1345-1
485,𒇥,CUNEIFORM SIGN LAGAB TIMES U,123-1-1245-1-12-5-236-136
486,𒇦,CUNEIFORM SIGN LAGAB TIMES U PLUS A,123-1-1245-1-12-5-236-136-5-235-1
487,𒇧,CUNEIFORM SIGN LAGAB TIMES U PLUS U PLUS U,123-1-1245-1-12-5-236-136-5-235-136-5-235-136
488,𒇨,CUNEIFORM SIGN LAGAB TIMES U2 PLUS ASH,123-1-1245-1-12-5-236-136-26-3456-12-5-235-1-234-125
489,𒇩,CUNEIFORM SIGN LAGAB TIMES UD,123-1-1245-1-12-5-236-136-145
490,𒇪,CUNEIFORM SIGN LAGAB TIMES USH,123-1-1245-1-12-5-236-136-234-125
491,𒇫,CUNEIFORM SIGN LAGAB SQUARED,123-1-1245-1-12-35-3456-12
492,𒇬,CUNEIFORM SIGN LAGAR,123-1-1245-1-1235
493,𒇭,CUNEIFORM SIGN LAGAR TIMES SHE,123-1-1245-1-1235-5-236-234-125-15
494,𒇮,CUNEIFORM SIGN LAGAR TIMES SHE PLUS SUM,123-1-1245-1-1235-5-236-234-125-15-5-235-234-136-134
495,𒇯,CUNEIFORM SIGN LAGAR GUNU,123-1-1245-1-1235-0-1245-136-1345-136
496,𒇰,CUNEIFORM SIGN LAGAR GUNU OVER LAGAR GUNU SHE,123-1-1245-1-1235-0-1245-136-1345-136-5-34-123-1-1245-1-1235-0-1245-136-1345-136-0-234-125-15
497,𒇱,CUNEIFORM SIGN LAHSHU,123-1-125-234-125-136
498,𒇲,CUNEIFORM SIGN LAL,123-1-123
499,𒇳,CUNEIFORM SIGN LAL TIMES LAL,123-1-123-5-236-123-1-123
500,𒇴,CUNEIFORM SIGN LAM,123-1-134
501,𒇵,CUNEIFORM SIGN LAM TIMES KUR,123-1-134-5-236-13-136-1235
502,𒇶,CUNEIFORM SIGN LAM TIMES KUR PLUS RU,123-1-134-5-236-13-136-1235-5-235-1235-136
503,𒇷,CUNEIFORM SIGN LI,123-24
504,𒇸,CUNEIFORM SIGN LIL,123-24-123
505,𒇹,CUNEIFORM SIGN LIMMU2,123-24-134-134-136-26-3456-12
506,𒇺,CUNEIFORM SIGN LISH,123-24-234-125
507,𒇻,CUNEIFORM SIGN LU,123-136
508,𒇼,CUNEIFORM SIGN LU TIMES BAD,123-136-5-236-12-1-145
509,𒇽,CUNEIFORM SIGN LU2,123-136-26-3456-12
510,𒇾,CUNEIFORM SIGN LU2 TIMES AL,123-136-26-3456-12-5-236-1-123
511,𒇿,CUNEIFORM SIGN LU2 TIMES BAD,123-136-26-3456-12-5-236-12-1-145
512,𒈀,CUNEIFORM SIGN LU2 TIMES ESH2,123-136-26-3456-12-5-236-15-234-125-26-3456-12
513,𒈁,CUNEIFORM SIGN LU2 TIMES ESH2 TENU,123-136-26-3456-12-5-236-15-234-125-26-3456-12-0-2345-15-1345-136
514,𒈂,CUNEIFORM SIGN LU2 TIMES GAN2 TENU,123-136-26-3456-12-5-236-1245-1-1345-26-3456-12-0-2345-15-1345-136
515,𒈃,CUNEIFORM SIGN LU2 TIMES HI TIMES BAD,123-136-26-3456-12-5-236-125-24-5-236-12-1-145
516,𒈄,CUNEIFORM SIGN LU2 TIMES IM,123-136-26-3456-12-5-236-24-134
517,𒈅,CUNEIFORM SIGN LU2 TIMES KAD2,123-136-26-3456-12-5-236-13-1-145-26-3456-12
518,𒈆,CUNEIFORM SIGN LU2 TIMES KAD3,123-136-26-3456-12-5-236-13-1-145-26-3456-14
519,𒈇,CUNEIFORM SIGN LU2 TIMES KAD3 PLUS ASH,123-136-26-3456-12-5-236-13-1-145-26-3456-14-5-235-1-234-125
520,𒈈,CUNEIFORM SIGN LU2 TIMES KI,123-136-26-3456-12-5-236-13-24
521,𒈉,CUNEIFORM SIGN LU2 TIMES LA PLUS ASH,123-136-26-3456-12-5-236-123-1-5-235-1-234-125
522,𒈊,CUNEIFORM SIGN LU2 TIMES LAGAB,123-136-26-3456-12-5-236-123-1-1245-1-12
523,𒈋,CUNEIFORM SIGN LU2 TIMES ME PLUS EN,123-136-26-3456-12-5-236-134-15-5-235-15-1345
524,𒈌,CUNEIFORM SIGN LU2 TIMES NE,123-136-26-3456-12-5-236-1345-15
525,𒈍,CUNEIFORM SIGN LU2 TIMES NU,123-136-26-3456-12-5-236-1345-136
526,𒈎,CUNEIFORM SIGN LU2 TIMES SI PLUS ASH,123-136-26-3456-12-5-236-234-24-5-235-1-234-125
527,𒈏,CUNEIFORM SIGN LU2 TIMES SIK2 PLUS BU,123-136-26-3456-12-5-236-234-24-13-26-3456-12-5-235-12-136
528,𒈐,CUNEIFORM SIGN LU2 TIMES TUG2,123-136-26-3456-12-5-236-2345-136-1245-26-3456-12
529,𒈑,CUNEIFORM SIGN LU2 TENU,123-136-26-3456-12-0-2345-15-1345-136
530,𒈒,CUNEIFORM SIGN LU2 CROSSING LU2,123-136-26-3456-12-14-1235-135-234-234-24-1345-1245-123-136-26-3456-12
531,𒈓,CUNEIFORM SIGN LU2 OPPOSING LU2,123-136-26-3456-12-135-1234-1234-135-234-24-1345-1245-123-136-26-3456-12
532,𒈔,CUNEIFORM SIGN LU2 SQUARED,123-136-26-3456-12-35-3456-12
533,𒈕,CUNEIFORM SIGN LU2 SHESHIG,123-136-26-3456-12-0-234-125-15-234-125-24-1245
534,𒈖,CUNEIFORM SIGN LU3,123-136-26-3456-14
535,𒈗,CUNEIFORM SIGN LUGAL,123-136-1245-1-123
536,𒈘,CUNEIFORM SIGN LUGAL OVER LUGAL,123-136-1245-1-123-5-34-123-136-1245-1-123
537,𒈙,CUNEIFORM SIGN LUGAL OPPOSING LUGAL,123-136-1245-1-123-135-1234-1234-135-234-24-1345-1245-123-136-1245-1-123
538,𒈚,CUNEIFORM SIGN LUGAL SHESHIG,123-136-1245-1-123-0-234-125-15-234-125-24-1245
539,𒈛,CUNEIFORM SIGN LUH,123-136-125
540,𒈜,CUNEIFORM SIGN LUL,123-136-123
541,𒈝,CUNEIFORM SIGN LUM,123-136-134
542,𒈞,CUNEIFORM SIGN LUM OVER LUM,123-136-134-5-34-123-136-134
543,𒈟,CUNEIFORM SIGN LUM OVER LUM GAR OVER GAR,123-136-134-5-34-123-136-134-0-1245-1-1235-5-34-1245-1-1235
544,𒈠,CUNEIFORM SIGN MA,134-1
545,𒈡,CUNEIFORM SIGN MA TIMES TAK4,134-1-5-236-2345-1-13-26-3456-145
546,𒈢,CUNEIFORM SIGN MA GUNU,134-1-0-1245-136-1345-136
547,𒈣,CUNEIFORM SIGN MA2,134-1-26-3456-12
548,𒈤,CUNEIFORM SIGN MAH,134-1-125
549,𒈥,CUNEIFORM SIGN MAR,134-1-1235
550,𒈦,CUNEIFORM SIGN MASH,134-1-234-125
551,𒈧,CUNEIFORM SIGN MASH2,134-1-234-125-26-3456-12
552,𒈨,CUNEIFORM SIGN ME,134-15
553,𒈩,CUNEIFORM SIGN MES,134-15-234
554,𒈪,CUNEIFORM SIGN MI,134-24
555,𒈫,CUNEIFORM SIGN MIN,134-24-1345
556,𒈬,CUNEIFORM SIGN MU,134-136
557,𒈭,CUNEIFORM SIGN MU OVER MU,134-136-5-34-134-136
558,𒈮,CUNEIFORM SIGN MUG,134-136-1245
559,𒈯,CUNEIFORM SIGN MUG GUNU,134-136-1245-0-1245-136-1345-136
560,𒈰,CUNEIFORM SIGN MUNSUB,134-136-1345-234-136-12
561,𒈱,CUNEIFORM SIGN MURGU2,134-136-1235-1245-136-26-3456-12
562,𒈲,CUNEIFORM SIGN MUSH,134-136-234-125
563,𒈳,CUNEIFORM SIGN MUSH TIMES A,134-136-234-125-5-236-1
564,𒈴,CUNEIFORM SIGN MUSH TIMES KUR,134-136-234-125-5-236-13-136-1235
565,𒈵,CUNEIFORM SIGN MUSH TIMES ZA,134-136-234-125-5-236-1356-1
566,𒈶,CUNEIFORM SIGN MUSH OVER MUSH,134-136-234-125-5-34-134-136-234-125
567,𒈷,CUNEIFORM SIGN MUSH OVER MUSH TIMES A PLUS NA,134-136-234-125-5-34-134-136-234-125-5-236-1-5-235-1345-1
568,𒈸,CUNEIFORM SIGN MUSH CROSSING MUSH,134-136-234-125-14-1235-135-234-234-24-1345-1245-134-136-234-125
569,𒈹,CUNEIFORM SIGN MUSH3,134-136-234-125-26-3456-14
570,𒈺,CUNEIFORM SIGN MUSH3 TIMES A,134-136-234-125-26-3456-14-5-236-1
571,𒈻,CUNEIFORM SIGN MUSH3 TIMES A PLUS DI,134-136-234-125-26-3456-14-5-236-1-5-235-145-24
572,𒈼,CUNEIFORM SIGN MUSH3 TIMES DI,134-136-234-125-26-3456-14-5-236-145-24
573,𒈽,CUNEIFORM SIGN MUSH3 GUNU,134-136-234-125-26-3456-14-0-1245-136-1345-136
574,𒈾,CUNEIFORM SIGN NA,1345-1
575,𒈿,CUNEIFORM SIGN NA2,1345-1-26-3456-12
576,𒉀,CUNEIFORM SIGN NAGA,1345-1-1245-1
577,𒉁,CUNEIFORM SIGN NAGA INVERTED,1345-1-1245-1-0-24-1345-1236-15-1235-2345-15-145
578,𒉂,CUNEIFORM SIGN NAGA TIMES SHU TENU,1345-1-1245-1-5-236-234-125-136-0-2345-15-1345-136
579,𒉃,CUNEIFORM SIGN NAGA OPPOSING NAGA,1345-1-1245-1-135-1234-1234-135-234-24-1345-1245-1345-1-1245-1
580,𒉄,CUNEIFORM SIGN NAGAR,1345-1-1245-1-1235
581,𒉅,CUNEIFORM SIGN NAM NUTILLU,1345-1-134-0-1345-136-2345-24-123-123-136
582,𒉆,CUNEIFORM SIGN NAM,1345-1-134
583,𒉇,CUNEIFORM SIGN NAM2,1345-1-134-26-3456-12
584,𒉈,CUNEIFORM SIGN NE,1345-15
585,𒉉,CUNEIFORM SIGN NE TIMES A,1345-15-5-236-1
586,𒉊,CUNEIFORM SIGN NE TIMES UD,1345-15-5-236-136-145
587,𒉋,CUNEIFORM SIGN NE SHESHIG,1345-15-0-234-125-15-234-125-24-1245
588,𒉌,CUNEIFORM SIGN NI,1345-24
589,𒉍,CUNEIFORM SIGN NI TIMES E,1345-24-5-236-15
590,𒉎,CUNEIFORM SIGN NI2,1345-24-26-3456-12
591,𒉏,CUNEIFORM SIGN NIM,1345-24-134
592,𒉐,CUNEIFORM SIGN NIM TIMES GAN2 TENU,1345-24-134-5-236-1245-1-1345-26-3456-12-0-2345-15-1345-136
593,𒉑,CUNEIFORM SIGN NIM TIMES GAR PLUS GAN2 TENU,1345-24-134-5-236-1245-1-1235-5-235-1245-1-1345-26-3456-12-0-2345-15-1345-136
594,𒉒,CUNEIFORM SIGN NINDA2,1345-24-1345-145-1-26-3456-12
595,𒉓,CUNEIFORM SIGN NINDA2 TIMES AN,1345-24-1345-145-1-26-3456-12-5-236-1-1345
596,𒉔,CUNEIFORM SIGN NINDA2 TIMES ASH,1345-24-1345-145-1-26-3456-12-5-236-1-234-125
597,𒉕,CUNEIFORM SIGN NINDA2 TIMES ASH PLUS ASH,1345-24-1345-145-1-26-3456-12-5-236-1-234-125-5-235-1-234-125
598,𒉖,CUNEIFORM SIGN NINDA2 TIMES GUD,1345-24-1345-145-1-26-3456-12-5-236-1245-136-145
599,𒉗,CUNEIFORM SIGN NINDA2 TIMES ME PLUS GAN2 TENU,1345-24-1345-145-1-26-3456-12-5-236-134-15-5-235-1245-1-1345-26-3456-12-0-2345-15-1345-136
600,𒉘,CUNEIFORM SIGN NINDA2 TIMES NE,1345-24-1345-145-1-26-3456-12-5-236-1345-15
601,𒉙,CUNEIFORM SIGN NINDA2 TIMES NUN,1345-24-1345-145-1-26-3456-12-5-236-1345-136-1345
602,𒉚,CUNEIFORM SIGN NINDA2 TIMES SHE,1345-24-1345-145-1-26-3456-12-5-236-234-125-15
603,𒉛,CUNEIFORM SIGN NINDA2 TIMES SHE PLUS A AN,1345-24-1345-145-1-26-3456-12-5-236-234-125-15-5-235-1-0-1-1345
604,𒉜,CUNEIFORM SIGN NINDA2 TIMES SHE PLUS ASH,1345-24-1345-145-1-26-3456-12-5-236-234-125-15-5-235-1-234-125
605,𒉝,CUNEIFORM SIGN NINDA2 TIMES SHE PLUS ASH PLUS ASH,1345-24-1345-145-1-26-3456-12-5-236-234-125-15-5-235-1-234-125-5-235-1-234-125
606,𒉞,CUNEIFORM SIGN NINDA2 TIMES U2 PLUS ASH,1345-24-1345-145-1-26-3456-12-5-236-136-26-3456-12-5-235-1-234-125
607,𒉟,CUNEIFORM SIGN NINDA2 TIMES USH,1345-24-1345-145-1-26-3456-12-5-236-136-234-125
608,𒉠,CUNEIFORM SIGN NISAG,1345-24-234-1-1245
609,𒉡,CUNEIFORM SIGN NU,1345-136
610,𒉢,CUNEIFORM SIGN NU11,1345-136-26-3456-1-26-3456-1
611,𒉣,CUNEIFORM SIGN NUN,1345-136-1345
612,𒉤,CUNEIFORM SIGN NUN LAGAR TIMES GAR,1345-136-1345-0-123-1-1245-1-1235-5-236-1245-1-1235
613,𒉥,CUNEIFORM SIGN NUN LAGAR TIMES MASH,1345-136-1345-0-123-1-1245-1-1235-5-236-134-1-234-125
614,𒉦,CUNEIFORM SIGN NUN LAGAR TIMES SAL,1345-136-1345-0-123-1-1245-1-1235-5-236-234-1-123
615,𒉧,CUNEIFORM SIGN NUN LAGAR TIMES SAL OVER NUN LAGAR TIMES SAL,1345-136-1345-0-123-1-1245-1-1235-5-236-234-1-123-5-34-1345-136-1345-0-123-1-1245-1-1235-5-236-234-1-123
616,𒉨,CUNEIFORM SIGN NUN LAGAR TIMES USH,1345-136-1345-0-123-1-1245-1-1235-5-236-136-234-125
617,𒉩,CUNEIFORM SIGN NUN TENU,1345-136-1345-0-2345-15-1345-136
618,𒉪,CUNEIFORM SIGN NUN OVER NUN,1345-136-1345-5-34-1345-136-1345
619,𒉫,CUNEIFORM SIGN NUN CROSSING NUN,1345-136-1345-14-1235-135-234-234-24-1345-1245-1345-136-1345
620,𒉬,CUNEIFORM SIGN NUN CROSSING NUN LAGAR OVER LAGAR,1345-136-1345-14-1235-135-234-234-24-1345-1245-1345-136-1345-0-123-1-1245-1-1235-5-34-123-1-1245-1-1235
621,𒉭,CUNEIFORM SIGN NUNUZ,1345-136-1345-136
622,𒉮,CUNEIFORM SIGN NUNUZ AB2 TIMES ASHGAB,1345-136-1345-136-1356-0-1-12-26-3456-12-5-236-1-234-125-1245-1-12
623,𒉯,CUNEIFORM SIGN NUNUZ AB2 TIMES BI,1345-136-1345-136-1356-0-1-12-26-3456-12-5-236-12-24
624,𒉰,CUNEIFORM SIGN NUNUZ AB2 TIMES DUG,1345-136-1345-136-1356-0-1-12-26-3456-12-5-236-145-136-1245
625,𒉱,CUNEIFORM SIGN NUNUZ AB2 TIMES GUD,1345-136-1345-136-1356-0-1-12-26-3456-12-5-236-1245-136-145
626,𒉲,CUNEIFORM SIGN NUNUZ AB2 TIMES IGI GUNU,1345-136-1345-136-1356-0-1-12-26-3456-12-5-236-24-1245-24-0-1245-136-1345-136
627,𒉳,CUNEIFORM SIGN NUNUZ AB2 TIMES KAD3,1345-136-1345-136-1356-0-1-12-26-3456-12-5-236-13-1-145-26-3456-14
628,𒉴,CUNEIFORM SIGN NUNUZ AB2 TIMES LA,1345-136-1345-136-1356-0-1-12-26-3456-12-5-236-123-1
629,𒉵,CUNEIFORM SIGN NUNUZ AB2 TIMES NE,1345-136-1345-136-1356-0-1-12-26-3456-12-5-236-1345-15
630,𒉶,CUNEIFORM SIGN NUNUZ AB2 TIMES SILA3,1345-136-1345-136-1356-0-1-12-26-3456-12-5-236-234-24-123-1-26-3456-14
631,𒉷,CUNEIFORM SIGN NUNUZ AB2 TIMES U2,1345-136-1345-136-1356-0-1-12-26-3456-12-5-236-136-26-3456-12
632,𒉸,CUNEIFORM SIGN NUNUZ KISIM5 TIMES BI,1345-136-1345-136-1356-0-13-24-234-24-134-26-3456-15-5-236-12-24
633,𒉹,CUNEIFORM SIGN NUNUZ KISIM5 TIMES BI U,1345-136-1345-136-1356-0-13-24-234-24-134-26-3456-15-5-236-12-24-0-136
634,𒉺,CUNEIFORM SIGN PA,1234-1
635,𒉻,CUNEIFORM SIGN PAD,1234-1-145
636,𒉼,CUNEIFORM SIGN PAN,1234-1-1345
637,𒉽,CUNEIFORM SIGN PAP,1234-1-1234
638,𒉾,CUNEIFORM SIGN PESH2,1234-15-234-125-26-3456-12
639,𒉿,CUNEIFORM SIGN PI,1234-24
640,𒊀,CUNEIFORM SIGN PI TIMES A,1234-24-5-236-1
641,𒊁,CUNEIFORM SIGN PI TIMES AB,1234-24-5-236-1-12
642,𒊂,CUNEIFORM SIGN PI TIMES BI,1234-24-5-236-12-24
643,𒊃,CUNEIFORM SIGN PI TIMES BU,1234-24-5-236-12-136
644,𒊄,CUNEIFORM SIGN PI TIMES E,1234-24-5-236-15
645,𒊅,CUNEIFORM SIGN PI TIMES I,1234-24-5-236-24
646,𒊆,CUNEIFORM SIGN PI TIMES IB,1234-24-5-236-24-12
647,𒊇,CUNEIFORM SIGN PI TIMES U,1234-24-5-236-136
648,𒊈,CUNEIFORM SIGN PI TIMES U2,1234-24-5-236-136-26-3456-12
649,𒊉,CUNEIFORM SIGN PI CROSSING PI,1234-24-14-1235-135-234-234-24-1345-1245-1234-24
650,𒊊,CUNEIFORM SIGN PIRIG,1234-24-1235-24-1245
651,𒊋,CUNEIFORM SIGN PIRIG TIMES KAL,1234-24-1235-24-1245-5-236-13-1-123
652,𒊌,CUNEIFORM SIGN PIRIG TIMES UD,1234-24-1235-24-1245-5-236-136-145
653,𒊍,CUNEIFORM SIGN PIRIG TIMES ZA,1234-24-1235-24-1245-5-236-1356-1
654,𒊎,CUNEIFORM SIGN PIRIG OPPOSING PIRIG,1234-24-1235-24-1245-135-1234-1234-135-234-24-1345-1245-1234-24-1235-24-1245
655,𒊏,CUNEIFORM SIGN RA,1235-1
656,𒊐,CUNEIFORM SIGN RAB,1235-1-12
657,𒊑,CUNEIFORM SIGN RI,1235-24
658,𒊒,CUNEIFORM SIGN RU,1235-136
659,𒊓,CUNEIFORM SIGN SA,234-1
660,𒊔,CUNEIFORM SIGN SAG NUTILLU,234-1-1245-0-1345-136-2345-24-123-123-136
661,𒊕,CUNEIFORM SIGN SAG,234-1-1245
662,𒊖,CUNEIFORM SIGN SAG TIMES A,234-1-1245-5-236-1
663,𒊗,CUNEIFORM SIGN SAG TIMES DU,234-1-1245-5-236-145-136
664,𒊘,CUNEIFORM SIGN SAG TIMES DUB,234-1-1245-5-236-145-136-12
665,𒊙,CUNEIFORM SIGN SAG TIMES HA,234-1-1245-5-236-125-1
666,𒊚,CUNEIFORM SIGN SAG TIMES KAK,234-1-1245-5-236-13-1-13
667,𒊛,CUNEIFORM SIGN SAG TIMES KUR,234-1-1245-5-236-13-136-1235
668,𒊜,CUNEIFORM SIGN SAG TIMES LUM,234-1-1245-5-236-123-136-134
669,𒊝,CUNEIFORM SIGN SAG TIMES MI,234-1-1245-5-236-134-24
670,𒊞,CUNEIFORM SIGN SAG TIMES NUN,234-1-1245-5-236-1345-136-1345
671,𒊟,CUNEIFORM SIGN SAG TIMES SAL,234-1-1245-5-236-234-1-123
672,𒊠,CUNEIFORM SIGN SAG TIMES SHID,234-1-1245-5-236-234-125-24-145
673,𒊡,CUNEIFORM SIGN SAG TIMES TAB,234-1-1245-5-236-2345-1-12
674,𒊢,CUNEIFORM SIGN SAG TIMES U2,234-1-1245-5-236-136-26-3456-12
675,𒊣,CUNEIFORM SIGN SAG TIMES UB,234-1-1245-5-236-136-12
676,𒊤,CUNEIFORM SIGN SAG TIMES UM,234-1-1245-5-236-136-134
677,𒊥,CUNEIFORM SIGN SAG TIMES UR,234-1-1245-5-236-136-1235
678,𒊦,CUNEIFORM SIGN SAG TIMES USH,234-1-1245-5-236-136-234-125
679,𒊧,CUNEIFORM SIGN SAG OVER SAG,234-1-1245-5-34-234-1-1245
680,𒊨,CUNEIFORM SIGN SAG GUNU,234-1-1245-0-1245-136-1345-136
681,𒊩,CUNEIFORM SIGN SAL,234-1-123
682,𒊪,CUNEIFORM SIGN SAL LAGAB TIMES ASH2,234-1-123-0-123-1-1245-1-12-5-236-1-234-125-26-3456-12
683,𒊫,CUNEIFORM SIGN SANGA2,234-1-1345-1245-1-26-3456-12
684,𒊬,CUNEIFORM SIGN SAR,234-1-1235
685,𒊭,CUNEIFORM SIGN SHA,234-125-1
686,𒊮,CUNEIFORM SIGN SHA3,234-125-1-26-3456-14
687,𒊯,CUNEIFORM SIGN SHA3 TIMES A,234-125-1-26-3456-14-5-236-1
688,𒊰,CUNEIFORM SIGN SHA3 TIMES BAD,234-125-1-26-3456-14-5-236-12-1-145
689,𒊱,CUNEIFORM SIGN SHA3 TIMES GISH,234-125-1-26-3456-14-5-236-1245-24-234-125
690,𒊲,CUNEIFORM SIGN SHA3 TIMES NE,234-125-1-26-3456-14-5-236-1345-15
691,𒊳,CUNEIFORM SIGN SHA3 TIMES SHU2,234-125-1-26-3456-14-5-236-234-125-136-26-3456-12
692,𒊴,CUNEIFORM SIGN SHA3 TIMES TUR,234-125-1-26-3456-14-5-236-2345-136-1235
693,𒊵,CUNEIFORM SIGN SHA3 TIMES U,234-125-1-26-3456-14-5-236-136
694,𒊶,CUNEIFORM SIGN SHA3 TIMES U PLUS A,234-125-1-26-3456-14-5-236-136-5-235-1
695,𒊷,CUNEIFORM SIGN SHA6,234-125-1-26-3456-124
696,𒊸,CUNEIFORM SIGN SHAB6,234-125-1-12-26-3456-124
697,𒊹,CUNEIFORM SIGN SHAR2,234-125-1-1235-26-3456-12
698,𒊺,CUNEIFORM SIGN SHE,234-125-15
699,𒊻,CUNEIFORM SIGN SHE HU,234-125-15-0-125-136
700,𒊼,CUNEIFORM SIGN SHE OVER SHE GAD OVER GAD GAR OVER GAR,234-125-15-5-34-234-125-15-0-1245-1-145-5-34-1245-1-145-0-1245-1-1235-5-34-1245-1-1235
701,𒊽,CUNEIFORM SIGN SHE OVER SHE TAB OVER TAB GAR OVER GAR,234-125-15-5-34-234-125-15-0-2345-1-12-5-34-2345-1-12-0-1245-1-1235-5-34-1245-1-1235
702,𒊾,CUNEIFORM SIGN SHEG9,234-125-15-1245-26-3456-24
703,𒊿,CUNEIFORM SIGN SHEN,234-125-15-1345
704,𒋀,CUNEIFORM SIGN SHESH,234-125-15-234-125
705,𒋁,CUNEIFORM SIGN SHESH2,234-125-15-234-125-26-3456-12
706,𒋂,CUNEIFORM SIGN SHESHLAM,234-125-15-234-125-123-1-134
707,𒋃,CUNEIFORM SIGN SHID,234-125-24-145
708,𒋄,CUNEIFORM SIGN SHID TIMES A,234-125-24-145-5-236-1
709,𒋅,CUNEIFORM SIGN SHID TIMES IM,234-125-24-145-5-236-24-134
710,𒋆,CUNEIFORM SIGN SHIM,234-125-24-134
711,𒋇,CUNEIFORM SIGN SHIM TIMES A,234-125-24-134-5-236-1
712,𒋈,CUNEIFORM SIGN SHIM TIMES BAL,234-125-24-134-5-236-12-1-123
713,𒋉,CUNEIFORM SIGN SHIM TIMES BULUG,234-125-24-134-5-236-12-136-123-136-1245
714,𒋊,CUNEIFORM SIGN SHIM TIMES DIN,234-125-24-134-5-236-145-24-1345
715,𒋋,CUNEIFORM SIGN SHIM TIMES GAR,234-125-24-134-5-236-1245-1-1235
716,𒋌,CUNEIFORM SIGN SHIM TIMES IGI,234-125-24-134-5-236-24-1245-24
717,𒋍,CUNEIFORM SIGN SHIM TIMES IGI GUNU,234-125-24-134-5-236-24-1245-24-0-1245-136-1345-136
718,𒋎,CUNEIFORM SIGN SHIM TIMES KUSHU2,234-125-24-134-5-236-13-136-234-125-136-26-3456-12
719,𒋏,CUNEIFORM SIGN SHIM TIMES LUL,234-125-24-134-5-236-123-136-123
720,𒋐,CUNEIFORM SIGN SHIM TIMES MUG,234-125-24-134-5-236-134-136-1245
721,𒋑,CUNEIFORM SIGN SHIM TIMES SAL,234-125-24-134-5-236-234-1-123
722,𒋒,CUNEIFORM SIGN SHINIG,234-125-24-1345-24-1245
723,𒋓,CUNEIFORM SIGN SHIR,234-125-24-1235
724,𒋔,CUNEIFORM SIGN SHIR TENU,234-125-24-1235-0-2345-15-1345-136
725,𒋕,CUNEIFORM SIGN SHIR OVER SHIR BUR OVER BUR,234-125-24-1235-5-34-234-125-24-1235-0-12-136-1235-5-34-12-136-1235
726,𒋖,CUNEIFORM SIGN SHITA,234-125-24-2345-1
727,𒋗,CUNEIFORM SIGN SHU,234-125-136
728,𒋘,CUNEIFORM SIGN SHU OVER INVERTED SHU,234-125-136-5-34-24-1345-1236-15-1235-2345-15-145-0-234-125-136
729,𒋙,CUNEIFORM SIGN SHU2,234-125-136-26-3456-12
730,𒋚,CUNEIFORM SIGN SHUBUR,234-125-136-12-136-1235
731,𒋛,CUNEIFORM SIGN SI,234-24
732,𒋜,CUNEIFORM SIGN SI GUNU,234-24-0-1245-136-1345-136
733,𒋝,CUNEIFORM SIGN SIG,234-24-1245
734,𒋞,CUNEIFORM SIGN SIG4,234-24-1245-26-3456-145
