,Character(decimal),Decimal,Character(hex),Hex,Name,Braille
0,­њђђ,73728,­њђђ,12000,CUNEIFORM SIGN A,РаЂ
1,­њђЂ,73729,­њђЂ,12001,CUNEIFORM SIGN A TIMES A,РаЂРаљРадРаЂ
2,­њђѓ,73730,­њђѓ,12002,CUNEIFORM SIGN A TIMES BAD,РаЂРаљРадРаЃРаЂРаЎ
3,­њђЃ,73731,­њђЃ,12003,CUNEIFORM SIGN A TIMES GAN2 TENU,РаЂРаљРадРаЏРаЂРаЮРа╝РаЃ РаъРаЉРаЮРаЦ
4,­њђё,73732,­њђё,12004,CUNEIFORM SIGN A TIMES HA,РаЂРаљРадРаЊРаЂ
5,­њђЁ,73733,­њђЁ,12005,CUNEIFORM SIGN A TIMES IGI,РаЂРаљРадРаіРаЏРаі
6,­њђє,73734,­њђє,12006,CUNEIFORM SIGN A TIMES LAGAR GUNU,РаЂРаљРадРаЄРаЂРаЏРаЂРаЌ РаЏРаЦРаЮРаЦ
7,­њђЄ,73735,­њђЄ,12007,CUNEIFORM SIGN A TIMES MUSH,РаЂРаљРадРаЇРаЦРајРаЊ
8,­њђѕ,73736,­њђѕ,12008,CUNEIFORM SIGN A TIMES SAG,РаЂРаљРадРајРаЂРаЏ
9,­њђЅ,73737,­њђЅ,12009,CUNEIFORM SIGN A2,РаЂРа╝РаЃ
10,­њђі,73738,­њђі,1200A,CUNEIFORM SIGN AB,РаЂРаЃ
11,­њђІ,73739,­њђІ,1200B,CUNEIFORM SIGN AB TIMES ASH2,РаЂРаЃРаљРадРаЂРајРаЊРа╝РаЃ
12,­њђї,73740,­њђї,1200C,CUNEIFORM SIGN AB TIMES DUN3 GUNU,РаЂРаЃРаљРадРаЎРаЦРаЮРа╝РаЅ РаЏРаЦРаЮРаЦ
13,­њђЇ,73741,­њђЇ,1200D,CUNEIFORM SIGN AB TIMES GAL,РаЂРаЃРаљРадРаЏРаЂРаЄ
14,­њђј,73742,­њђј,1200E,CUNEIFORM SIGN AB TIMES GAN2 TENU,РаЂРаЃРаљРадРаЏРаЂРаЮРа╝РаЃ РаъРаЉРаЮРаЦ
15,­њђЈ,73743,­њђЈ,1200F,CUNEIFORM SIGN AB TIMES HA,РаЂРаЃРаљРадРаЊРаЂ
16,­њђљ,73744,­њђљ,12010,CUNEIFORM SIGN AB TIMES IGI GUNU,РаЂРаЃРаљРадРаіРаЏРаі РаЏРаЦРаЮРаЦ
17,­њђЉ,73745,­њђЉ,12011,CUNEIFORM SIGN AB TIMES IMIN,РаЂРаЃРаљРадРаіРаЇРаіРаЮ
18,­њђњ,73746,­њђњ,12012,CUNEIFORM SIGN AB TIMES LAGAB,РаЂРаЃРаљРадРаЄРаЂРаЏРаЂРаЃ
19,­њђЊ,73747,­њђЊ,12013,CUNEIFORM SIGN AB TIMES SHESH,РаЂРаЃРаљРадРајРаЊРаЉРајРаЊ
20,­њђћ,73748,­њђћ,12014,CUNEIFORM SIGN AB TIMES U PLUS U PLUS U,РаЂРаЃРаљРадРаЦРаљРаќРаЦРаљРаќРаЦ
21,­њђЋ,73749,­њђЋ,12015,CUNEIFORM SIGN AB GUNU,РаЂРаЃ РаЏРаЦРаЮРаЦ
22,­њђќ,73750,­њђќ,12016,CUNEIFORM SIGN AB2,РаЂРаЃРа╝РаЃ
23,­њђЌ,73751,­њђЌ,12017,CUNEIFORM SIGN AB2 TIMES BALAG,РаЂРаЃРа╝РаЃРаљРадРаЃРаЂРаЄРаЂРаЏ
24,­њђў,73752,­њђў,12018,CUNEIFORM SIGN AB2 TIMES GAN2 TENU,РаЂРаЃРа╝РаЃРаљРадРаЏРаЂРаЮРа╝РаЃ РаъРаЉРаЮРаЦ
25,­њђЎ,73753,­њђЎ,12019,CUNEIFORM SIGN AB2 TIMES ME PLUS EN,РаЂРаЃРа╝РаЃРаљРадРаЇРаЉРаљРаќРаЉРаЮ
26,­њђџ,73754,­њђџ,1201A,CUNEIFORM SIGN AB2 TIMES SHA3,РаЂРаЃРа╝РаЃРаљРадРајРаЊРаЂРа╝РаЅ
27,­њђЏ,73755,­њђЏ,1201B,CUNEIFORM SIGN AB2 TIMES TAK4,РаЂРаЃРа╝РаЃРаљРадРаъРаЂРаЁРа╝РаЎ
28,­њђю,73756,­њђю,1201C,CUNEIFORM SIGN AD,РаЂРаЎ
29,­њђЮ,73757,­њђЮ,1201D,CUNEIFORM SIGN AK,РаЂРаЁ
30,­њђъ,73758,­њђъ,1201E,CUNEIFORM SIGN AK TIMES ERIN2,РаЂРаЁРаљРадРаЉРаЌРаіРаЮРа╝РаЃ
31,­њђЪ,73759,­њђЪ,1201F,CUNEIFORM SIGN AK TIMES SHITA PLUS GISH,РаЂРаЁРаљРадРајРаЊРаіРаъРаЂРаљРаќРаЏРаіРајРаЊ
32,­њђа,73760,­њђа,12020,CUNEIFORM SIGN AL,РаЂРаЄ
33,­њђА,73761,­њђА,12021,CUNEIFORM SIGN AL TIMES AL,РаЂРаЄРаљРадРаЂРаЄ
34,­њђб,73762,­њђб,12022,CUNEIFORM SIGN AL TIMES DIM2,РаЂРаЄРаљРадРаЎРаіРаЇРа╝РаЃ
35,­њђБ,73763,­њђБ,12023,CUNEIFORM SIGN AL TIMES GISH,РаЂРаЄРаљРадРаЏРаіРајРаЊ
36,­њђц,73764,­њђц,12024,CUNEIFORM SIGN AL TIMES HA,РаЂРаЄРаљРадРаЊРаЂ
37,­њђЦ,73765,­њђЦ,12025,CUNEIFORM SIGN AL TIMES KAD3,РаЂРаЄРаљРадРаЁРаЂРаЎРа╝РаЅ
38,­њђд,73766,­њђд,12026,CUNEIFORM SIGN AL TIMES KI,РаЂРаЄРаљРадРаЁРаі
39,­њђД,73767,­њђД,12027,CUNEIFORM SIGN AL TIMES SHE,РаЂРаЄРаљРадРајРаЊРаЉ
40,­њђе,73768,­њђе,12028,CUNEIFORM SIGN AL TIMES USH,РаЂРаЄРаљРадРаЦРајРаЊ
41,­њђЕ,73769,­њђЕ,12029,CUNEIFORM SIGN ALAN,РаЂРаЄРаЂРаЮ
42,­њђф,73770,­њђф,1202A,CUNEIFORM SIGN ALEPH,РаЂРаЄРаЉРаЈРаЊ
43,­њђФ,73771,­њђФ,1202B,CUNEIFORM SIGN AMAR,РаЂРаЇРаЂРаЌ
44,­њђг,73772,­њђг,1202C,CUNEIFORM SIGN AMAR TIMES SHE,РаЂРаЇРаЂРаЌРаљРадРајРаЊРаЉ
45,­њђГ,73773,­њђГ,1202D,CUNEIFORM SIGN AN,РаЂРаЮ
46,­њђ«,73774,­њђ«,1202E,CUNEIFORM SIGN AN OVER AN,РаЂРаЮРаљРаїРаЂРаЮ
47,­њђ»,73775,­њђ»,1202F,CUNEIFORM SIGN AN THREE TIMES,РаЂРаЮРаћРа╝РаЅ
48,­њђ░,73776,­њђ░,12030,CUNEIFORM SIGN AN PLUS NAGA OPPOSING AN PLUS NAGA,РаЂРаЮРаљРаќРаЮРаЂРаЏРаЂРаѕРајРаЂРаЮРаљРаќРаЮРаЂРаЏРаЂ
49,­њђ▒,73777,­њђ▒,12031,CUNEIFORM SIGN AN PLUS NAGA SQUARED,РаЂРаЮРаљРаќРаЮРаЂРаЏРаЂРаћРа╝РаЃ
50,­њђ▓,73778,­њђ▓,12032,CUNEIFORM SIGN ANSHE,РаЂРаЮРајРаЊРаЉ
51,­њђ│,73779,­њђ│,12033,CUNEIFORM SIGN APIN,РаЂРаЈРаіРаЮ
52,­њђ┤,73780,­њђ┤,12034,CUNEIFORM SIGN ARAD,РаЂРаЌРаЂРаЎ
53,­њђх,73781,­њђх,12035,CUNEIFORM SIGN ARAD TIMES KUR,РаЂРаЌРаЂРаЎРаљРадРаЁРаЦРаЌ
54,­њђХ,73782,­њђХ,12036,CUNEIFORM SIGN ARKAB,РаЂРаЌРаЁРаЂРаЃ
55,­њђи,73783,­њђи,12037,CUNEIFORM SIGN ASAL2,РаЂРајРаЂРаЄРа╝РаЃ
56,­њђИ,73784,­њђИ,12038,CUNEIFORM SIGN ASH,РаЂРајРаЊ
57,­њђ╣,73785,­њђ╣,12039,CUNEIFORM SIGN ASH ZIDA TENU,РаЂРајРаЊ РахРаіРаЎРаЂ РаъРаЉРаЮРаЦ
58,­њђ║,73786,­њђ║,1203A,CUNEIFORM SIGN ASH KABA TENU,РаЂРајРаЊ РаЁРаЂРаЃРаЂ РаъРаЉРаЮРаЦ
59,­њђ╗,73787,­њђ╗,1203B,CUNEIFORM SIGN ASH OVER ASH TUG2 OVER TUG2 TUG2 OVER TUG2 PAP,РаЂРајРаЊРаљРаїРаЂРајРаЊ РаъРаЦРаЏРа╝РаЃРаљРаїРаъРаЦРаЏРа╝РаЃ РаъРаЦРаЏРа╝РаЃРаљРаїРаъРаЦРаЏРа╝РаЃ РаЈРаЂРаЈ
60,­њђ╝,73788,­њђ╝,1203C,CUNEIFORM SIGN ASH OVER ASH OVER ASH,РаЂРајРаЊРаљРаїРаЂРајРаЊРаљРаїРаЂРајРаЊ
61,­њђй,73789,­њђй,1203D,CUNEIFORM SIGN ASH OVER ASH OVER ASH CROSSING ASH OVER ASH OVER ASH,РаЂРајРаЊРаљРаїРаЂРајРаЊРаљРаїРаЂРајРаЊРаѕРа»РаЂРајРаЊРаљРаїРаЂРајРаЊРаљРаїРаЂРајРаЊ
62,­њђЙ,73790,­њђЙ,1203E,CUNEIFORM SIGN ASH2,РаЂРајРаЊРа╝РаЃ
63,­њђ┐,73791,­њђ┐,1203F,CUNEIFORM SIGN ASHGAB,РаЂРајРаЊРаЏРаЂРаЃ
64,­њЂђ,73792,­њЂђ,12040,CUNEIFORM SIGN BA,РаЃРаЂ
65,­њЂЂ,73793,­њЂЂ,12041,CUNEIFORM SIGN BAD,РаЃРаЂРаЎ
66,­њЂѓ,73794,­њЂѓ,12042,CUNEIFORM SIGN BAG3,РаЃРаЂРаЏРа╝РаЅ
67,­њЂЃ,73795,­њЂЃ,12043,CUNEIFORM SIGN BAHAR2,РаЃРаЂРаЊРаЂРаЌРа╝РаЃ
68,­њЂё,73796,­њЂё,12044,CUNEIFORM SIGN BAL,РаЃРаЂРаЄ
69,­њЂЁ,73797,­њЂЁ,12045,CUNEIFORM SIGN BAL OVER BAL,РаЃРаЂРаЄРаљРаїРаЃРаЂРаЄ
70,­њЂє,73798,­њЂє,12046,CUNEIFORM SIGN BALAG,РаЃРаЂРаЄРаЂРаЏ
71,­њЂЄ,73799,­њЂЄ,12047,CUNEIFORM SIGN BAR,РаЃРаЂРаЌ
72,­њЂѕ,73800,­њЂѕ,12048,CUNEIFORM SIGN BARA2,РаЃРаЂРаЌРаЂРа╝РаЃ
73,­њЂЅ,73801,­њЂЅ,12049,CUNEIFORM SIGN BI,РаЃРаі
74,­њЂі,73802,­њЂі,1204A,CUNEIFORM SIGN BI TIMES A,РаЃРаіРаљРадРаЂ
75,­њЂІ,73803,­њЂІ,1204B,CUNEIFORM SIGN BI TIMES GAR,РаЃРаіРаљРадРаЏРаЂРаЌ
76,­њЂї,73804,­њЂї,1204C,CUNEIFORM SIGN BI TIMES IGI GUNU,РаЃРаіРаљРадРаіРаЏРаі РаЏРаЦРаЮРаЦ
77,­њЂЇ,73805,­њЂЇ,1204D,CUNEIFORM SIGN BU,РаЃРаЦ
78,­њЂј,73806,­њЂј,1204E,CUNEIFORM SIGN BU OVER BU AB,РаЃРаЦРаљРаїРаЃРаЦ РаЂРаЃ
79,­њЂЈ,73807,­њЂЈ,1204F,CUNEIFORM SIGN BU OVER BU UN,РаЃРаЦРаљРаїРаЃРаЦ РаЦРаЮ
80,­њЂљ,73808,­њЂљ,12050,CUNEIFORM SIGN BU CROSSING BU,РаЃРаЦРаѕРа»РаЃРаЦ
81,­њЂЉ,73809,­њЂЉ,12051,CUNEIFORM SIGN BULUG,РаЃРаЦРаЄРаЦРаЏ
82,­њЂњ,73810,­њЂњ,12052,CUNEIFORM SIGN BULUG OVER BULUG,РаЃРаЦРаЄРаЦРаЏРаљРаїРаЃРаЦРаЄРаЦРаЏ
83,­њЂЊ,73811,­њЂЊ,12053,CUNEIFORM SIGN BUR,РаЃРаЦРаЌ
84,­њЂћ,73812,­њЂћ,12054,CUNEIFORM SIGN BUR2,РаЃРаЦРаЌРа╝РаЃ
85,­њЂЋ,73813,­њЂЋ,12055,CUNEIFORM SIGN DA,РаЎРаЂ
86,­њЂќ,73814,­њЂќ,12056,CUNEIFORM SIGN DAG,РаЎРаЂРаЏ
87,­њЂЌ,73815,­њЂЌ,12057,CUNEIFORM SIGN DAG KISIM5 TIMES A PLUS MASH,РаЎРаЂРаЏ РаЁРаіРајРаіРаЇРа╝РаЉРаљРадРаЂРаљРаќРаЇРаЂРајРаЊ
88,­њЂў,73816,­њЂў,12058,CUNEIFORM SIGN DAG KISIM5 TIMES AMAR,РаЎРаЂРаЏ РаЁРаіРајРаіРаЇРа╝РаЉРаљРадРаЂРаЇРаЂРаЌ
89,­њЂЎ,73817,­њЂЎ,12059,CUNEIFORM SIGN DAG KISIM5 TIMES BALAG,РаЎРаЂРаЏ РаЁРаіРајРаіРаЇРа╝РаЉРаљРадРаЃРаЂРаЄРаЂРаЏ
90,­њЂџ,73818,­њЂџ,1205A,CUNEIFORM SIGN DAG KISIM5 TIMES BI,РаЎРаЂРаЏ РаЁРаіРајРаіРаЇРа╝РаЉРаљРадРаЃРаі
91,­њЂЏ,73819,­њЂЏ,1205B,CUNEIFORM SIGN DAG KISIM5 TIMES GA,РаЎРаЂРаЏ РаЁРаіРајРаіРаЇРа╝РаЉРаљРадРаЏРаЂ
92,­њЂю,73820,­њЂю,1205C,CUNEIFORM SIGN DAG KISIM5 TIMES GA PLUS MASH,РаЎРаЂРаЏ РаЁРаіРајРаіРаЇРа╝РаЉРаљРадРаЏРаЂРаљРаќРаЇРаЂРајРаЊ
93,­њЂЮ,73821,­њЂЮ,1205D,CUNEIFORM SIGN DAG KISIM5 TIMES GI,РаЎРаЂРаЏ РаЁРаіРајРаіРаЇРа╝РаЉРаљРадРаЏРаі
94,­њЂъ,73822,­њЂъ,1205E,CUNEIFORM SIGN DAG KISIM5 TIMES GIR2,РаЎРаЂРаЏ РаЁРаіРајРаіРаЇРа╝РаЉРаљРадРаЏРаіРаЌРа╝РаЃ
95,­њЂЪ,73823,­њЂЪ,1205F,CUNEIFORM SIGN DAG KISIM5 TIMES GUD,РаЎРаЂРаЏ РаЁРаіРајРаіРаЇРа╝РаЉРаљРадРаЏРаЦРаЎ
96,­њЂа,73824,­њЂа,12060,CUNEIFORM SIGN DAG KISIM5 TIMES HA,РаЎРаЂРаЏ РаЁРаіРајРаіРаЇРа╝РаЉРаљРадРаЊРаЂ
97,­њЂА,73825,­њЂА,12061,CUNEIFORM SIGN DAG KISIM5 TIMES IR,РаЎРаЂРаЏ РаЁРаіРајРаіРаЇРа╝РаЉРаљРадРаіРаЌ
98,­њЂб,73826,­њЂб,12062,CUNEIFORM SIGN DAG KISIM5 TIMES IR PLUS LU,РаЎРаЂРаЏ РаЁРаіРајРаіРаЇРа╝РаЉРаљРадРаіРаЌРаљРаќРаЄРаЦ
99,­њЂБ,73827,­њЂБ,12063,CUNEIFORM SIGN DAG KISIM5 TIMES KAK,РаЎРаЂРаЏ РаЁРаіРајРаіРаЇРа╝РаЉРаљРадРаЁРаЂРаЁ
100,­њЂц,73828,­њЂц,12064,CUNEIFORM SIGN DAG KISIM5 TIMES LA,РаЎРаЂРаЏ РаЁРаіРајРаіРаЇРа╝РаЉРаљРадРаЄРаЂ
101,­њЂЦ,73829,­њЂЦ,12065,CUNEIFORM SIGN DAG KISIM5 TIMES LU,РаЎРаЂРаЏ РаЁРаіРајРаіРаЇРа╝РаЉРаљРадРаЄРаЦ
102,­њЂд,73830,­њЂд,12066,CUNEIFORM SIGN DAG KISIM5 TIMES LU PLUS MASH2,РаЎРаЂРаЏ РаЁРаіРајРаіРаЇРа╝РаЉРаљРадРаЄРаЦРаљРаќРаЇРаЂРајРаЊРа╝РаЃ
103,­њЂД,73831,­њЂД,12067,CUNEIFORM SIGN DAG KISIM5 TIMES LUM,РаЎРаЂРаЏ РаЁРаіРајРаіРаЇРа╝РаЉРаљРадРаЄРаЦРаЇ
104,­њЂе,73832,­њЂе,12068,CUNEIFORM SIGN DAG KISIM5 TIMES NE,РаЎРаЂРаЏ РаЁРаіРајРаіРаЇРа╝РаЉРаљРадРаЮРаЉ
105,­њЂЕ,73833,­њЂЕ,12069,CUNEIFORM SIGN DAG KISIM5 TIMES PAP PLUS PAP,РаЎРаЂРаЏ РаЁРаіРајРаіРаЇРа╝РаЉРаљРадРаЈРаЂРаЈРаљРаќРаЈРаЂРаЈ
106,­њЂф,73834,­њЂф,1206A,CUNEIFORM SIGN DAG KISIM5 TIMES SI,РаЎРаЂРаЏ РаЁРаіРајРаіРаЇРа╝РаЉРаљРадРајРаі
107,­њЂФ,73835,­њЂФ,1206B,CUNEIFORM SIGN DAG KISIM5 TIMES TAK4,РаЎРаЂРаЏ РаЁРаіРајРаіРаЇРа╝РаЉРаљРадРаъРаЂРаЁРа╝РаЎ
108,­њЂг,73836,­њЂг,1206C,CUNEIFORM SIGN DAG KISIM5 TIMES U2 PLUS GIR2,РаЎРаЂРаЏ РаЁРаіРајРаіРаЇРа╝РаЉРаљРадРаЦРа╝РаЃРаљРаќРаЏРаіРаЌРа╝РаЃ
109,­њЂГ,73837,­њЂГ,1206D,CUNEIFORM SIGN DAG KISIM5 TIMES USH,РаЎРаЂРаЏ РаЁРаіРајРаіРаЇРа╝РаЉРаљРадРаЦРајРаЊ
110,­њЂ«,73838,­њЂ«,1206E,CUNEIFORM SIGN DAM,РаЎРаЂРаЇ
111,­њЂ»,73839,­њЂ»,1206F,CUNEIFORM SIGN DAR,РаЎРаЂРаЌ
112,­њЂ░,73840,­њЂ░,12070,CUNEIFORM SIGN DARA3,РаЎРаЂРаЌРаЂРа╝РаЅ
113,­њЂ▒,73841,­њЂ▒,12071,CUNEIFORM SIGN DARA4,РаЎРаЂРаЌРаЂРа╝РаЎ
114,­њЂ▓,73842,­њЂ▓,12072,CUNEIFORM SIGN DI,РаЎРаі
115,­њЂ│,73843,­њЂ│,12073,CUNEIFORM SIGN DIB,РаЎРаіРаЃ
116,­њЂ┤,73844,­њЂ┤,12074,CUNEIFORM SIGN DIM,РаЎРаіРаЇ
117,­њЂх,73845,­њЂх,12075,CUNEIFORM SIGN DIM TIMES SHE,РаЎРаіРаЇРаљРадРајРаЊРаЉ
118,­њЂХ,73846,­њЂХ,12076,CUNEIFORM SIGN DIM2,РаЎРаіРаЇРа╝РаЃ
119,­њЂи,73847,­њЂи,12077,CUNEIFORM SIGN DIN,РаЎРаіРаЮ
120,­њЂИ,73848,­њЂИ,12078,CUNEIFORM SIGN DIN KASKAL U GUNU DISH,РаЎРаіРаЮ РаЁРаЂРајРаЁРаЂРаЄ РаЦ РаЏРаЦРаЮРаЦ РаЎРаіРајРаЊ
121,­њЂ╣,73849,­њЂ╣,12079,CUNEIFORM SIGN DISH,РаЎРаіРајРаЊ
122,­њЂ║,73850,­њЂ║,1207A,CUNEIFORM SIGN DU,РаЎРаЦ
123,­њЂ╗,73851,­њЂ╗,1207B,CUNEIFORM SIGN DU OVER DU,РаЎРаЦРаљРаїРаЎРаЦ
124,­њЂ╝,73852,­њЂ╝,1207C,CUNEIFORM SIGN DU GUNU,РаЎРаЦ РаЏРаЦРаЮРаЦ
125,­њЂй,73853,­њЂй,1207D,CUNEIFORM SIGN DU SHESHIG,РаЎРаЦ РајРаЊРаЉРајРаЊРаіРаЏ
126,­њЂЙ,73854,­њЂЙ,1207E,CUNEIFORM SIGN DUB,РаЎРаЦРаЃ
127,­њЂ┐,73855,­њЂ┐,1207F,CUNEIFORM SIGN DUB TIMES ESH2,РаЎРаЦРаЃРаљРадРаЉРајРаЊРа╝РаЃ
128,­њѓђ,73856,­њѓђ,12080,CUNEIFORM SIGN DUB2,РаЎРаЦРаЃРа╝РаЃ
129,­њѓЂ,73857,­њѓЂ,12081,CUNEIFORM SIGN DUG,РаЎРаЦРаЏ
130,­њѓѓ,73858,­њѓѓ,12082,CUNEIFORM SIGN DUGUD,РаЎРаЦРаЏРаЦРаЎ
131,­њѓЃ,73859,­њѓЃ,12083,CUNEIFORM SIGN DUH,РаЎРаЦРаЊ
132,­њѓё,73860,­њѓё,12084,CUNEIFORM SIGN DUN,РаЎРаЦРаЮ
133,­њѓЁ,73861,­њѓЁ,12085,CUNEIFORM SIGN DUN3,РаЎРаЦРаЮРа╝РаЅ
134,­њѓє,73862,­њѓє,12086,CUNEIFORM SIGN DUN3 GUNU,РаЎРаЦРаЮРа╝РаЅ РаЏРаЦРаЮРаЦ
135,­њѓЄ,73863,­њѓЄ,12087,CUNEIFORM SIGN DUN3 GUNU GUNU,РаЎРаЦРаЮРа╝РаЅ РаЏРаЦРаЮРаЦ РаЏРаЦРаЮРаЦ
136,­њѓѕ,73864,­њѓѕ,12088,CUNEIFORM SIGN DUN4,РаЎРаЦРаЮРа╝РаЎ
137,­њѓЅ,73865,­њѓЅ,12089,CUNEIFORM SIGN DUR2,РаЎРаЦРаЌРа╝РаЃ
138,­њѓі,73866,­њѓі,1208A,CUNEIFORM SIGN E,РаЉ
139,­њѓІ,73867,­њѓІ,1208B,CUNEIFORM SIGN E TIMES PAP,РаЉРаљРадРаЈРаЂРаЈ
140,­њѓї,73868,­њѓї,1208C,CUNEIFORM SIGN E OVER E NUN OVER NUN,РаЉРаљРаїРаЉ РаЮРаЦРаЮРаљРаїРаЮРаЦРаЮ
141,­њѓЇ,73869,­њѓЇ,1208D,CUNEIFORM SIGN E2,РаЉРа╝РаЃ
142,­њѓј,73870,­њѓј,1208E,CUNEIFORM SIGN E2 TIMES A PLUS HA PLUS DA,РаЉРа╝РаЃРаљРадРаЂРаљРаќРаЊРаЂРаљРаќРаЎРаЂ
143,­њѓЈ,73871,­њѓЈ,1208F,CUNEIFORM SIGN E2 TIMES GAR,РаЉРа╝РаЃРаљРадРаЏРаЂРаЌ
144,­њѓљ,73872,­њѓљ,12090,CUNEIFORM SIGN E2 TIMES MI,РаЉРа╝РаЃРаљРадРаЇРаі
145,­њѓЉ,73873,­њѓЉ,12091,CUNEIFORM SIGN E2 TIMES SAL,РаЉРа╝РаЃРаљРадРајРаЂРаЄ
146,­њѓњ,73874,­њѓњ,12092,CUNEIFORM SIGN E2 TIMES SHE,РаЉРа╝РаЃРаљРадРајРаЊРаЉ
147,­њѓЊ,73875,­њѓЊ,12093,CUNEIFORM SIGN E2 TIMES U,РаЉРа╝РаЃРаљРадРаЦ
148,­њѓћ,73876,­њѓћ,12094,CUNEIFORM SIGN EDIN,РаЉРаЎРаіРаЮ
149,­њѓЋ,73877,­њѓЋ,12095,CUNEIFORM SIGN EGIR,РаЉРаЏРаіРаЌ
150,­њѓќ,73878,­њѓќ,12096,CUNEIFORM SIGN EL,РаЉРаЄ
151,­њѓЌ,73879,­њѓЌ,12097,CUNEIFORM SIGN EN,РаЉРаЮ
152,­њѓў,73880,­њѓў,12098,CUNEIFORM SIGN EN TIMES GAN2,РаЉРаЮРаљРадРаЏРаЂРаЮРа╝РаЃ
153,­њѓЎ,73881,­њѓЎ,12099,CUNEIFORM SIGN EN TIMES GAN2 TENU,РаЉРаЮРаљРадРаЏРаЂРаЮРа╝РаЃ РаъРаЉРаЮРаЦ
154,­њѓџ,73882,­њѓџ,1209A,CUNEIFORM SIGN EN TIMES ME,РаЉРаЮРаљРадРаЇРаЉ
155,­њѓЏ,73883,­њѓЏ,1209B,CUNEIFORM SIGN EN CROSSING EN,РаЉРаЮРаѕРа»РаЉРаЮ
156,­њѓю,73884,­њѓю,1209C,CUNEIFORM SIGN EN OPPOSING EN,РаЉРаЮРаѕРајРаЉРаЮ
157,­њѓЮ,73885,­њѓЮ,1209D,CUNEIFORM SIGN EN SQUARED,РаЉРаЮРаћРа╝РаЃ
158,­њѓъ,73886,­њѓъ,1209E,CUNEIFORM SIGN EREN,РаЉРаЌРаЉРаЮ
159,­њѓЪ,73887,­њѓЪ,1209F,CUNEIFORM SIGN ERIN2,РаЉРаЌРаіРаЮРа╝РаЃ
160,­њѓа,73888,­њѓа,120A0,CUNEIFORM SIGN ESH2,РаЉРајРаЊРа╝РаЃ
161,­њѓА,73889,­њѓА,120A1,CUNEIFORM SIGN EZEN,РаЉРахРаЉРаЮ
162,­њѓб,73890,­њѓб,120A2,CUNEIFORM SIGN EZEN TIMES A,РаЉРахРаЉРаЮРаљРадРаЂ
163,­њѓБ,73891,­њѓБ,120A3,CUNEIFORM SIGN EZEN TIMES A PLUS LAL,РаЉРахРаЉРаЮРаљРадРаЂРаљРаќРаЄРаЂРаЄ
164,­њѓц,73892,­њѓц,120A4,CUNEIFORM SIGN EZEN TIMES A PLUS LAL TIMES LAL,РаЉРахРаЉРаЮРаљРадРаЂРаљРаќРаЄРаЂРаЄРаљРадРаЄРаЂРаЄ
165,­њѓЦ,73893,­њѓЦ,120A5,CUNEIFORM SIGN EZEN TIMES AN,РаЉРахРаЉРаЮРаљРадРаЂРаЮ
166,­њѓд,73894,­њѓд,120A6,CUNEIFORM SIGN EZEN TIMES BAD,РаЉРахРаЉРаЮРаљРадРаЃРаЂРаЎ
167,­њѓД,73895,­њѓД,120A7,CUNEIFORM SIGN EZEN TIMES DUN3 GUNU,РаЉРахРаЉРаЮРаљРадРаЎРаЦРаЮРа╝РаЅ РаЏРаЦРаЮРаЦ
168,­њѓе,73896,­њѓе,120A8,CUNEIFORM SIGN EZEN TIMES DUN3 GUNU GUNU,РаЉРахРаЉРаЮРаљРадРаЎРаЦРаЮРа╝РаЅ РаЏРаЦРаЮРаЦ РаЏРаЦРаЮРаЦ
169,­њѓЕ,73897,­њѓЕ,120A9,CUNEIFORM SIGN EZEN TIMES HA,РаЉРахРаЉРаЮРаљРадРаЊРаЂ
170,­њѓф,73898,­њѓф,120AA,CUNEIFORM SIGN EZEN TIMES HA GUNU,РаЉРахРаЉРаЮРаљРадРаЊРаЂ РаЏРаЦРаЮРаЦ
171,­њѓФ,73899,­њѓФ,120AB,CUNEIFORM SIGN EZEN TIMES IGI GUNU,РаЉРахРаЉРаЮРаљРадРаіРаЏРаі РаЏРаЦРаЮРаЦ
172,­њѓг,73900,­њѓг,120AC,CUNEIFORM SIGN EZEN TIMES KASKAL,РаЉРахРаЉРаЮРаљРадРаЁРаЂРајРаЁРаЂРаЄ
173,­њѓГ,73901,­њѓГ,120AD,CUNEIFORM SIGN EZEN TIMES KASKAL SQUARED,РаЉРахРаЉРаЮРаљРадРаЁРаЂРајРаЁРаЂРаЄРаћРа╝РаЃ
174,­њѓ«,73902,­њѓ«,120AE,CUNEIFORM SIGN EZEN TIMES KU3,РаЉРахРаЉРаЮРаљРадРаЁРаЦРа╝РаЅ
175,­њѓ»,73903,­њѓ»,120AF,CUNEIFORM SIGN EZEN TIMES LA,РаЉРахРаЉРаЮРаљРадРаЄРаЂ
176,­њѓ░,73904,­њѓ░,120B0,CUNEIFORM SIGN EZEN TIMES LAL TIMES LAL,РаЉРахРаЉРаЮРаљРадРаЄРаЂРаЄРаљРадРаЄРаЂРаЄ
177,­њѓ▒,73905,­њѓ▒,120B1,CUNEIFORM SIGN EZEN TIMES LI,РаЉРахРаЉРаЮРаљРадРаЄРаі
178,­њѓ▓,73906,­њѓ▓,120B2,CUNEIFORM SIGN EZEN TIMES LU,РаЉРахРаЉРаЮРаљРадРаЄРаЦ
179,­њѓ│,73907,­њѓ│,120B3,CUNEIFORM SIGN EZEN TIMES U2,РаЉРахРаЉРаЮРаљРадРаЦРа╝РаЃ
180,­њѓ┤,73908,­њѓ┤,120B4,CUNEIFORM SIGN EZEN TIMES UD,РаЉРахРаЉРаЮРаљРадРаЦРаЎ
181,­њѓх,73909,­њѓх,120B5,CUNEIFORM SIGN GA,РаЏРаЂ
182,­њѓХ,73910,­њѓХ,120B6,CUNEIFORM SIGN GA GUNU,РаЏРаЂ РаЏРаЦРаЮРаЦ
183,­њѓи,73911,­њѓи,120B7,CUNEIFORM SIGN GA2,РаЏРаЂРа╝РаЃ
184,­њѓИ,73912,­њѓИ,120B8,CUNEIFORM SIGN GA2 TIMES A PLUS DA PLUS HA,РаЏРаЂРа╝РаЃРаљРадРаЂРаљРаќРаЎРаЂРаљРаќРаЊРаЂ
185,­њѓ╣,73913,­њѓ╣,120B9,CUNEIFORM SIGN GA2 TIMES A PLUS HA,РаЏРаЂРа╝РаЃРаљРадРаЂРаљРаќРаЊРаЂ
186,­њѓ║,73914,­њѓ║,120BA,CUNEIFORM SIGN GA2 TIMES A PLUS IGI,РаЏРаЂРа╝РаЃРаљРадРаЂРаљРаќРаіРаЏРаі
187,­њѓ╗,73915,­њѓ╗,120BB,CUNEIFORM SIGN GA2 TIMES AB2 TENU PLUS TAB,РаЏРаЂРа╝РаЃРаљРадРаЂРаЃРа╝РаЃ РаъРаЉРаЮРаЦРаљРаќРаъРаЂРаЃ
188,­њѓ╝,73916,­њѓ╝,120BC,CUNEIFORM SIGN GA2 TIMES AN,РаЏРаЂРа╝РаЃРаљРадРаЂРаЮ
189,­њѓй,73917,­њѓй,120BD,CUNEIFORM SIGN GA2 TIMES ASH,РаЏРаЂРа╝РаЃРаљРадРаЂРајРаЊ
190,­њѓЙ,73918,­њѓЙ,120BE,CUNEIFORM SIGN GA2 TIMES ASH2 PLUS GAL,РаЏРаЂРа╝РаЃРаљРадРаЂРајРаЊРа╝РаЃРаљРаќРаЏРаЂРаЄ
191,­њѓ┐,73919,­њѓ┐,120BF,CUNEIFORM SIGN GA2 TIMES BAD,РаЏРаЂРа╝РаЃРаљРадРаЃРаЂРаЎ
192,­њЃђ,73920,­њЃђ,120C0,CUNEIFORM SIGN GA2 TIMES BAR PLUS RA,РаЏРаЂРа╝РаЃРаљРадРаЃРаЂРаЌРаљРаќРаЌРаЂ
193,­њЃЂ,73921,­њЃЂ,120C1,CUNEIFORM SIGN GA2 TIMES BUR,РаЏРаЂРа╝РаЃРаљРадРаЃРаЦРаЌ
194,­њЃѓ,73922,­њЃѓ,120C2,CUNEIFORM SIGN GA2 TIMES BUR PLUS RA,РаЏРаЂРа╝РаЃРаљРадРаЃРаЦРаЌРаљРаќРаЌРаЂ
195,­њЃЃ,73923,­њЃЃ,120C3,CUNEIFORM SIGN GA2 TIMES DA,РаЏРаЂРа╝РаЃРаљРадРаЎРаЂ
196,­њЃё,73924,­њЃё,120C4,CUNEIFORM SIGN GA2 TIMES DI,РаЏРаЂРа╝РаЃРаљРадРаЎРаі
197,­њЃЁ,73925,­њЃЁ,120C5,CUNEIFORM SIGN GA2 TIMES DIM TIMES SHE,РаЏРаЂРа╝РаЃРаљРадРаЎРаіРаЇРаљРадРајРаЊРаЉ
198,­њЃє,73926,­њЃє,120C6,CUNEIFORM SIGN GA2 TIMES DUB,РаЏРаЂРа╝РаЃРаљРадРаЎРаЦРаЃ
199,­њЃЄ,73927,­њЃЄ,120C7,CUNEIFORM SIGN GA2 TIMES EL,РаЏРаЂРа╝РаЃРаљРадРаЉРаЄ
200,­њЃѕ,73928,­њЃѕ,120C8,CUNEIFORM SIGN GA2 TIMES EL PLUS LA,РаЏРаЂРа╝РаЃРаљРадРаЉРаЄРаљРаќРаЄРаЂ
201,­њЃЅ,73929,­њЃЅ,120C9,CUNEIFORM SIGN GA2 TIMES EN,РаЏРаЂРа╝РаЃРаљРадРаЉРаЮ
202,­њЃі,73930,­њЃі,120CA,CUNEIFORM SIGN GA2 TIMES EN TIMES GAN2 TENU,РаЏРаЂРа╝РаЃРаљРадРаЉРаЮРаљРадРаЏРаЂРаЮРа╝РаЃ РаъРаЉРаЮРаЦ
203,­њЃІ,73931,­њЃІ,120CB,CUNEIFORM SIGN GA2 TIMES GAN2 TENU,РаЏРаЂРа╝РаЃРаљРадРаЏРаЂРаЮРа╝РаЃ РаъРаЉРаЮРаЦ
204,­њЃї,73932,­њЃї,120CC,CUNEIFORM SIGN GA2 TIMES GAR,РаЏРаЂРа╝РаЃРаљРадРаЏРаЂРаЌ
205,­њЃЇ,73933,­њЃЇ,120CD,CUNEIFORM SIGN GA2 TIMES GI,РаЏРаЂРа╝РаЃРаљРадРаЏРаі
206,­њЃј,73934,­њЃј,120CE,CUNEIFORM SIGN GA2 TIMES GI4,РаЏРаЂРа╝РаЃРаљРадРаЏРаіРа╝РаЎ
207,­њЃЈ,73935,­њЃЈ,120CF,CUNEIFORM SIGN GA2 TIMES GI4 PLUS A,РаЏРаЂРа╝РаЃРаљРадРаЏРаіРа╝РаЎРаљРаќРаЂ
208,­њЃљ,73936,­њЃљ,120D0,CUNEIFORM SIGN GA2 TIMES GIR2 PLUS SU,РаЏРаЂРа╝РаЃРаљРадРаЏРаіРаЌРа╝РаЃРаљРаќРајРаЦ
209,­њЃЉ,73937,­њЃЉ,120D1,CUNEIFORM SIGN GA2 TIMES HA PLUS LU PLUS ESH2,РаЏРаЂРа╝РаЃРаљРадРаЊРаЂРаљРаќРаЄРаЦРаљРаќРаЉРајРаЊРа╝РаЃ
210,­њЃњ,73938,­њЃњ,120D2,CUNEIFORM SIGN GA2 TIMES HAL,РаЏРаЂРа╝РаЃРаљРадРаЊРаЂРаЄ
211,­њЃЊ,73939,­њЃЊ,120D3,CUNEIFORM SIGN GA2 TIMES HAL PLUS LA,РаЏРаЂРа╝РаЃРаљРадРаЊРаЂРаЄРаљРаќРаЄРаЂ
212,­њЃћ,73940,­њЃћ,120D4,CUNEIFORM SIGN GA2 TIMES HI PLUS LI,РаЏРаЂРа╝РаЃРаљРадРаЊРаіРаљРаќРаЄРаі
213,­њЃЋ,73941,­њЃЋ,120D5,CUNEIFORM SIGN GA2 TIMES HUB2,РаЏРаЂРа╝РаЃРаљРадРаЊРаЦРаЃРа╝РаЃ
214,­њЃќ,73942,­њЃќ,120D6,CUNEIFORM SIGN GA2 TIMES IGI GUNU,РаЏРаЂРа╝РаЃРаљРадРаіРаЏРаі РаЏРаЦРаЮРаЦ
215,­њЃЌ,73943,­њЃЌ,120D7,CUNEIFORM SIGN GA2 TIMES ISH PLUS HU PLUS ASH,РаЏРаЂРа╝РаЃРаљРадРаіРајРаЊРаљРаќРаЊРаЦРаљРаќРаЂРајРаЊ
216,­њЃў,73944,­њЃў,120D8,CUNEIFORM SIGN GA2 TIMES KAK,РаЏРаЂРа╝РаЃРаљРадРаЁРаЂРаЁ
217,­њЃЎ,73945,­њЃЎ,120D9,CUNEIFORM SIGN GA2 TIMES KASKAL,РаЏРаЂРа╝РаЃРаљРадРаЁРаЂРајРаЁРаЂРаЄ
218,­њЃџ,73946,­њЃџ,120DA,CUNEIFORM SIGN GA2 TIMES KID,РаЏРаЂРа╝РаЃРаљРадРаЁРаіРаЎ
