,Character(decimal),Decimal,Character(hex),Hex,Name,Braille
669,­њіЮ,74397,­њіЮ,1229D,CUNEIFORM SIGN SAG TIMES MI,РајРаЂРаЏРаљРадРаЇРаі
670,­њіъ,74398,­њіъ,1229E,CUNEIFORM SIGN SAG TIMES NUN,РајРаЂРаЏРаљРадРаЮРаЦРаЮ
671,­њіЪ,74399,­њіЪ,1229F,CUNEIFORM SIGN SAG TIMES SAL,РајРаЂРаЏРаљРадРајРаЂРаЄ
672,­њіа,74400,­њіа,122A0,CUNEIFORM SIGN SAG TIMES SHID,РајРаЂРаЏРаљРадРајРаЊРаіРаЎ
673,­њіА,74401,­њіА,122A1,CUNEIFORM SIGN SAG TIMES TAB,РајРаЂРаЏРаљРадРаъРаЂРаЃ
674,­њіб,74402,­њіб,122A2,CUNEIFORM SIGN SAG TIMES U2,РајРаЂРаЏРаљРадРаЦРа╝РаЃ
675,­њіБ,74403,­њіБ,122A3,CUNEIFORM SIGN SAG TIMES UB,РајРаЂРаЏРаљРадРаЦРаЃ
676,­њіц,74404,­њіц,122A4,CUNEIFORM SIGN SAG TIMES UM,РајРаЂРаЏРаљРадРаЦРаЇ
677,­њіЦ,74405,­њіЦ,122A5,CUNEIFORM SIGN SAG TIMES UR,РајРаЂРаЏРаљРадРаЦРаЌ
678,­њід,74406,­њід,122A6,CUNEIFORM SIGN SAG TIMES USH,РајРаЂРаЏРаљРадРаЦРајРаЊ
679,­њіД,74407,­њіД,122A7,CUNEIFORM SIGN SAG OVER SAG,РајРаЂРаЏРаљРаїРајРаЂРаЏ
680,­њіе,74408,­њіе,122A8,CUNEIFORM SIGN SAG GUNU,РајРаЂРаЏ РаЏРаЦРаЮРаЦ
681,­њіЕ,74409,­њіЕ,122A9,CUNEIFORM SIGN SAL,РајРаЂРаЄ
682,­њіф,74410,­њіф,122AA,CUNEIFORM SIGN SAL LAGAB TIMES ASH2,РајРаЂРаЄ РаЄРаЂРаЏРаЂРаЃРаљРадРаЂРајРаЊРа╝РаЃ
683,­њіФ,74411,­њіФ,122AB,CUNEIFORM SIGN SANGA2,РајРаЂРаЮРаЏРаЂРа╝РаЃ
684,­њіг,74412,­њіг,122AC,CUNEIFORM SIGN SAR,РајРаЂРаЌ
685,­њіГ,74413,­њіГ,122AD,CUNEIFORM SIGN SHA,РајРаЊРаЂ
686,­њі«,74414,­њі«,122AE,CUNEIFORM SIGN SHA3,РајРаЊРаЂРа╝РаЅ
687,­њі»,74415,­њі»,122AF,CUNEIFORM SIGN SHA3 TIMES A,РајРаЊРаЂРа╝РаЅРаљРадРаЂ
688,­њі░,74416,­њі░,122B0,CUNEIFORM SIGN SHA3 TIMES BAD,РајРаЊРаЂРа╝РаЅРаљРадРаЃРаЂРаЎ
689,­њі▒,74417,­њі▒,122B1,CUNEIFORM SIGN SHA3 TIMES GISH,РајРаЊРаЂРа╝РаЅРаљРадРаЏРаіРајРаЊ
690,­њі▓,74418,­њі▓,122B2,CUNEIFORM SIGN SHA3 TIMES NE,РајРаЊРаЂРа╝РаЅРаљРадРаЮРаЉ
691,­њі│,74419,­њі│,122B3,CUNEIFORM SIGN SHA3 TIMES SHU2,РајРаЊРаЂРа╝РаЅРаљРадРајРаЊРаЦРа╝РаЃ
692,­њі┤,74420,­њі┤,122B4,CUNEIFORM SIGN SHA3 TIMES TUR,РајРаЊРаЂРа╝РаЅРаљРадРаъРаЦРаЌ
693,­њіх,74421,­њіх,122B5,CUNEIFORM SIGN SHA3 TIMES U,РајРаЊРаЂРа╝РаЅРаљРадРаЦ
694,­њіХ,74422,­њіХ,122B6,CUNEIFORM SIGN SHA3 TIMES U PLUS A,РајРаЊРаЂРа╝РаЅРаљРадРаЦРаљРаќРаЂ
695,­њіи,74423,­њіи,122B7,CUNEIFORM SIGN SHA6,РајРаЊРаЂРа╝РаІ
696,­њіИ,74424,­њіИ,122B8,CUNEIFORM SIGN SHAB6,РајРаЊРаЂРаЃРа╝РаІ
697,­њі╣,74425,­њі╣,122B9,CUNEIFORM SIGN SHAR2,РајРаЊРаЂРаЌРа╝РаЃ
698,­њі║,74426,­њі║,122BA,CUNEIFORM SIGN SHE,РајРаЊРаЉ
699,­њі╗,74427,­њі╗,122BB,CUNEIFORM SIGN SHE HU,РајРаЊРаЉ РаЊРаЦ
700,­њі╝,74428,­њі╝,122BC,CUNEIFORM SIGN SHE OVER SHE GAD OVER GAD GAR OVER GAR,РајРаЊРаЉРаљРаїРајРаЊРаЉ РаЏРаЂРаЎРаљРаїРаЏРаЂРаЎ РаЏРаЂРаЌРаљРаїРаЏРаЂРаЌ
701,­њій,74429,­њій,122BD,CUNEIFORM SIGN SHE OVER SHE TAB OVER TAB GAR OVER GAR,РајРаЊРаЉРаљРаїРајРаЊРаЉ РаъРаЂРаЃРаљРаїРаъРаЂРаЃ РаЏРаЂРаЌРаљРаїРаЏРаЂРаЌ
702,­њіЙ,74430,­њіЙ,122BE,CUNEIFORM SIGN SHEG9,РајРаЊРаЉРаЏРа╝Раі
703,­њі┐,74431,­њі┐,122BF,CUNEIFORM SIGN SHEN,РајРаЊРаЉРаЮ
704,­њІђ,74432,­њІђ,122C0,CUNEIFORM SIGN SHESH,РајРаЊРаЉРајРаЊ
705,­њІЂ,74433,­њІЂ,122C1,CUNEIFORM SIGN SHESH2,РајРаЊРаЉРајРаЊРа╝РаЃ
706,­њІѓ,74434,­њІѓ,122C2,CUNEIFORM SIGN SHESHLAM,РајРаЊРаЉРајРаЊРаЄРаЂРаЇ
707,­њІЃ,74435,­њІЃ,122C3,CUNEIFORM SIGN SHID,РајРаЊРаіРаЎ
708,­њІё,74436,­њІё,122C4,CUNEIFORM SIGN SHID TIMES A,РајРаЊРаіРаЎРаљРадРаЂ
709,­њІЁ,74437,­њІЁ,122C5,CUNEIFORM SIGN SHID TIMES IM,РајРаЊРаіРаЎРаљРадРаіРаЇ
710,­њІє,74438,­њІє,122C6,CUNEIFORM SIGN SHIM,РајРаЊРаіРаЇ
711,­њІЄ,74439,­њІЄ,122C7,CUNEIFORM SIGN SHIM TIMES A,РајРаЊРаіРаЇРаљРадРаЂ
712,­њІѕ,74440,­њІѕ,122C8,CUNEIFORM SIGN SHIM TIMES BAL,РајРаЊРаіРаЇРаљРадРаЃРаЂРаЄ
713,­њІЅ,74441,­њІЅ,122C9,CUNEIFORM SIGN SHIM TIMES BULUG,РајРаЊРаіРаЇРаљРадРаЃРаЦРаЄРаЦРаЏ
714,­њІі,74442,­њІі,122CA,CUNEIFORM SIGN SHIM TIMES DIN,РајРаЊРаіРаЇРаљРадРаЎРаіРаЮ
715,­њІІ,74443,­њІІ,122CB,CUNEIFORM SIGN SHIM TIMES GAR,РајРаЊРаіРаЇРаљРадРаЏРаЂРаЌ
716,­њІї,74444,­њІї,122CC,CUNEIFORM SIGN SHIM TIMES IGI,РајРаЊРаіРаЇРаљРадРаіРаЏРаі
717,­њІЇ,74445,­њІЇ,122CD,CUNEIFORM SIGN SHIM TIMES IGI GUNU,РајРаЊРаіРаЇРаљРадРаіРаЏРаі РаЏРаЦРаЮРаЦ
718,­њІј,74446,­њІј,122CE,CUNEIFORM SIGN SHIM TIMES KUSHU2,РајРаЊРаіРаЇРаљРадРаЁРаЦРајРаЊРаЦРа╝РаЃ
719,­њІЈ,74447,­њІЈ,122CF,CUNEIFORM SIGN SHIM TIMES LUL,РајРаЊРаіРаЇРаљРадРаЄРаЦРаЄ
720,­њІљ,74448,­њІљ,122D0,CUNEIFORM SIGN SHIM TIMES MUG,РајРаЊРаіРаЇРаљРадРаЇРаЦРаЏ
721,­њІЉ,74449,­њІЉ,122D1,CUNEIFORM SIGN SHIM TIMES SAL,РајРаЊРаіРаЇРаљРадРајРаЂРаЄ
722,­њІњ,74450,­њІњ,122D2,CUNEIFORM SIGN SHINIG,РајРаЊРаіРаЮРаіРаЏ
723,­њІЊ,74451,­њІЊ,122D3,CUNEIFORM SIGN SHIR,РајРаЊРаіРаЌ
724,­њІћ,74452,­њІћ,122D4,CUNEIFORM SIGN SHIR TENU,РајРаЊРаіРаЌ РаъРаЉРаЮРаЦ
725,­њІЋ,74453,­њІЋ,122D5,CUNEIFORM SIGN SHIR OVER SHIR BUR OVER BUR,РајРаЊРаіРаЌРаљРаїРајРаЊРаіРаЌ РаЃРаЦРаЌРаљРаїРаЃРаЦРаЌ
726,­њІќ,74454,­њІќ,122D6,CUNEIFORM SIGN SHITA,РајРаЊРаіРаъРаЂ
727,­њІЌ,74455,­њІЌ,122D7,CUNEIFORM SIGN SHU,РајРаЊРаЦ
728,­њІў,74456,­њІў,122D8,CUNEIFORM SIGN SHU OVER INVERTED SHU,РајРаЊРаЦРаљРаїРаіРаЮРаДРаЉРаЌРаъРаЉРаЎ РајРаЊРаЦ
729,­њІЎ,74457,­њІЎ,122D9,CUNEIFORM SIGN SHU2,РајРаЊРаЦРа╝РаЃ
730,­њІџ,74458,­њІџ,122DA,CUNEIFORM SIGN SHUBUR,РајРаЊРаЦРаЃРаЦРаЌ
731,­њІЏ,74459,­њІЏ,122DB,CUNEIFORM SIGN SI,РајРаі
732,­њІю,74460,­њІю,122DC,CUNEIFORM SIGN SI GUNU,РајРаі РаЏРаЦРаЮРаЦ
733,­њІЮ,74461,­њІЮ,122DD,CUNEIFORM SIGN SIG,РајРаіРаЏ
734,­њІъ,74462,­њІъ,122DE,CUNEIFORM SIGN SIG4,РајРаіРаЏРа╝РаЎ
735,­њІЪ,74463,­њІЪ,122DF,CUNEIFORM SIGN SIG4 OVER SIG4 SHU2,РајРаіРаЏРа╝РаЎРаљРаїРајРаіРаЏРа╝РаЎ РајРаЊРаЦРа╝РаЃ
736,­њІа,74464,­њІа,122E0,CUNEIFORM SIGN SIK2,РајРаіРаЁРа╝РаЃ
737,­њІА,74465,­њІА,122E1,CUNEIFORM SIGN SILA3,РајРаіРаЄРаЂРа╝РаЅ
738,­њІб,74466,­њІб,122E2,CUNEIFORM SIGN SU,РајРаЦ
739,­њІБ,74467,­њІБ,122E3,CUNEIFORM SIGN SU OVER SU,РајРаЦРаљРаїРајРаЦ
740,­њІц,74468,­њІц,122E4,CUNEIFORM SIGN SUD,РајРаЦРаЎ
741,­њІЦ,74469,­њІЦ,122E5,CUNEIFORM SIGN SUD2,РајРаЦРаЎРа╝РаЃ
742,­њІд,74470,­њІд,122E6,CUNEIFORM SIGN SUHUR,РајРаЦРаЊРаЦРаЌ
743,­њІД,74471,­њІД,122E7,CUNEIFORM SIGN SUM,РајРаЦРаЇ
744,­њІе,74472,­њІе,122E8,CUNEIFORM SIGN SUMASH,РајРаЦРаЇРаЂРајРаЊ
745,­њІЕ,74473,­њІЕ,122E9,CUNEIFORM SIGN SUR,РајРаЦРаЌ
746,­њІф,74474,­њІф,122EA,CUNEIFORM SIGN SUR9,РајРаЦРаЌРа╝Раі
747,­њІФ,74475,­њІФ,122EB,CUNEIFORM SIGN TA,РаъРаЂ
748,­њІг,74476,­њІг,122EC,CUNEIFORM SIGN TA ASTERISK,РаъРаЂРаљРад
749,­њІГ,74477,­њІГ,122ED,CUNEIFORM SIGN TA TIMES HI,РаъРаЂРаљРадРаЊРаі
750,­њІ«,74478,­њІ«,122EE,CUNEIFORM SIGN TA TIMES MI,РаъРаЂРаљРадРаЇРаі
751,­њІ»,74479,­њІ»,122EF,CUNEIFORM SIGN TA GUNU,РаъРаЂ РаЏРаЦРаЮРаЦ
752,­њІ░,74480,­њІ░,122F0,CUNEIFORM SIGN TAB,РаъРаЂРаЃ
753,­њІ▒,74481,­њІ▒,122F1,CUNEIFORM SIGN TAB OVER TAB NI OVER NI DISH OVER DISH,РаъРаЂРаЃРаљРаїРаъРаЂРаЃ РаЮРаіРаљРаїРаЮРаі РаЎРаіРајРаЊРаљРаїРаЎРаіРајРаЊ
754,­њІ▓,74482,­њІ▓,122F2,CUNEIFORM SIGN TAB SQUARED,РаъРаЂРаЃРаћРа╝РаЃ
755,­њІ│,74483,­њІ│,122F3,CUNEIFORM SIGN TAG,РаъРаЂРаЏ
756,­њІ┤,74484,­њІ┤,122F4,CUNEIFORM SIGN TAG TIMES BI,РаъРаЂРаЏРаљРадРаЃРаі
757,­њІх,74485,­њІх,122F5,CUNEIFORM SIGN TAG TIMES GUD,РаъРаЂРаЏРаљРадРаЏРаЦРаЎ
758,­њІХ,74486,­њІХ,122F6,CUNEIFORM SIGN TAG TIMES SHE,РаъРаЂРаЏРаљРадРајРаЊРаЉ
759,­њІи,74487,­њІи,122F7,CUNEIFORM SIGN TAG TIMES SHU,РаъРаЂРаЏРаљРадРајРаЊРаЦ
760,­њІИ,74488,­њІИ,122F8,CUNEIFORM SIGN TAG TIMES TUG2,РаъРаЂРаЏРаљРадРаъРаЦРаЏРа╝РаЃ
761,­њІ╣,74489,­њІ╣,122F9,CUNEIFORM SIGN TAG TIMES UD,РаъРаЂРаЏРаљРадРаЦРаЎ
762,­њІ║,74490,­њІ║,122FA,CUNEIFORM SIGN TAK4,РаъРаЂРаЁРа╝РаЎ
763,­њІ╗,74491,­њІ╗,122FB,CUNEIFORM SIGN TAR,РаъРаЂРаЌ
764,­њІ╝,74492,­њІ╝,122FC,CUNEIFORM SIGN TE,РаъРаЉ
765,­њІй,74493,­њІй,122FD,CUNEIFORM SIGN TE GUNU,РаъРаЉ РаЏРаЦРаЮРаЦ
766,­њІЙ,74494,­њІЙ,122FE,CUNEIFORM SIGN TI,РаъРаі
767,­њІ┐,74495,­њІ┐,122FF,CUNEIFORM SIGN TI TENU,РаъРаі РаъРаЉРаЮРаЦ
768,­њїђ,74496,­њїђ,12300,CUNEIFORM SIGN TIL,РаъРаіРаЄ
769,­њїЂ,74497,­њїЂ,12301,CUNEIFORM SIGN TIR,РаъРаіРаЌ
770,­њїѓ,74498,­њїѓ,12302,CUNEIFORM SIGN TIR TIMES TAK4,РаъРаіРаЌРаљРадРаъРаЂРаЁРа╝РаЎ
771,­њїЃ,74499,­њїЃ,12303,CUNEIFORM SIGN TIR OVER TIR,РаъРаіРаЌРаљРаїРаъРаіРаЌ
772,­њїё,74500,­њїё,12304,CUNEIFORM SIGN TIR OVER TIR GAD OVER GAD GAR OVER GAR,РаъРаіРаЌРаљРаїРаъРаіРаЌ РаЏРаЂРаЎРаљРаїРаЏРаЂРаЎ РаЏРаЂРаЌРаљРаїРаЏРаЂРаЌ
773,­њїЁ,74501,­њїЁ,12305,CUNEIFORM SIGN TU,РаъРаЦ
774,­њїє,74502,­њїє,12306,CUNEIFORM SIGN TUG2,РаъРаЦРаЏРа╝РаЃ
775,­њїЄ,74503,­њїЄ,12307,CUNEIFORM SIGN TUK,РаъРаЦРаЁ
776,­њїѕ,74504,­њїѕ,12308,CUNEIFORM SIGN TUM,РаъРаЦРаЇ
777,­њїЅ,74505,­њїЅ,12309,CUNEIFORM SIGN TUR,РаъРаЦРаЌ
778,­њїі,74506,­њїі,1230A,CUNEIFORM SIGN TUR OVER TUR ZA OVER ZA,РаъРаЦРаЌРаљРаїРаъРаЦРаЌ РахРаЂРаљРаїРахРаЂ
779,­њїІ,74507,­њїІ,1230B,CUNEIFORM SIGN U,РаЦ
780,­њїї,74508,­њїї,1230C,CUNEIFORM SIGN U GUD,РаЦ РаЏРаЦРаЎ
781,­њїЇ,74509,­њїЇ,1230D,CUNEIFORM SIGN U U U,РаЦ РаЦ РаЦ
782,­њїј,74510,­њїј,1230E,CUNEIFORM SIGN U OVER U PA OVER PA GAR OVER GAR,РаЦРаљРаїРаЦ РаЈРаЂРаљРаїРаЈРаЂ РаЏРаЂРаЌРаљРаїРаЏРаЂРаЌ
783,­њїЈ,74511,­њїЈ,1230F,CUNEIFORM SIGN U OVER U SUR OVER SUR,РаЦРаљРаїРаЦ РајРаЦРаЌРаљРаїРајРаЦРаЌ
784,­њїљ,74512,­њїљ,12310,CUNEIFORM SIGN U OVER U U REVERSED OVER U REVERSED,РаЦРаљРаїРаЦ РаЦРаѕРа»РаѕРаБРаљРаїРаЦРаѕРа»РаѕРаБ
785,­њїЉ,74513,­њїЉ,12311,CUNEIFORM SIGN U2,РаЦРа╝РаЃ
786,­њїњ,74514,­њїњ,12312,CUNEIFORM SIGN UB,РаЦРаЃ
787,­њїЊ,74515,­њїЊ,12313,CUNEIFORM SIGN UD,РаЦРаЎ
788,­њїћ,74516,­њїћ,12314,CUNEIFORM SIGN UD KUSHU2,РаЦРаЎ РаЁРаЦРајРаЊРаЦРа╝РаЃ
789,­њїЋ,74517,­њїЋ,12315,CUNEIFORM SIGN UD TIMES BAD,РаЦРаЎРаљРадРаЃРаЂРаЎ
790,­њїќ,74518,­њїќ,12316,CUNEIFORM SIGN UD TIMES MI,РаЦРаЎРаљРадРаЇРаі
791,­њїЌ,74519,­њїЌ,12317,CUNEIFORM SIGN UD TIMES U PLUS U PLUS U,РаЦРаЎРаљРадРаЦРаљРаќРаЦРаљРаќРаЦ
792,­њїў,74520,­њїў,12318,CUNEIFORM SIGN UD TIMES U PLUS U PLUS U GUNU,РаЦРаЎРаљРадРаЦРаљРаќРаЦРаљРаќРаЦ РаЏРаЦРаЮРаЦ
793,­њїЎ,74521,­њїЎ,12319,CUNEIFORM SIGN UD GUNU,РаЦРаЎ РаЏРаЦРаЮРаЦ
794,­њїџ,74522,­њїџ,1231A,CUNEIFORM SIGN UD SHESHIG,РаЦРаЎ РајРаЊРаЉРајРаЊРаіРаЏ
795,­њїЏ,74523,­њїЏ,1231B,CUNEIFORM SIGN UD SHESHIG TIMES BAD,РаЦРаЎ РајРаЊРаЉРајРаЊРаіРаЏРаљРадРаЃРаЂРаЎ
796,­њїю,74524,­њїю,1231C,CUNEIFORM SIGN UDUG,РаЦРаЎРаЦРаЏ
797,­њїЮ,74525,­њїЮ,1231D,CUNEIFORM SIGN UM,РаЦРаЇ
798,­њїъ,74526,­њїъ,1231E,CUNEIFORM SIGN UM TIMES LAGAB,РаЦРаЇРаљРадРаЄРаЂРаЏРаЂРаЃ
799,­њїЪ,74527,­њїЪ,1231F,CUNEIFORM SIGN UM TIMES ME PLUS DA,РаЦРаЇРаљРадРаЇРаЉРаљРаќРаЎРаЂ
800,­њїа,74528,­њїа,12320,CUNEIFORM SIGN UM TIMES SHA3,РаЦРаЇРаљРадРајРаЊРаЂРа╝РаЅ
801,­њїА,74529,­њїА,12321,CUNEIFORM SIGN UM TIMES U,РаЦРаЇРаљРадРаЦ
802,­њїб,74530,­њїб,12322,CUNEIFORM SIGN UMBIN,РаЦРаЇРаЃРаіРаЮ
803,­њїБ,74531,­њїБ,12323,CUNEIFORM SIGN UMUM,РаЦРаЇРаЦРаЇ
804,­њїц,74532,­њїц,12324,CUNEIFORM SIGN UMUM TIMES KASKAL,РаЦРаЇРаЦРаЇРаљРадРаЁРаЂРајРаЁРаЂРаЄ
805,­њїЦ,74533,­њїЦ,12325,CUNEIFORM SIGN UMUM TIMES PA,РаЦРаЇРаЦРаЇРаљРадРаЈРаЂ
806,­њїд,74534,­њїд,12326,CUNEIFORM SIGN UN,РаЦРаЮ
807,­њїД,74535,­њїД,12327,CUNEIFORM SIGN UN GUNU,РаЦРаЮ РаЏРаЦРаЮРаЦ
808,­њїе,74536,­њїе,12328,CUNEIFORM SIGN UR,РаЦРаЌ
809,­њїЕ,74537,­њїЕ,12329,CUNEIFORM SIGN UR CROSSING UR,РаЦРаЌРаѕРа»РаЦРаЌ
810,­њїф,74538,­њїф,1232A,CUNEIFORM SIGN UR SHESHIG,РаЦРаЌ РајРаЊРаЉРајРаЊРаіРаЏ
811,­њїФ,74539,­њїФ,1232B,CUNEIFORM SIGN UR2,РаЦРаЌРа╝РаЃ
812,­њїг,74540,­њїг,1232C,CUNEIFORM SIGN UR2 TIMES A PLUS HA,РаЦРаЌРа╝РаЃРаљРадРаЂРаљРаќРаЊРаЂ
813,­њїГ,74541,­њїГ,1232D,CUNEIFORM SIGN UR2 TIMES A PLUS NA,РаЦРаЌРа╝РаЃРаљРадРаЂРаљРаќРаЮРаЂ
814,­њї«,74542,­њї«,1232E,CUNEIFORM SIGN UR2 TIMES AL,РаЦРаЌРа╝РаЃРаљРадРаЂРаЄ
815,­њї»,74543,­њї»,1232F,CUNEIFORM SIGN UR2 TIMES HA,РаЦРаЌРа╝РаЃРаљРадРаЊРаЂ
816,­њї░,74544,­њї░,12330,CUNEIFORM SIGN UR2 TIMES NUN,РаЦРаЌРа╝РаЃРаљРадРаЮРаЦРаЮ
817,­њї▒,74545,­њї▒,12331,CUNEIFORM SIGN UR2 TIMES U2,РаЦРаЌРа╝РаЃРаљРадРаЦРа╝РаЃ
818,­њї▓,74546,­њї▓,12332,CUNEIFORM SIGN UR2 TIMES U2 PLUS ASH,РаЦРаЌРа╝РаЃРаљРадРаЦРа╝РаЃРаљРаќРаЂРајРаЊ
819,­њї│,74547,­њї│,12333,CUNEIFORM SIGN UR2 TIMES U2 PLUS BI,РаЦРаЌРа╝РаЃРаљРадРаЦРа╝РаЃРаљРаќРаЃРаі
820,­њї┤,74548,­њї┤,12334,CUNEIFORM SIGN UR4,РаЦРаЌРа╝РаЎ
821,­њїх,74549,­њїх,12335,CUNEIFORM SIGN URI,РаЦРаЌРаі
822,­њїХ,74550,­њїХ,12336,CUNEIFORM SIGN URI3,РаЦРаЌРаіРа╝РаЅ
823,­њїи,74551,­њїи,12337,CUNEIFORM SIGN URU,РаЦРаЌРаЦ
824,­њїИ,74552,­њїИ,12338,CUNEIFORM SIGN URU TIMES A,РаЦРаЌРаЦРаљРадРаЂ
825,­њї╣,74553,­њї╣,12339,CUNEIFORM SIGN URU TIMES ASHGAB,РаЦРаЌРаЦРаљРадРаЂРајРаЊРаЏРаЂРаЃ
826,­њї║,74554,­њї║,1233A,CUNEIFORM SIGN URU TIMES BAR,РаЦРаЌРаЦРаљРадРаЃРаЂРаЌ
827,­њї╗,74555,­њї╗,1233B,CUNEIFORM SIGN URU TIMES DUN,РаЦРаЌРаЦРаљРадРаЎРаЦРаЮ
828,­њї╝,74556,­њї╝,1233C,CUNEIFORM SIGN URU TIMES GA,РаЦРаЌРаЦРаљРадРаЏРаЂ
829,­њїй,74557,­њїй,1233D,CUNEIFORM SIGN URU TIMES GAL,РаЦРаЌРаЦРаљРадРаЏРаЂРаЄ
830,­њїЙ,74558,­њїЙ,1233E,CUNEIFORM SIGN URU TIMES GAN2 TENU,РаЦРаЌРаЦРаљРадРаЏРаЂРаЮРа╝РаЃ РаъРаЉРаЮРаЦ
831,­њї┐,74559,­њї┐,1233F,CUNEIFORM SIGN URU TIMES GAR,РаЦРаЌРаЦРаљРадРаЏРаЂРаЌ
832,­њЇђ,74560,­њЇђ,12340,CUNEIFORM SIGN URU TIMES GU,РаЦРаЌРаЦРаљРадРаЏРаЦ
833,­њЇЂ,74561,­њЇЂ,12341,CUNEIFORM SIGN URU TIMES HA,РаЦРаЌРаЦРаљРадРаЊРаЂ
834,­њЇѓ,74562,­њЇѓ,12342,CUNEIFORM SIGN URU TIMES IGI,РаЦРаЌРаЦРаљРадРаіРаЏРаі
835,­њЇЃ,74563,­њЇЃ,12343,CUNEIFORM SIGN URU TIMES IM,РаЦРаЌРаЦРаљРадРаіРаЇ
836,­њЇё,74564,­њЇё,12344,CUNEIFORM SIGN URU TIMES ISH,РаЦРаЌРаЦРаљРадРаіРајРаЊ
837,­њЇЁ,74565,­њЇЁ,12345,CUNEIFORM SIGN URU TIMES KI,РаЦРаЌРаЦРаљРадРаЁРаі
838,­њЇє,74566,­њЇє,12346,CUNEIFORM SIGN URU TIMES LUM,РаЦРаЌРаЦРаљРадРаЄРаЦРаЇ
839,­њЇЄ,74567,­њЇЄ,12347,CUNEIFORM SIGN URU TIMES MIN,РаЦРаЌРаЦРаљРадРаЇРаіРаЮ
840,­њЇѕ,74568,­њЇѕ,12348,CUNEIFORM SIGN URU TIMES PA,РаЦРаЌРаЦРаљРадРаЈРаЂ
841,­њЇЅ,74569,­њЇЅ,12349,CUNEIFORM SIGN URU TIMES SHE,РаЦРаЌРаЦРаљРадРајРаЊРаЉ
842,­њЇі,74570,­њЇі,1234A,CUNEIFORM SIGN URU TIMES SIG4,РаЦРаЌРаЦРаљРадРајРаіРаЏРа╝РаЎ
843,­њЇІ,74571,­њЇІ,1234B,CUNEIFORM SIGN URU TIMES TU,РаЦРаЌРаЦРаљРадРаъРаЦ
844,­њЇї,74572,­њЇї,1234C,CUNEIFORM SIGN URU TIMES U PLUS GUD,РаЦРаЌРаЦРаљРадРаЦРаљРаќРаЏРаЦРаЎ
845,­њЇЇ,74573,­њЇЇ,1234D,CUNEIFORM SIGN URU TIMES UD,РаЦРаЌРаЦРаљРадРаЦРаЎ
846,­њЇј,74574,­њЇј,1234E,CUNEIFORM SIGN URU TIMES URUDA,РаЦРаЌРаЦРаљРадРаЦРаЌРаЦРаЎРаЂ
847,­њЇЈ,74575,­њЇЈ,1234F,CUNEIFORM SIGN URUDA,РаЦРаЌРаЦРаЎРаЂ
848,­њЇљ,74576,­њЇљ,12350,CUNEIFORM SIGN URUDA TIMES U,РаЦРаЌРаЦРаЎРаЂРаљРадРаЦ
849,­њЇЉ,74577,­њЇЉ,12351,CUNEIFORM SIGN USH,РаЦРајРаЊ
850,­њЇњ,74578,­њЇњ,12352,CUNEIFORM SIGN USH TIMES A,РаЦРајРаЊРаљРадРаЂ
851,­њЇЊ,74579,­њЇЊ,12353,CUNEIFORM SIGN USH TIMES KU,РаЦРајРаЊРаљРадРаЁРаЦ
852,­њЇћ,74580,­њЇћ,12354,CUNEIFORM SIGN USH TIMES KUR,РаЦРајРаЊРаљРадРаЁРаЦРаЌ
853,­њЇЋ,74581,­њЇЋ,12355,CUNEIFORM SIGN USH TIMES TAK4,РаЦРајРаЊРаљРадРаъРаЂРаЁРа╝РаЎ
854,­њЇќ,74582,­њЇќ,12356,CUNEIFORM SIGN USHX,РаЦРајРаЊРаГ
855,­њЇЌ,74583,­њЇЌ,12357,CUNEIFORM SIGN USH2,РаЦРајРаЊРа╝РаЃ
856,­њЇў,74584,­њЇў,12358,CUNEIFORM SIGN USHUMX,РаЦРајРаЊРаЦРаЇРаГ
857,­њЇЎ,74585,­њЇЎ,12359,CUNEIFORM SIGN UTUKI,РаЦРаъРаЦРаЁРаі
858,­њЇџ,74586,­њЇџ,1235A,CUNEIFORM SIGN UZ3,РаЦРахРа╝РаЅ
859,­њЇЏ,74587,­њЇЏ,1235B,CUNEIFORM SIGN UZ3 TIMES KASKAL,РаЦРахРа╝РаЅРаљРадРаЁРаЂРајРаЁРаЂРаЄ
860,­њЇю,74588,­њЇю,1235C,CUNEIFORM SIGN UZU,РаЦРахРаЦ
861,­њЇЮ,74589,­њЇЮ,1235D,CUNEIFORM SIGN ZA,РахРаЂ
862,­њЇъ,74590,­њЇъ,1235E,CUNEIFORM SIGN ZA TENU,РахРаЂ РаъРаЉРаЮРаЦ
863,­њЇЪ,74591,­њЇЪ,1235F,CUNEIFORM SIGN ZA SQUARED TIMES KUR,РахРаЂРаћРа╝РаЃРаљРадРаЁРаЦРаЌ
864,­њЇа,74592,­њЇа,12360,CUNEIFORM SIGN ZAG,РахРаЂРаЏ
865,­њЇА,74593,­њЇА,12361,CUNEIFORM SIGN ZAMX,РахРаЂРаЇРаГ
866,­њЇб,74594,­њЇб,12362,CUNEIFORM SIGN ZE2,РахРаЉРа╝РаЃ
867,­њЇБ,74595,­њЇБ,12363,CUNEIFORM SIGN ZI,РахРаі
868,­њЇц,74596,­њЇц,12364,CUNEIFORM SIGN ZI OVER ZI,РахРаіРаљРаїРахРаі
869,­њЇЦ,74597,­њЇЦ,12365,CUNEIFORM SIGN ZI3,РахРаіРа╝РаЅ
870,­њЇд,74598,­њЇд,12366,CUNEIFORM SIGN ZIB,РахРаіРаЃ
871,­њЇД,74599,­њЇД,12367,CUNEIFORM SIGN ZIB KABA TENU,РахРаіРаЃ РаЁРаЂРаЃРаЂ РаъРаЉРаЮРаЦ
872,­њЇе,74600,­њЇе,12368,CUNEIFORM SIGN ZIG,РахРаіРаЏ
873,­њЇЕ,74601,­њЇЕ,12369,CUNEIFORM SIGN ZIZ2,РахРаіРахРа╝РаЃ
874,­њЇф,74602,­њЇф,1236A,CUNEIFORM SIGN ZU,РахРаЦ
875,­њЇФ,74603,­њЇФ,1236B,CUNEIFORM SIGN ZU5,РахРаЦРа╝РаЉ
876,­њЇг,74604,­њЇг,1236C,CUNEIFORM SIGN ZU5 TIMES A,РахРаЦРа╝РаЉРаљРадРаЂ
877,­њЇГ,74605,­њЇГ,1236D,CUNEIFORM SIGN ZUBUR,РахРаЦРаЃРаЦРаЌ
878,­њЇ«,74606,­њЇ«,1236E,CUNEIFORM SIGN ZUM,РахРаЦРаЇ
879,­њЇ»,74607,­њЇ»,1236F,CUNEIFORM SIGN KAP ELAMITE,РаЁРаЂРаЈ РаЉРаЄРаЂРаЇРаіРаъРаЉ
880,­њЇ░,74608,­њЇ░,12370,CUNEIFORM SIGN AB TIMES NUN,РаЂРаЃРаљРадРаЮРаЦРаЮ
881,­њЇ▒,74609,­њЇ▒,12371,CUNEIFORM SIGN AB2 TIMES A,РаЂРаЃРа╝РаЃРаљРадРаЂ
882,­њЇ▓,74610,­њЇ▓,12372,CUNEIFORM SIGN AMAR TIMES KUG,РаЂРаЇРаЂРаЌРаљРадРаЁРаЦРаЏ
883,­њЇ│,74611,­њЇ│,12373,CUNEIFORM SIGN DAG KISIM5 TIMES U2 PLUS MASH,РаЎРаЂРаЏ РаЁРаіРајРаіРаЇРа╝РаЉРаљРадРаЦРа╝РаЃРаљРаќРаЇРаЂРајРаЊ
884,­њЇ┤,74612,­њЇ┤,12374,CUNEIFORM SIGN DAG3,РаЎРаЂРаЏРа╝РаЅ
885,­њЇх,74613,­њЇх,12375,CUNEIFORM SIGN DISH PLUS SHU,РаЎРаіРајРаЊРаљРаќРајРаЊРаЦ
886,­њЇХ,74614,­њЇХ,12376,CUNEIFORM SIGN DUB TIMES SHE,РаЎРаЦРаЃРаљРадРајРаЊРаЉ
887,­њЇи,74615,­њЇи,12377,CUNEIFORM SIGN EZEN TIMES GUD,РаЉРахРаЉРаЮРаљРадРаЏРаЦРаЎ
888,­њЇИ,74616,­њЇИ,12378,CUNEIFORM SIGN EZEN TIMES SHE,РаЉРахРаЉРаЮРаљРадРајРаЊРаЉ
889,­њЇ╣,74617,­њЇ╣,12379,CUNEIFORM SIGN GA2 TIMES AN PLUS KAK PLUS A,РаЏРаЂРа╝РаЃРаљРадРаЂРаЮРаљРаќРаЁРаЂРаЁРаљРаќРаЂ
890,­њЇ║,74618,­њЇ║,1237A,CUNEIFORM SIGN GA2 TIMES ASH2,РаЏРаЂРа╝РаЃРаљРадРаЂРајРаЊРа╝РаЃ
891,­њЇ╗,74619,­њЇ╗,1237B,CUNEIFORM SIGN GE22,РаЏРаЉРа╝РаЃРа╝РаЃ
892,­њЇ╝,74620,­њЇ╝,1237C,CUNEIFORM SIGN GIG,РаЏРаіРаЏ
893,­њЇй,74621,­њЇй,1237D,CUNEIFORM SIGN HUSH,РаЊРаЦРајРаЊ
894,­њЇЙ,74622,­њЇЙ,1237E,CUNEIFORM SIGN KA TIMES ANSHE,РаЁРаЂРаљРадРаЂРаЮРајРаЊРаЉ
895,­њЇ┐,74623,­њЇ┐,1237F,CUNEIFORM SIGN KA TIMES ASH3,РаЁРаЂРаљРадРаЂРајРаЊРа╝РаЅ
896,­њјђ,74624,­њјђ,12380,CUNEIFORM SIGN KA TIMES GISH,РаЁРаЂРаљРадРаЏРаіРајРаЊ
897,­њјЂ,74625,­њјЂ,12381,CUNEIFORM SIGN KA TIMES GUD,РаЁРаЂРаљРадРаЏРаЦРаЎ
898,­њјѓ,74626,­њјѓ,12382,CUNEIFORM SIGN KA TIMES HI TIMES ASH2,РаЁРаЂРаљРадРаЊРаіРаљРадРаЂРајРаЊРа╝РаЃ
899,­њјЃ,74627,­њјЃ,12383,CUNEIFORM SIGN KA TIMES LUM,РаЁРаЂРаљРадРаЄРаЦРаЇ
900,­њјё,74628,­њјё,12384,CUNEIFORM SIGN KA TIMES PA,РаЁРаЂРаљРадРаЈРаЂ
901,­њјЁ,74629,­њјЁ,12385,CUNEIFORM SIGN KA TIMES SHUL,РаЁРаЂРаљРадРајРаЊРаЦРаЄ
902,­њјє,74630,­њјє,12386,CUNEIFORM SIGN KA TIMES TU,РаЁРаЂРаљРадРаъРаЦ
903,­њјЄ,74631,­њјЄ,12387,CUNEIFORM SIGN KA TIMES UR2,РаЁРаЂРаљРадРаЦРаЌРа╝РаЃ
904,­њјѕ,74632,­њјѕ,12388,CUNEIFORM SIGN LAGAB TIMES GI,РаЄРаЂРаЏРаЂРаЃРаљРадРаЏРаі
905,­њјЅ,74633,­њјЅ,12389,CUNEIFORM SIGN LU2 SHESHIG TIMES BAD,РаЄРаЦРа╝РаЃ РајРаЊРаЉРајРаЊРаіРаЏРаљРадРаЃРаЂРаЎ
906,­њјі,74634,­њјі,1238A,CUNEIFORM SIGN LU2 TIMES ESH2 PLUS LAL,РаЄРаЦРа╝РаЃРаљРадРаЉРајРаЊРа╝РаЃРаљРаќРаЄРаЂРаЄ
907,­њјІ,74635,­њјІ,1238B,CUNEIFORM SIGN LU2 TIMES SHU,РаЄРаЦРа╝РаЃРаљРадРајРаЊРаЦ
908,­њјї,74636,­њјї,1238C,CUNEIFORM SIGN MESH,РаЇРаЉРајРаЊ
909,­њјЇ,74637,­њјЇ,1238D,CUNEIFORM SIGN MUSH3 TIMES ZA,РаЇРаЦРајРаЊРа╝РаЅРаљРадРахРаЂ
910,­њјј,74638,­њјј,1238E,CUNEIFORM SIGN NA4,РаЮРаЂРа╝РаЎ
911,­њјЈ,74639,­њјЈ,1238F,CUNEIFORM SIGN NIN,РаЮРаіРаЮ
912,­њјљ,74640,­њјљ,12390,CUNEIFORM SIGN NIN9,РаЮРаіРаЮРа╝Раі
