,Character(decimal),Decimal,Character(hex),Hex,Name,Braille
455,­њЄЄ,74183,­њЄЄ,121C7,CUNEIFORM SIGN LAGAB TIMES GUD PLUS GUD,РаЄРаЂРаЏРаЂРаЃРаљРадРаЏРаЦРаЎРаљРаќРаЏРаЦРаЎ
456,­њЄѕ,74184,­њЄѕ,121C8,CUNEIFORM SIGN LAGAB TIMES HA,РаЄРаЂРаЏРаЂРаЃРаљРадРаЊРаЂ
457,­њЄЅ,74185,­њЄЅ,121C9,CUNEIFORM SIGN LAGAB TIMES HAL,РаЄРаЂРаЏРаЂРаЃРаљРадРаЊРаЂРаЄ
458,­њЄі,74186,­њЄі,121CA,CUNEIFORM SIGN LAGAB TIMES HI TIMES NUN,РаЄРаЂРаЏРаЂРаЃРаљРадРаЊРаіРаљРадРаЮРаЦРаЮ
459,­њЄІ,74187,­њЄІ,121CB,CUNEIFORM SIGN LAGAB TIMES IGI GUNU,РаЄРаЂРаЏРаЂРаЃРаљРадРаіРаЏРаі РаЏРаЦРаЮРаЦ
460,­њЄї,74188,­њЄї,121CC,CUNEIFORM SIGN LAGAB TIMES IM,РаЄРаЂРаЏРаЂРаЃРаљРадРаіРаЇ
461,­њЄЇ,74189,­њЄЇ,121CD,CUNEIFORM SIGN LAGAB TIMES IM PLUS HA,РаЄРаЂРаЏРаЂРаЃРаљРадРаіРаЇРаљРаќРаЊРаЂ
462,­њЄј,74190,­њЄј,121CE,CUNEIFORM SIGN LAGAB TIMES IM PLUS LU,РаЄРаЂРаЏРаЂРаЃРаљРадРаіРаЇРаљРаќРаЄРаЦ
463,­њЄЈ,74191,­њЄЈ,121CF,CUNEIFORM SIGN LAGAB TIMES KI,РаЄРаЂРаЏРаЂРаЃРаљРадРаЁРаі
464,­њЄљ,74192,­њЄљ,121D0,CUNEIFORM SIGN LAGAB TIMES KIN,РаЄРаЂРаЏРаЂРаЃРаљРадРаЁРаіРаЮ
465,­њЄЉ,74193,­њЄЉ,121D1,CUNEIFORM SIGN LAGAB TIMES KU3,РаЄРаЂРаЏРаЂРаЃРаљРадРаЁРаЦРа╝РаЅ
466,­њЄњ,74194,­њЄњ,121D2,CUNEIFORM SIGN LAGAB TIMES KUL,РаЄРаЂРаЏРаЂРаЃРаљРадРаЁРаЦРаЄ
467,­њЄЊ,74195,­њЄЊ,121D3,CUNEIFORM SIGN LAGAB TIMES KUL PLUS HI PLUS A,РаЄРаЂРаЏРаЂРаЃРаљРадРаЁРаЦРаЄРаљРаќРаЊРаіРаљРаќРаЂ
468,­њЄћ,74196,­њЄћ,121D4,CUNEIFORM SIGN LAGAB TIMES LAGAB,РаЄРаЂРаЏРаЂРаЃРаљРадРаЄРаЂРаЏРаЂРаЃ
469,­њЄЋ,74197,­њЄЋ,121D5,CUNEIFORM SIGN LAGAB TIMES LISH,РаЄРаЂРаЏРаЂРаЃРаљРадРаЄРаіРајРаЊ
470,­њЄќ,74198,­њЄќ,121D6,CUNEIFORM SIGN LAGAB TIMES LU,РаЄРаЂРаЏРаЂРаЃРаљРадРаЄРаЦ
471,­њЄЌ,74199,­њЄЌ,121D7,CUNEIFORM SIGN LAGAB TIMES LUL,РаЄРаЂРаЏРаЂРаЃРаљРадРаЄРаЦРаЄ
472,­њЄў,74200,­њЄў,121D8,CUNEIFORM SIGN LAGAB TIMES ME,РаЄРаЂРаЏРаЂРаЃРаљРадРаЇРаЉ
473,­њЄЎ,74201,­њЄЎ,121D9,CUNEIFORM SIGN LAGAB TIMES ME PLUS EN,РаЄРаЂРаЏРаЂРаЃРаљРадРаЇРаЉРаљРаќРаЉРаЮ
474,­њЄџ,74202,­њЄџ,121DA,CUNEIFORM SIGN LAGAB TIMES MUSH,РаЄРаЂРаЏРаЂРаЃРаљРадРаЇРаЦРајРаЊ
475,­њЄЏ,74203,­њЄЏ,121DB,CUNEIFORM SIGN LAGAB TIMES NE,РаЄРаЂРаЏРаЂРаЃРаљРадРаЮРаЉ
476,­њЄю,74204,­њЄю,121DC,CUNEIFORM SIGN LAGAB TIMES SHE PLUS SUM,РаЄРаЂРаЏРаЂРаЃРаљРадРајРаЊРаЉРаљРаќРајРаЦРаЇ
477,­њЄЮ,74205,­њЄЮ,121DD,CUNEIFORM SIGN LAGAB TIMES SHITA PLUS GISH PLUS ERIN2,РаЄРаЂРаЏРаЂРаЃРаљРадРајРаЊРаіРаъРаЂРаљРаќРаЏРаіРајРаЊРаљРаќРаЉРаЌРаіРаЮРа╝РаЃ
478,­њЄъ,74206,­њЄъ,121DE,CUNEIFORM SIGN LAGAB TIMES SHITA PLUS GISH TENU,РаЄРаЂРаЏРаЂРаЃРаљРадРајРаЊРаіРаъРаЂРаљРаќРаЏРаіРајРаЊ РаъРаЉРаЮРаЦ
479,­њЄЪ,74207,­њЄЪ,121DF,CUNEIFORM SIGN LAGAB TIMES SHU2,РаЄРаЂРаЏРаЂРаЃРаљРадРајРаЊРаЦРа╝РаЃ
480,­њЄа,74208,­њЄа,121E0,CUNEIFORM SIGN LAGAB TIMES SHU2 PLUS SHU2,РаЄРаЂРаЏРаЂРаЃРаљРадРајРаЊРаЦРа╝РаЃРаљРаќРајРаЊРаЦРа╝РаЃ
481,­њЄА,74209,­њЄА,121E1,CUNEIFORM SIGN LAGAB TIMES SUM,РаЄРаЂРаЏРаЂРаЃРаљРадРајРаЦРаЇ
482,­њЄб,74210,­њЄб,121E2,CUNEIFORM SIGN LAGAB TIMES TAG,РаЄРаЂРаЏРаЂРаЃРаљРадРаъРаЂРаЏ
483,­њЄБ,74211,­њЄБ,121E3,CUNEIFORM SIGN LAGAB TIMES TAK4,РаЄРаЂРаЏРаЂРаЃРаљРадРаъРаЂРаЁРа╝РаЎ
484,­њЄц,74212,­њЄц,121E4,CUNEIFORM SIGN LAGAB TIMES TE PLUS A PLUS SU PLUS NA,РаЄРаЂРаЏРаЂРаЃРаљРадРаъРаЉРаљРаќРаЂРаљРаќРајРаЦРаљРаќРаЮРаЂ
485,­њЄЦ,74213,­њЄЦ,121E5,CUNEIFORM SIGN LAGAB TIMES U,РаЄРаЂРаЏРаЂРаЃРаљРадРаЦ
486,­њЄд,74214,­њЄд,121E6,CUNEIFORM SIGN LAGAB TIMES U PLUS A,РаЄРаЂРаЏРаЂРаЃРаљРадРаЦРаљРаќРаЂ
487,­њЄД,74215,­њЄД,121E7,CUNEIFORM SIGN LAGAB TIMES U PLUS U PLUS U,РаЄРаЂРаЏРаЂРаЃРаљРадРаЦРаљРаќРаЦРаљРаќРаЦ
488,­њЄе,74216,­њЄе,121E8,CUNEIFORM SIGN LAGAB TIMES U2 PLUS ASH,РаЄРаЂРаЏРаЂРаЃРаљРадРаЦРа╝РаЃРаљРаќРаЂРајРаЊ
489,­њЄЕ,74217,­њЄЕ,121E9,CUNEIFORM SIGN LAGAB TIMES UD,РаЄРаЂРаЏРаЂРаЃРаљРадРаЦРаЎ
490,­њЄф,74218,­њЄф,121EA,CUNEIFORM SIGN LAGAB TIMES USH,РаЄРаЂРаЏРаЂРаЃРаљРадРаЦРајРаЊ
491,­њЄФ,74219,­њЄФ,121EB,CUNEIFORM SIGN LAGAB SQUARED,РаЄРаЂРаЏРаЂРаЃРаћРа╝РаЃ
492,­њЄг,74220,­њЄг,121EC,CUNEIFORM SIGN LAGAR,РаЄРаЂРаЏРаЂРаЌ
493,­њЄГ,74221,­њЄГ,121ED,CUNEIFORM SIGN LAGAR TIMES SHE,РаЄРаЂРаЏРаЂРаЌРаљРадРајРаЊРаЉ
494,­њЄ«,74222,­њЄ«,121EE,CUNEIFORM SIGN LAGAR TIMES SHE PLUS SUM,РаЄРаЂРаЏРаЂРаЌРаљРадРајРаЊРаЉРаљРаќРајРаЦРаЇ
495,­њЄ»,74223,­њЄ»,121EF,CUNEIFORM SIGN LAGAR GUNU,РаЄРаЂРаЏРаЂРаЌ РаЏРаЦРаЮРаЦ
496,­њЄ░,74224,­њЄ░,121F0,CUNEIFORM SIGN LAGAR GUNU OVER LAGAR GUNU SHE,РаЄРаЂРаЏРаЂРаЌ РаЏРаЦРаЮРаЦРаљРаїРаЄРаЂРаЏРаЂРаЌ РаЏРаЦРаЮРаЦ РајРаЊРаЉ
497,­њЄ▒,74225,­њЄ▒,121F1,CUNEIFORM SIGN LAHSHU,РаЄРаЂРаЊРајРаЊРаЦ
498,­њЄ▓,74226,­њЄ▓,121F2,CUNEIFORM SIGN LAL,РаЄРаЂРаЄ
499,­њЄ│,74227,­њЄ│,121F3,CUNEIFORM SIGN LAL TIMES LAL,РаЄРаЂРаЄРаљРадРаЄРаЂРаЄ
500,­њЄ┤,74228,­њЄ┤,121F4,CUNEIFORM SIGN LAM,РаЄРаЂРаЇ
501,­њЄх,74229,­њЄх,121F5,CUNEIFORM SIGN LAM TIMES KUR,РаЄРаЂРаЇРаљРадРаЁРаЦРаЌ
502,­њЄХ,74230,­њЄХ,121F6,CUNEIFORM SIGN LAM TIMES KUR PLUS RU,РаЄРаЂРаЇРаљРадРаЁРаЦРаЌРаљРаќРаЌРаЦ
503,­њЄи,74231,­њЄи,121F7,CUNEIFORM SIGN LI,РаЄРаі
504,­њЄИ,74232,­њЄИ,121F8,CUNEIFORM SIGN LIL,РаЄРаіРаЄ
505,­њЄ╣,74233,­њЄ╣,121F9,CUNEIFORM SIGN LIMMU2,РаЄРаіРаЇРаЇРаЦРа╝РаЃ
506,­њЄ║,74234,­њЄ║,121FA,CUNEIFORM SIGN LISH,РаЄРаіРајРаЊ
507,­њЄ╗,74235,­њЄ╗,121FB,CUNEIFORM SIGN LU,РаЄРаЦ
508,­њЄ╝,74236,­њЄ╝,121FC,CUNEIFORM SIGN LU TIMES BAD,РаЄРаЦРаљРадРаЃРаЂРаЎ
509,­њЄй,74237,­њЄй,121FD,CUNEIFORM SIGN LU2,РаЄРаЦРа╝РаЃ
510,­њЄЙ,74238,­њЄЙ,121FE,CUNEIFORM SIGN LU2 TIMES AL,РаЄРаЦРа╝РаЃРаљРадРаЂРаЄ
511,­њЄ┐,74239,­њЄ┐,121FF,CUNEIFORM SIGN LU2 TIMES BAD,РаЄРаЦРа╝РаЃРаљРадРаЃРаЂРаЎ
512,­њѕђ,74240,­њѕђ,12200,CUNEIFORM SIGN LU2 TIMES ESH2,РаЄРаЦРа╝РаЃРаљРадРаЉРајРаЊРа╝РаЃ
513,­њѕЂ,74241,­њѕЂ,12201,CUNEIFORM SIGN LU2 TIMES ESH2 TENU,РаЄРаЦРа╝РаЃРаљРадРаЉРајРаЊРа╝РаЃ РаъРаЉРаЮРаЦ
514,­њѕѓ,74242,­њѕѓ,12202,CUNEIFORM SIGN LU2 TIMES GAN2 TENU,РаЄРаЦРа╝РаЃРаљРадРаЏРаЂРаЮРа╝РаЃ РаъРаЉРаЮРаЦ
515,­њѕЃ,74243,­њѕЃ,12203,CUNEIFORM SIGN LU2 TIMES HI TIMES BAD,РаЄРаЦРа╝РаЃРаљРадРаЊРаіРаљРадРаЃРаЂРаЎ
516,­њѕё,74244,­њѕё,12204,CUNEIFORM SIGN LU2 TIMES IM,РаЄРаЦРа╝РаЃРаљРадРаіРаЇ
517,­њѕЁ,74245,­њѕЁ,12205,CUNEIFORM SIGN LU2 TIMES KAD2,РаЄРаЦРа╝РаЃРаљРадРаЁРаЂРаЎРа╝РаЃ
518,­њѕє,74246,­њѕє,12206,CUNEIFORM SIGN LU2 TIMES KAD3,РаЄРаЦРа╝РаЃРаљРадРаЁРаЂРаЎРа╝РаЅ
519,­њѕЄ,74247,­њѕЄ,12207,CUNEIFORM SIGN LU2 TIMES KAD3 PLUS ASH,РаЄРаЦРа╝РаЃРаљРадРаЁРаЂРаЎРа╝РаЅРаљРаќРаЂРајРаЊ
520,­њѕѕ,74248,­њѕѕ,12208,CUNEIFORM SIGN LU2 TIMES KI,РаЄРаЦРа╝РаЃРаљРадРаЁРаі
521,­њѕЅ,74249,­њѕЅ,12209,CUNEIFORM SIGN LU2 TIMES LA PLUS ASH,РаЄРаЦРа╝РаЃРаљРадРаЄРаЂРаљРаќРаЂРајРаЊ
522,­њѕі,74250,­њѕі,1220A,CUNEIFORM SIGN LU2 TIMES LAGAB,РаЄРаЦРа╝РаЃРаљРадРаЄРаЂРаЏРаЂРаЃ
523,­њѕІ,74251,­њѕІ,1220B,CUNEIFORM SIGN LU2 TIMES ME PLUS EN,РаЄРаЦРа╝РаЃРаљРадРаЇРаЉРаљРаќРаЉРаЮ
524,­њѕї,74252,­њѕї,1220C,CUNEIFORM SIGN LU2 TIMES NE,РаЄРаЦРа╝РаЃРаљРадРаЮРаЉ
525,­њѕЇ,74253,­њѕЇ,1220D,CUNEIFORM SIGN LU2 TIMES NU,РаЄРаЦРа╝РаЃРаљРадРаЮРаЦ
526,­њѕј,74254,­њѕј,1220E,CUNEIFORM SIGN LU2 TIMES SI PLUS ASH,РаЄРаЦРа╝РаЃРаљРадРајРаіРаљРаќРаЂРајРаЊ
527,­њѕЈ,74255,­њѕЈ,1220F,CUNEIFORM SIGN LU2 TIMES SIK2 PLUS BU,РаЄРаЦРа╝РаЃРаљРадРајРаіРаЁРа╝РаЃРаљРаќРаЃРаЦ
528,­њѕљ,74256,­њѕљ,12210,CUNEIFORM SIGN LU2 TIMES TUG2,РаЄРаЦРа╝РаЃРаљРадРаъРаЦРаЏРа╝РаЃ
529,­њѕЉ,74257,­њѕЉ,12211,CUNEIFORM SIGN LU2 TENU,РаЄРаЦРа╝РаЃ РаъРаЉРаЮРаЦ
530,­њѕњ,74258,­њѕњ,12212,CUNEIFORM SIGN LU2 CROSSING LU2,РаЄРаЦРа╝РаЃРаѕРа»РаЄРаЦРа╝РаЃ
531,­њѕЊ,74259,­њѕЊ,12213,CUNEIFORM SIGN LU2 OPPOSING LU2,РаЄРаЦРа╝РаЃРаѕРајРаЄРаЦРа╝РаЃ
532,­њѕћ,74260,­њѕћ,12214,CUNEIFORM SIGN LU2 SQUARED,РаЄРаЦРа╝РаЃРаћРа╝РаЃ
533,­њѕЋ,74261,­њѕЋ,12215,CUNEIFORM SIGN LU2 SHESHIG,РаЄРаЦРа╝РаЃ РајРаЊРаЉРајРаЊРаіРаЏ
534,­њѕќ,74262,­њѕќ,12216,CUNEIFORM SIGN LU3,РаЄРаЦРа╝РаЅ
535,­њѕЌ,74263,­њѕЌ,12217,CUNEIFORM SIGN LUGAL,РаЄРаЦРаЏРаЂРаЄ
536,­њѕў,74264,­њѕў,12218,CUNEIFORM SIGN LUGAL OVER LUGAL,РаЄРаЦРаЏРаЂРаЄРаљРаїРаЄРаЦРаЏРаЂРаЄ
537,­њѕЎ,74265,­њѕЎ,12219,CUNEIFORM SIGN LUGAL OPPOSING LUGAL,РаЄРаЦРаЏРаЂРаЄРаѕРајРаЄРаЦРаЏРаЂРаЄ
538,­њѕџ,74266,­њѕџ,1221A,CUNEIFORM SIGN LUGAL SHESHIG,РаЄРаЦРаЏРаЂРаЄ РајРаЊРаЉРајРаЊРаіРаЏ
539,­њѕЏ,74267,­њѕЏ,1221B,CUNEIFORM SIGN LUH,РаЄРаЦРаЊ
540,­њѕю,74268,­њѕю,1221C,CUNEIFORM SIGN LUL,РаЄРаЦРаЄ
541,­њѕЮ,74269,­њѕЮ,1221D,CUNEIFORM SIGN LUM,РаЄРаЦРаЇ
542,­њѕъ,74270,­њѕъ,1221E,CUNEIFORM SIGN LUM OVER LUM,РаЄРаЦРаЇРаљРаїРаЄРаЦРаЇ
543,­њѕЪ,74271,­њѕЪ,1221F,CUNEIFORM SIGN LUM OVER LUM GAR OVER GAR,РаЄРаЦРаЇРаљРаїРаЄРаЦРаЇ РаЏРаЂРаЌРаљРаїРаЏРаЂРаЌ
544,­њѕа,74272,­њѕа,12220,CUNEIFORM SIGN MA,РаЇРаЂ
545,­њѕА,74273,­њѕА,12221,CUNEIFORM SIGN MA TIMES TAK4,РаЇРаЂРаљРадРаъРаЂРаЁРа╝РаЎ
546,­њѕб,74274,­њѕб,12222,CUNEIFORM SIGN MA GUNU,РаЇРаЂ РаЏРаЦРаЮРаЦ
547,­њѕБ,74275,­њѕБ,12223,CUNEIFORM SIGN MA2,РаЇРаЂРа╝РаЃ
548,­њѕц,74276,­њѕц,12224,CUNEIFORM SIGN MAH,РаЇРаЂРаЊ
549,­њѕЦ,74277,­њѕЦ,12225,CUNEIFORM SIGN MAR,РаЇРаЂРаЌ
550,­њѕд,74278,­њѕд,12226,CUNEIFORM SIGN MASH,РаЇРаЂРајРаЊ
551,­њѕД,74279,­њѕД,12227,CUNEIFORM SIGN MASH2,РаЇРаЂРајРаЊРа╝РаЃ
552,­њѕе,74280,­њѕе,12228,CUNEIFORM SIGN ME,РаЇРаЉ
553,­њѕЕ,74281,­њѕЕ,12229,CUNEIFORM SIGN MES,РаЇРаЉРај
554,­њѕф,74282,­њѕф,1222A,CUNEIFORM SIGN MI,РаЇРаі
555,­њѕФ,74283,­њѕФ,1222B,CUNEIFORM SIGN MIN,РаЇРаіРаЮ
556,­њѕг,74284,­њѕг,1222C,CUNEIFORM SIGN MU,РаЇРаЦ
557,­њѕГ,74285,­њѕГ,1222D,CUNEIFORM SIGN MU OVER MU,РаЇРаЦРаљРаїРаЇРаЦ
558,­њѕ«,74286,­њѕ«,1222E,CUNEIFORM SIGN MUG,РаЇРаЦРаЏ
559,­њѕ»,74287,­њѕ»,1222F,CUNEIFORM SIGN MUG GUNU,РаЇРаЦРаЏ РаЏРаЦРаЮРаЦ
560,­њѕ░,74288,­њѕ░,12230,CUNEIFORM SIGN MUNSUB,РаЇРаЦРаЮРајРаЦРаЃ
561,­њѕ▒,74289,­њѕ▒,12231,CUNEIFORM SIGN MURGU2,РаЇРаЦРаЌРаЏРаЦРа╝РаЃ
562,­њѕ▓,74290,­њѕ▓,12232,CUNEIFORM SIGN MUSH,РаЇРаЦРајРаЊ
563,­њѕ│,74291,­њѕ│,12233,CUNEIFORM SIGN MUSH TIMES A,РаЇРаЦРајРаЊРаљРадРаЂ
564,­њѕ┤,74292,­њѕ┤,12234,CUNEIFORM SIGN MUSH TIMES KUR,РаЇРаЦРајРаЊРаљРадРаЁРаЦРаЌ
565,­њѕх,74293,­њѕх,12235,CUNEIFORM SIGN MUSH TIMES ZA,РаЇРаЦРајРаЊРаљРадРахРаЂ
566,­њѕХ,74294,­њѕХ,12236,CUNEIFORM SIGN MUSH OVER MUSH,РаЇРаЦРајРаЊРаљРаїРаЇРаЦРајРаЊ
567,­њѕи,74295,­њѕи,12237,CUNEIFORM SIGN MUSH OVER MUSH TIMES A PLUS NA,РаЇРаЦРајРаЊРаљРаїРаЇРаЦРајРаЊРаљРадРаЂРаљРаќРаЮРаЂ
568,­њѕИ,74296,­њѕИ,12238,CUNEIFORM SIGN MUSH CROSSING MUSH,РаЇРаЦРајРаЊРаѕРа»РаЇРаЦРајРаЊ
569,­њѕ╣,74297,­њѕ╣,12239,CUNEIFORM SIGN MUSH3,РаЇРаЦРајРаЊРа╝РаЅ
570,­њѕ║,74298,­њѕ║,1223A,CUNEIFORM SIGN MUSH3 TIMES A,РаЇРаЦРајРаЊРа╝РаЅРаљРадРаЂ
571,­њѕ╗,74299,­њѕ╗,1223B,CUNEIFORM SIGN MUSH3 TIMES A PLUS DI,РаЇРаЦРајРаЊРа╝РаЅРаљРадРаЂРаљРаќРаЎРаі
572,­њѕ╝,74300,­њѕ╝,1223C,CUNEIFORM SIGN MUSH3 TIMES DI,РаЇРаЦРајРаЊРа╝РаЅРаљРадРаЎРаі
573,­њѕй,74301,­њѕй,1223D,CUNEIFORM SIGN MUSH3 GUNU,РаЇРаЦРајРаЊРа╝РаЅ РаЏРаЦРаЮРаЦ
574,­њѕЙ,74302,­њѕЙ,1223E,CUNEIFORM SIGN NA,РаЮРаЂ
575,­њѕ┐,74303,­њѕ┐,1223F,CUNEIFORM SIGN NA2,РаЮРаЂРа╝РаЃ
576,­њЅђ,74304,­њЅђ,12240,CUNEIFORM SIGN NAGA,РаЮРаЂРаЏРаЂ
577,­њЅЂ,74305,­њЅЂ,12241,CUNEIFORM SIGN NAGA INVERTED,РаЮРаЂРаЏРаЂ РаіРаЮРаДРаЉРаЌРаъРаЉРаЎ
578,­њЅѓ,74306,­њЅѓ,12242,CUNEIFORM SIGN NAGA TIMES SHU TENU,РаЮРаЂРаЏРаЂРаљРадРајРаЊРаЦ РаъРаЉРаЮРаЦ
579,­њЅЃ,74307,­њЅЃ,12243,CUNEIFORM SIGN NAGA OPPOSING NAGA,РаЮРаЂРаЏРаЂРаѕРајРаЮРаЂРаЏРаЂ
580,­њЅё,74308,­њЅё,12244,CUNEIFORM SIGN NAGAR,РаЮРаЂРаЏРаЂРаЌ
581,­њЅЁ,74309,­њЅЁ,12245,CUNEIFORM SIGN NAM NUTILLU,РаЮРаЂРаЇ РаЮРаЦРаъРаіРаЄРаЄРаЦ
582,­њЅє,74310,­њЅє,12246,CUNEIFORM SIGN NAM,РаЮРаЂРаЇ
583,­њЅЄ,74311,­њЅЄ,12247,CUNEIFORM SIGN NAM2,РаЮРаЂРаЇРа╝РаЃ
584,­њЅѕ,74312,­њЅѕ,12248,CUNEIFORM SIGN NE,РаЮРаЉ
585,­њЅЅ,74313,­њЅЅ,12249,CUNEIFORM SIGN NE TIMES A,РаЮРаЉРаљРадРаЂ
586,­њЅі,74314,­њЅі,1224A,CUNEIFORM SIGN NE TIMES UD,РаЮРаЉРаљРадРаЦРаЎ
587,­њЅІ,74315,­њЅІ,1224B,CUNEIFORM SIGN NE SHESHIG,РаЮРаЉ РајРаЊРаЉРајРаЊРаіРаЏ
588,­њЅї,74316,­њЅї,1224C,CUNEIFORM SIGN NI,РаЮРаі
589,­њЅЇ,74317,­њЅЇ,1224D,CUNEIFORM SIGN NI TIMES E,РаЮРаіРаљРадРаЉ
590,­њЅј,74318,­њЅј,1224E,CUNEIFORM SIGN NI2,РаЮРаіРа╝РаЃ
591,­њЅЈ,74319,­њЅЈ,1224F,CUNEIFORM SIGN NIM,РаЮРаіРаЇ
592,­њЅљ,74320,­њЅљ,12250,CUNEIFORM SIGN NIM TIMES GAN2 TENU,РаЮРаіРаЇРаљРадРаЏРаЂРаЮРа╝РаЃ РаъРаЉРаЮРаЦ
593,­њЅЉ,74321,­њЅЉ,12251,CUNEIFORM SIGN NIM TIMES GAR PLUS GAN2 TENU,РаЮРаіРаЇРаљРадРаЏРаЂРаЌРаљРаќРаЏРаЂРаЮРа╝РаЃ РаъРаЉРаЮРаЦ
594,­њЅњ,74322,­њЅњ,12252,CUNEIFORM SIGN NINDA2,РаЮРаіРаЮРаЎРаЂРа╝РаЃ
595,­њЅЊ,74323,­њЅЊ,12253,CUNEIFORM SIGN NINDA2 TIMES AN,РаЮРаіРаЮРаЎРаЂРа╝РаЃРаљРадРаЂРаЮ
596,­њЅћ,74324,­њЅћ,12254,CUNEIFORM SIGN NINDA2 TIMES ASH,РаЮРаіРаЮРаЎРаЂРа╝РаЃРаљРадРаЂРајРаЊ
597,­њЅЋ,74325,­њЅЋ,12255,CUNEIFORM SIGN NINDA2 TIMES ASH PLUS ASH,РаЮРаіРаЮРаЎРаЂРа╝РаЃРаљРадРаЂРајРаЊРаљРаќРаЂРајРаЊ
598,­њЅќ,74326,­њЅќ,12256,CUNEIFORM SIGN NINDA2 TIMES GUD,РаЮРаіРаЮРаЎРаЂРа╝РаЃРаљРадРаЏРаЦРаЎ
599,­њЅЌ,74327,­њЅЌ,12257,CUNEIFORM SIGN NINDA2 TIMES ME PLUS GAN2 TENU,РаЮРаіРаЮРаЎРаЂРа╝РаЃРаљРадРаЇРаЉРаљРаќРаЏРаЂРаЮРа╝РаЃ РаъРаЉРаЮРаЦ
600,­њЅў,74328,­њЅў,12258,CUNEIFORM SIGN NINDA2 TIMES NE,РаЮРаіРаЮРаЎРаЂРа╝РаЃРаљРадРаЮРаЉ
601,­њЅЎ,74329,­њЅЎ,12259,CUNEIFORM SIGN NINDA2 TIMES NUN,РаЮРаіРаЮРаЎРаЂРа╝РаЃРаљРадРаЮРаЦРаЮ
602,­њЅџ,74330,­њЅџ,1225A,CUNEIFORM SIGN NINDA2 TIMES SHE,РаЮРаіРаЮРаЎРаЂРа╝РаЃРаљРадРајРаЊРаЉ
603,­њЅЏ,74331,­њЅЏ,1225B,CUNEIFORM SIGN NINDA2 TIMES SHE PLUS A AN,РаЮРаіРаЮРаЎРаЂРа╝РаЃРаљРадРајРаЊРаЉРаљРаќРаЂ РаЂРаЮ
604,­њЅю,74332,­њЅю,1225C,CUNEIFORM SIGN NINDA2 TIMES SHE PLUS ASH,РаЮРаіРаЮРаЎРаЂРа╝РаЃРаљРадРајРаЊРаЉРаљРаќРаЂРајРаЊ
605,­њЅЮ,74333,­њЅЮ,1225D,CUNEIFORM SIGN NINDA2 TIMES SHE PLUS ASH PLUS ASH,РаЮРаіРаЮРаЎРаЂРа╝РаЃРаљРадРајРаЊРаЉРаљРаќРаЂРајРаЊРаљРаќРаЂРајРаЊ
606,­њЅъ,74334,­њЅъ,1225E,CUNEIFORM SIGN NINDA2 TIMES U2 PLUS ASH,РаЮРаіРаЮРаЎРаЂРа╝РаЃРаљРадРаЦРа╝РаЃРаљРаќРаЂРајРаЊ
607,­њЅЪ,74335,­њЅЪ,1225F,CUNEIFORM SIGN NINDA2 TIMES USH,РаЮРаіРаЮРаЎРаЂРа╝РаЃРаљРадРаЦРајРаЊ
608,­њЅа,74336,­њЅа,12260,CUNEIFORM SIGN NISAG,РаЮРаіРајРаЂРаЏ
609,­њЅА,74337,­њЅА,12261,CUNEIFORM SIGN NU,РаЮРаЦ
610,­њЅб,74338,­њЅб,12262,CUNEIFORM SIGN NU11,РаЮРаЦРа╝РаЂРа╝РаЂ
611,­њЅБ,74339,­њЅБ,12263,CUNEIFORM SIGN NUN,РаЮРаЦРаЮ
612,­њЅц,74340,­њЅц,12264,CUNEIFORM SIGN NUN LAGAR TIMES GAR,РаЮРаЦРаЮ РаЄРаЂРаЏРаЂРаЌРаљРадРаЏРаЂРаЌ
613,­њЅЦ,74341,­њЅЦ,12265,CUNEIFORM SIGN NUN LAGAR TIMES MASH,РаЮРаЦРаЮ РаЄРаЂРаЏРаЂРаЌРаљРадРаЇРаЂРајРаЊ
614,­њЅд,74342,­њЅд,12266,CUNEIFORM SIGN NUN LAGAR TIMES SAL,РаЮРаЦРаЮ РаЄРаЂРаЏРаЂРаЌРаљРадРајРаЂРаЄ
615,­њЅД,74343,­њЅД,12267,CUNEIFORM SIGN NUN LAGAR TIMES SAL OVER NUN LAGAR TIMES SAL,РаЮРаЦРаЮ РаЄРаЂРаЏРаЂРаЌРаљРадРајРаЂРаЄРаљРаїРаЮРаЦРаЮ РаЄРаЂРаЏРаЂРаЌРаљРадРајРаЂРаЄ
616,­њЅе,74344,­њЅе,12268,CUNEIFORM SIGN NUN LAGAR TIMES USH,РаЮРаЦРаЮ РаЄРаЂРаЏРаЂРаЌРаљРадРаЦРајРаЊ
617,­њЅЕ,74345,­њЅЕ,12269,CUNEIFORM SIGN NUN TENU,РаЮРаЦРаЮ РаъРаЉРаЮРаЦ
618,­њЅф,74346,­њЅф,1226A,CUNEIFORM SIGN NUN OVER NUN,РаЮРаЦРаЮРаљРаїРаЮРаЦРаЮ
619,­њЅФ,74347,­њЅФ,1226B,CUNEIFORM SIGN NUN CROSSING NUN,РаЮРаЦРаЮРаѕРа»РаЮРаЦРаЮ
620,­њЅг,74348,­њЅг,1226C,CUNEIFORM SIGN NUN CROSSING NUN LAGAR OVER LAGAR,РаЮРаЦРаЮРаѕРа»РаЮРаЦРаЮ РаЄРаЂРаЏРаЂРаЌРаљРаїРаЄРаЂРаЏРаЂРаЌ
621,­њЅГ,74349,­њЅГ,1226D,CUNEIFORM SIGN NUNUZ,РаЮРаЦРаЮРаЦ
622,­њЅ«,74350,­њЅ«,1226E,CUNEIFORM SIGN NUNUZ AB2 TIMES ASHGAB,РаЮРаЦРаЮРаЦРах РаЂРаЃРа╝РаЃРаљРадРаЂРајРаЊРаЏРаЂРаЃ
623,­њЅ»,74351,­њЅ»,1226F,CUNEIFORM SIGN NUNUZ AB2 TIMES BI,РаЮРаЦРаЮРаЦРах РаЂРаЃРа╝РаЃРаљРадРаЃРаі
624,­њЅ░,74352,­њЅ░,12270,CUNEIFORM SIGN NUNUZ AB2 TIMES DUG,РаЮРаЦРаЮРаЦРах РаЂРаЃРа╝РаЃРаљРадРаЎРаЦРаЏ
625,­њЅ▒,74353,­њЅ▒,12271,CUNEIFORM SIGN NUNUZ AB2 TIMES GUD,РаЮРаЦРаЮРаЦРах РаЂРаЃРа╝РаЃРаљРадРаЏРаЦРаЎ
626,­њЅ▓,74354,­њЅ▓,12272,CUNEIFORM SIGN NUNUZ AB2 TIMES IGI GUNU,РаЮРаЦРаЮРаЦРах РаЂРаЃРа╝РаЃРаљРадРаіРаЏРаі РаЏРаЦРаЮРаЦ
627,­њЅ│,74355,­њЅ│,12273,CUNEIFORM SIGN NUNUZ AB2 TIMES KAD3,РаЮРаЦРаЮРаЦРах РаЂРаЃРа╝РаЃРаљРадРаЁРаЂРаЎРа╝РаЅ
628,­њЅ┤,74356,­њЅ┤,12274,CUNEIFORM SIGN NUNUZ AB2 TIMES LA,РаЮРаЦРаЮРаЦРах РаЂРаЃРа╝РаЃРаљРадРаЄРаЂ
629,­њЅх,74357,­њЅх,12275,CUNEIFORM SIGN NUNUZ AB2 TIMES NE,РаЮРаЦРаЮРаЦРах РаЂРаЃРа╝РаЃРаљРадРаЮРаЉ
630,­њЅХ,74358,­њЅХ,12276,CUNEIFORM SIGN NUNUZ AB2 TIMES SILA3,РаЮРаЦРаЮРаЦРах РаЂРаЃРа╝РаЃРаљРадРајРаіРаЄРаЂРа╝РаЅ
631,­њЅи,74359,­њЅи,12277,CUNEIFORM SIGN NUNUZ AB2 TIMES U2,РаЮРаЦРаЮРаЦРах РаЂРаЃРа╝РаЃРаљРадРаЦРа╝РаЃ
632,­њЅИ,74360,­њЅИ,12278,CUNEIFORM SIGN NUNUZ KISIM5 TIMES BI,РаЮРаЦРаЮРаЦРах РаЁРаіРајРаіРаЇРа╝РаЉРаљРадРаЃРаі
633,­њЅ╣,74361,­њЅ╣,12279,CUNEIFORM SIGN NUNUZ KISIM5 TIMES BI U,РаЮРаЦРаЮРаЦРах РаЁРаіРајРаіРаЇРа╝РаЉРаљРадРаЃРаі РаЦ
634,­њЅ║,74362,­њЅ║,1227A,CUNEIFORM SIGN PA,РаЈРаЂ
635,­њЅ╗,74363,­њЅ╗,1227B,CUNEIFORM SIGN PAD,РаЈРаЂРаЎ
636,­њЅ╝,74364,­њЅ╝,1227C,CUNEIFORM SIGN PAN,РаЈРаЂРаЮ
637,­њЅй,74365,­њЅй,1227D,CUNEIFORM SIGN PAP,РаЈРаЂРаЈ
638,­њЅЙ,74366,­њЅЙ,1227E,CUNEIFORM SIGN PESH2,РаЈРаЉРајРаЊРа╝РаЃ
639,­њЅ┐,74367,­њЅ┐,1227F,CUNEIFORM SIGN PI,РаЈРаі
640,­њіђ,74368,­њіђ,12280,CUNEIFORM SIGN PI TIMES A,РаЈРаіРаљРадРаЂ
641,­њіЂ,74369,­њіЂ,12281,CUNEIFORM SIGN PI TIMES AB,РаЈРаіРаљРадРаЂРаЃ
642,­њіѓ,74370,­њіѓ,12282,CUNEIFORM SIGN PI TIMES BI,РаЈРаіРаљРадРаЃРаі
643,­њіЃ,74371,­њіЃ,12283,CUNEIFORM SIGN PI TIMES BU,РаЈРаіРаљРадРаЃРаЦ
644,­њіё,74372,­њіё,12284,CUNEIFORM SIGN PI TIMES E,РаЈРаіРаљРадРаЉ
645,­њіЁ,74373,­њіЁ,12285,CUNEIFORM SIGN PI TIMES I,РаЈРаіРаљРадРаі
646,­њіє,74374,­њіє,12286,CUNEIFORM SIGN PI TIMES IB,РаЈРаіРаљРадРаіРаЃ
647,­њіЄ,74375,­њіЄ,12287,CUNEIFORM SIGN PI TIMES U,РаЈРаіРаљРадРаЦ
648,­њіѕ,74376,­њіѕ,12288,CUNEIFORM SIGN PI TIMES U2,РаЈРаіРаљРадРаЦРа╝РаЃ
649,­њіЅ,74377,­њіЅ,12289,CUNEIFORM SIGN PI CROSSING PI,РаЈРаіРаѕРа»РаЈРаі
650,­њіі,74378,­њіі,1228A,CUNEIFORM SIGN PIRIG,РаЈРаіРаЌРаіРаЏ
651,­њіІ,74379,­њіІ,1228B,CUNEIFORM SIGN PIRIG TIMES KAL,РаЈРаіРаЌРаіРаЏРаљРадРаЁРаЂРаЄ
652,­њії,74380,­њії,1228C,CUNEIFORM SIGN PIRIG TIMES UD,РаЈРаіРаЌРаіРаЏРаљРадРаЦРаЎ
653,­њіЇ,74381,­њіЇ,1228D,CUNEIFORM SIGN PIRIG TIMES ZA,РаЈРаіРаЌРаіРаЏРаљРадРахРаЂ
654,­њіј,74382,­њіј,1228E,CUNEIFORM SIGN PIRIG OPPOSING PIRIG,РаЈРаіРаЌРаіРаЏРаѕРајРаЈРаіРаЌРаіРаЏ
655,­њіЈ,74383,­њіЈ,1228F,CUNEIFORM SIGN RA,РаЌРаЂ
656,­њіљ,74384,­њіљ,12290,CUNEIFORM SIGN RAB,РаЌРаЂРаЃ
657,­њіЉ,74385,­њіЉ,12291,CUNEIFORM SIGN RI,РаЌРаі
658,­њіњ,74386,­њіњ,12292,CUNEIFORM SIGN RU,РаЌРаЦ
659,­њіЊ,74387,­њіЊ,12293,CUNEIFORM SIGN SA,РајРаЂ
660,­њіћ,74388,­њіћ,12294,CUNEIFORM SIGN SAG NUTILLU,РајРаЂРаЏ РаЮРаЦРаъРаіРаЄРаЄРаЦ
661,­њіЋ,74389,­њіЋ,12295,CUNEIFORM SIGN SAG,РајРаЂРаЏ
662,­њіќ,74390,­њіќ,12296,CUNEIFORM SIGN SAG TIMES A,РајРаЂРаЏРаљРадРаЂ
663,­њіЌ,74391,­њіЌ,12297,CUNEIFORM SIGN SAG TIMES DU,РајРаЂРаЏРаљРадРаЎРаЦ
664,­њіў,74392,­њіў,12298,CUNEIFORM SIGN SAG TIMES DUB,РајРаЂРаЏРаљРадРаЎРаЦРаЃ
665,­њіЎ,74393,­њіЎ,12299,CUNEIFORM SIGN SAG TIMES HA,РајРаЂРаЏРаљРадРаЊРаЂ
666,­њіџ,74394,­њіџ,1229A,CUNEIFORM SIGN SAG TIMES KAK,РајРаЂРаЏРаљРадРаЁРаЂРаЁ
667,­њіЏ,74395,­њіЏ,1229B,CUNEIFORM SIGN SAG TIMES KUR,РајРаЂРаЏРаљРадРаЁРаЦРаЌ
668,­њію,74396,­њію,1229C,CUNEIFORM SIGN SAG TIMES LUM,РајРаЂРаЏРаљРадРаЄРаЦРаЇ
