Character,Hex,Type,Name,Braille
ЁТАА,12000,letter,CUNEIFORM SIGN A,таБ
ЁТАБ,12001,letter,CUNEIFORM SIGN A TIMES A,таБтабтаБ
ЁТАВ,12002,letter,CUNEIFORM SIGN A TIMES BAD,таБтабтаГтаБтаЩ
ЁТАГ,12003,letter,CUNEIFORM SIGN A TIMES GAN2 TENU,таБтабтаЫтаБтаЭ таЮтаСтаЭтае
ЁТАД,12004,letter,CUNEIFORM SIGN A TIMES HA,таБтабтаУтаБ
ЁТАЕ,12005,letter,CUNEIFORM SIGN A TIMES IGI,таБтабтаКтаЫтаК
ЁТАЖ,12006,letter,CUNEIFORM SIGN A TIMES LAGAR GUNU,таБтабтаЗтаБтаЫтаЬ таЫтаетаЭтае
ЁТАЗ,12007,letter,CUNEIFORM SIGN A TIMES MUSH,таБтабтаНтаетай
ЁТАИ,12008,letter,CUNEIFORM SIGN A TIMES SAG,таБтабтаОтаБтаЫ
ЁТАЙ,12009,letter,CUNEIFORM SIGN A2,таБ
ЁТАК,1200A,letter,CUNEIFORM SIGN AB,таБтаГ
ЁТАЛ,1200B,letter,CUNEIFORM SIGN AB TIMES ASH2,таБтаГтабтаБтай
ЁТАМ,1200C,letter,CUNEIFORM SIGN AB TIMES DUN3 GUNU,таБтаГтабтаЩтаетаЭтаТ таЫтаетаЭтае
ЁТАН,1200D,letter,CUNEIFORM SIGN AB TIMES GAL,таБтаГтабтаЫтаБтаЗ
ЁТАО,1200E,letter,CUNEIFORM SIGN AB TIMES GAN2 TENU,таБтаГтабтаЫтаБтаЭ таЮтаСтаЭтае
ЁТАП,1200F,letter,CUNEIFORM SIGN AB TIMES HA,таБтаГтабтаУтаБ
ЁТАР,12010,letter,CUNEIFORM SIGN AB TIMES IGI GUNU,таБтаГтабтаКтаЫтаК таЫтаетаЭтае
ЁТАС,12011,letter,CUNEIFORM SIGN AB TIMES IMIN,таБтаГтабтаКтаНтаКтаЭ
ЁТАТ,12012,letter,CUNEIFORM SIGN AB TIMES LAGAB,таБтаГтабтаЗтаБтаЫтаБтаГ
ЁТАУ,12013,letter,CUNEIFORM SIGN AB TIMES SHESH,таБтаГтабтайтаСтай
ЁТАФ,12014,letter,CUNEIFORM SIGN AB TIMES U PLUS U PLUS U,таБтаГтабтаетамтаетамтае
ЁТАХ,12015,letter,CUNEIFORM SIGN AB GUNU,таБтаГ таЫтаетаЭтае
ЁТАЦ,12016,letter,CUNEIFORM SIGN AB2,таБтаГ
ЁТАЧ,12017,letter,CUNEIFORM SIGN AB2 TIMES BALAG,таБтаГтабтаГтаБтаЗтаБтаЫ
ЁТАШ,12018,letter,CUNEIFORM SIGN AB2 TIMES GAN2 TENU,таБтаГтабтаЫтаБтаЭ таЮтаСтаЭтае
ЁТАЩ,12019,letter,CUNEIFORM SIGN AB2 TIMES ME PLUS EN,таБтаГтабтаНтаСтамтаСтаЭ
ЁТАЪ,1201A,letter,CUNEIFORM SIGN AB2 TIMES SHA3,таБтаГтабтайтаБтаТ
ЁТАЫ,1201B,letter,CUNEIFORM SIGN AB2 TIMES TAK4,таБтаГтабтаЮтаБтаЕта▓
ЁТАЬ,1201C,letter,CUNEIFORM SIGN AD,таБтаЩ
ЁТАЭ,1201D,letter,CUNEIFORM SIGN AK,таБтаЕ
ЁТАЮ,1201E,letter,CUNEIFORM SIGN AK TIMES ERIN2,таБтаЕтабтаСтаЧтаКтаЭ
ЁТАЯ,1201F,letter,CUNEIFORM SIGN AK TIMES SHITA PLUS GISH,таБтаЕтабтайтаКтаЮтаБтамтаЫтаКтай
ЁТАа,12020,letter,CUNEIFORM SIGN AL,таБтаЗ
ЁТАб,12021,letter,CUNEIFORM SIGN AL TIMES AL,таБтаЗтабтаБтаЗ
ЁТАв,12022,letter,CUNEIFORM SIGN AL TIMES DIM2,таБтаЗтабтаЩтаКтаН
ЁТАг,12023,letter,CUNEIFORM SIGN AL TIMES GISH,таБтаЗтабтаЫтаКтай
ЁТАд,12024,letter,CUNEIFORM SIGN AL TIMES HA,таБтаЗтабтаУтаБ
ЁТАе,12025,letter,CUNEIFORM SIGN AL TIMES KAD3,таБтаЗтабтаЕтаБтаЩтаТ
ЁТАж,12026,letter,CUNEIFORM SIGN AL TIMES KI,таБтаЗтабтаЕтаК
ЁТАз,12027,letter,CUNEIFORM SIGN AL TIMES SHE,таБтаЗтабтайтаС
ЁТАи,12028,letter,CUNEIFORM SIGN AL TIMES USH,таБтаЗтабтаетай
ЁТАй,12029,letter,CUNEIFORM SIGN ALAN,таБтаЗтаБтаЭ
ЁТАк,1202A,letter,CUNEIFORM SIGN ALEPH,таБтаЗтаСтаПтаУ
ЁТАл,1202B,letter,CUNEIFORM SIGN AMAR,таБтаНтаЬ
ЁТАм,1202C,letter,CUNEIFORM SIGN AMAR TIMES SHE,таБтаНтаЬтабтайтаС
ЁТАн,1202D,letter,CUNEIFORM SIGN AN,таБтаЭ
ЁТАо,1202E,letter,CUNEIFORM SIGN AN OVER AN,таБтаЭтаМтаБтаЭ
ЁТАп,1202F,letter,CUNEIFORM SIGN AN THREE TIMES,таБтаЭтаШта╕таТ
ЁТА░,12030,letter,CUNEIFORM SIGN AN PLUS NAGA OPPOSING AN PLUS NAGA,таБтаЭтамтаЭтаБтаЫтаБталтаБтаЭтамтаЭтаБтаЫтаБ
ЁТА▒,12031,letter,CUNEIFORM SIGN AN PLUS NAGA SQUARED,таБтаЭтамтаЭтаБтаЫтаБтаШта╕
ЁТА▓,12032,letter,CUNEIFORM SIGN ANSHE,таБтаЭтайтаС
ЁТА│,12033,letter,CUNEIFORM SIGN APIN,таБтаПтаКтаЭ
ЁТА┤,12034,letter,CUNEIFORM SIGN ARAD,таЬтаБтаЩ
ЁТА╡,12035,letter,CUNEIFORM SIGN ARAD TIMES KUR,таЬтаБтаЩтабтаЕтаетаЧ
ЁТА╢,12036,letter,CUNEIFORM SIGN ARKAB,таЬтаЕтаБтаГ
ЁТА╖,12037,letter,CUNEIFORM SIGN ASAL2,таБтаОтаБтаЗ
ЁТА╕,12038,letter,CUNEIFORM SIGN ASH,таБтай
ЁТА╣,12039,letter,CUNEIFORM SIGN ASH ZIDA TENU,таБтай та╡таКтаЩтаБ таЮтаСтаЭтае
ЁТА║,1203A,letter,CUNEIFORM SIGN ASH KABA TENU,таБтай таЕтаБтаГтаБ таЮтаСтаЭтае
ЁТА╗,1203B,letter,CUNEIFORM SIGN ASH OVER ASH TUG2 OVER TUG2 TUG2 OVER TUG2 PAP,таБтайтаМтаБтай таЮтаетаЫтаМтаЮтаетаЫ таЮтаетаЫтаМтаЮтаетаЫ таПтаБтаП
ЁТА╝,1203C,letter,CUNEIFORM SIGN ASH OVER ASH OVER ASH,таБтайтаМтаБтайтаМтаБтай
ЁТА╜,1203D,letter,CUNEIFORM SIGN ASH OVER ASH OVER ASH CROSSING ASH OVER ASH OVER ASH,таБтайтаМтаБтайтаМтаБтайтаптаБтайтаМтаБтайтаМтаБтай
ЁТА╛,1203E,letter,CUNEIFORM SIGN ASH2,таБтай
ЁТА┐,1203F,letter,CUNEIFORM SIGN ASHGAB,таБтайтаЫтаБтаГ
ЁТБА,12040,letter,CUNEIFORM SIGN BA,таГтаБ
ЁТББ,12041,letter,CUNEIFORM SIGN BAD,таГтаБтаЩ
ЁТБВ,12042,letter,CUNEIFORM SIGN BAG3,таГтаБтаЫтаТ
ЁТБГ,12043,letter,CUNEIFORM SIGN BAHAR2,таГтаБтаУтаЬ
ЁТБД,12044,letter,CUNEIFORM SIGN BAL,таГтаБтаЗ
ЁТБЕ,12045,letter,CUNEIFORM SIGN BAL OVER BAL,таГтаБтаЗтаМтаГтаБтаЗ
ЁТБЖ,12046,letter,CUNEIFORM SIGN BALAG,таГтаБтаЗтаБтаЫ
ЁТБЗ,12047,letter,CUNEIFORM SIGN BAR,таГтаЬ
ЁТБИ,12048,letter,CUNEIFORM SIGN BARA2,таГтаЬтаБ
ЁТБЙ,12049,letter,CUNEIFORM SIGN BI,таГтаК
ЁТБК,1204A,letter,CUNEIFORM SIGN BI TIMES A,таГтаКтабтаБ
ЁТБЛ,1204B,letter,CUNEIFORM SIGN BI TIMES GAR,таГтаКтабтаЫтаЬ
ЁТБМ,1204C,letter,CUNEIFORM SIGN BI TIMES IGI GUNU,таГтаКтабтаКтаЫтаК таЫтаетаЭтае
ЁТБН,1204D,letter,CUNEIFORM SIGN BU,таГтае
ЁТБО,1204E,letter,CUNEIFORM SIGN BU OVER BU AB,таГтаетаМтаГтае таБтаГ
ЁТБП,1204F,letter,CUNEIFORM SIGN BU OVER BU UN,таГтаетаМтаГтае таетаЭ
ЁТБР,12050,letter,CUNEIFORM SIGN BU CROSSING BU,таГтаетаптаГтае
ЁТБС,12051,letter,CUNEIFORM SIGN BULUG,таГтаетаЗтаетаЫ
ЁТБТ,12052,letter,CUNEIFORM SIGN BULUG OVER BULUG,таГтаетаЗтаетаЫтаМтаГтаетаЗтаетаЫ
ЁТБУ,12053,letter,CUNEIFORM SIGN BUR,таГтаетаЧ
ЁТБФ,12054,letter,CUNEIFORM SIGN BUR2,таГтаетаЧ
ЁТБХ,12055,letter,CUNEIFORM SIGN DA,таЩтаБ
ЁТБЦ,12056,letter,CUNEIFORM SIGN DAG,таЩтаБтаЫ
ЁТБЧ,12057,letter,CUNEIFORM SIGN DAG KISIM5 TIMES A PLUS MASH,таЩтаБтаЫ таЕтаКтаОтаКтаНтавтабтаБтамтаНтаБтай
ЁТБШ,12058,letter,CUNEIFORM SIGN DAG KISIM5 TIMES AMAR,таЩтаБтаЫ таЕтаКтаОтаКтаНтавтабтаБтаНтаЬ
ЁТБЩ,12059,letter,CUNEIFORM SIGN DAG KISIM5 TIMES BALAG,таЩтаБтаЫ таЕтаКтаОтаКтаНтавтабтаГтаБтаЗтаБтаЫ
ЁТБЪ,1205A,letter,CUNEIFORM SIGN DAG KISIM5 TIMES BI,таЩтаБтаЫ таЕтаКтаОтаКтаНтавтабтаГтаК
ЁТБЫ,1205B,letter,CUNEIFORM SIGN DAG KISIM5 TIMES GA,таЩтаБтаЫ таЕтаКтаОтаКтаНтавтабтаЫтаБ
ЁТБЬ,1205C,letter,CUNEIFORM SIGN DAG KISIM5 TIMES GA PLUS MASH,таЩтаБтаЫ таЕтаКтаОтаКтаНтавтабтаЫтаБтамтаНтаБтай
ЁТБЭ,1205D,letter,CUNEIFORM SIGN DAG KISIM5 TIMES GI,таЩтаБтаЫ таЕтаКтаОтаКтаНтавтабтаЫтаК
ЁТБЮ,1205E,letter,CUNEIFORM SIGN DAG KISIM5 TIMES GIR2,таЩтаБтаЫ таЕтаКтаОтаКтаНтавтабтаЫтаКтаЧ
ЁТБЯ,1205F,letter,CUNEIFORM SIGN DAG KISIM5 TIMES GUD,таЩтаБтаЫ таЕтаКтаОтаКтаНтавтабтаЫтаетаЩ
ЁТБа,12060,letter,CUNEIFORM SIGN DAG KISIM5 TIMES HA,таЩтаБтаЫ таЕтаКтаОтаКтаНтавтабтаУтаБ
ЁТБб,12061,letter,CUNEIFORM SIGN DAG KISIM5 TIMES IR,таЩтаБтаЫ таЕтаКтаОтаКтаНтавтабтаКтаЧ
ЁТБв,12062,letter,CUNEIFORM SIGN DAG KISIM5 TIMES IR PLUS LU,таЩтаБтаЫ таЕтаКтаОтаКтаНтавтабтаКтаЧтамтаЗтае
ЁТБг,12063,letter,CUNEIFORM SIGN DAG KISIM5 TIMES KAK,таЩтаБтаЫ таЕтаКтаОтаКтаНтавтабтаЕтаБтаЕ
ЁТБд,12064,letter,CUNEIFORM SIGN DAG KISIM5 TIMES LA,таЩтаБтаЫ таЕтаКтаОтаКтаНтавтабтаЗтаБ
ЁТБе,12065,letter,CUNEIFORM SIGN DAG KISIM5 TIMES LU,таЩтаБтаЫ таЕтаКтаОтаКтаНтавтабтаЗтае
ЁТБж,12066,letter,CUNEIFORM SIGN DAG KISIM5 TIMES LU PLUS MASH2,таЩтаБтаЫ таЕтаКтаОтаКтаНтавтабтаЗтаетамтаНтаБтай
ЁТБз,12067,letter,CUNEIFORM SIGN DAG KISIM5 TIMES LUM,таЩтаБтаЫ таЕтаКтаОтаКтаНтавтабтаЗтаетаН
ЁТБи,12068,letter,CUNEIFORM SIGN DAG KISIM5 TIMES NE,таЩтаБтаЫ таЕтаКтаОтаКтаНтавтабтаЭтаС
ЁТБй,12069,letter,CUNEIFORM SIGN DAG KISIM5 TIMES PAP PLUS PAP,таЩтаБтаЫ таЕтаКтаОтаКтаНтавтабтаПтаБтаПтамтаПтаБтаП
ЁТБк,1206A,letter,CUNEIFORM SIGN DAG KISIM5 TIMES SI,таЩтаБтаЫ таЕтаКтаОтаКтаНтавтабтаОтаК
ЁТБл,1206B,letter,CUNEIFORM SIGN DAG KISIM5 TIMES TAK4,таЩтаБтаЫ таЕтаКтаОтаКтаНтавтабтаЮтаБтаЕта▓
ЁТБм,1206C,letter,CUNEIFORM SIGN DAG KISIM5 TIMES U2 PLUS GIR2,таЩтаБтаЫ таЕтаКтаОтаКтаНтавтабтаетамтаЫтаКтаЧ
ЁТБн,1206D,letter,CUNEIFORM SIGN DAG KISIM5 TIMES USH,таЩтаБтаЫ таЕтаКтаОтаКтаНтавтабтаетай
ЁТБо,1206E,letter,CUNEIFORM SIGN DAM,таЩтаБтаН
ЁТБп,1206F,letter,CUNEIFORM SIGN DAR,таЩтаЬ
ЁТБ░,12070,letter,CUNEIFORM SIGN DARA3,таЩтаЬтаБтаТ
ЁТБ▒,12071,letter,CUNEIFORM SIGN DARA4,таЩтаЬтаБта▓
ЁТБ▓,12072,letter,CUNEIFORM SIGN DI,таЩтаК
ЁТБ│,12073,letter,CUNEIFORM SIGN DIB,таЩтаКтаГ
ЁТБ┤,12074,letter,CUNEIFORM SIGN DIM,таЩтаКтаН
ЁТБ╡,12075,letter,CUNEIFORM SIGN DIM TIMES SHE,таЩтаКтаНтабтайтаС
ЁТБ╢,12076,letter,CUNEIFORM SIGN DIM2,таЩтаКтаН
ЁТБ╖,12077,letter,CUNEIFORM SIGN DIN,таЩтаКтаЭ
ЁТБ╕,12078,letter,CUNEIFORM SIGN DIN KASKAL U GUNU DISH,таЩтаКтаЭ таЕтаБтаОтаЕтаБтаЗ тае таЫтаетаЭтае таЩтаКтай
ЁТБ╣,12079,letter,CUNEIFORM SIGN DISH,таЩтаКтай
ЁТБ║,1207A,letter,CUNEIFORM SIGN DU,таЩтае
ЁТБ╗,1207B,letter,CUNEIFORM SIGN DU OVER DU,таЩтаетаМтаЩтае
ЁТБ╝,1207C,letter,CUNEIFORM SIGN DU GUNU,таЩтае таЫтаетаЭтае
ЁТБ╜,1207D,letter,CUNEIFORM SIGN DU SHESHIG,таЩтае тайтаСтайтаКтаЫ
ЁТБ╛,1207E,letter,CUNEIFORM SIGN DUB,таЩтаетаГ
ЁТБ┐,1207F,letter,CUNEIFORM SIGN DUB TIMES ESH2,таЩтаетаГтабтаСтай
ЁТВА,12080,letter,CUNEIFORM SIGN DUB2,таЩтаетаГ
ЁТВБ,12081,letter,CUNEIFORM SIGN DUG,таЩтаетаЫ
ЁТВВ,12082,letter,CUNEIFORM SIGN DUGUD,таЩтаетаЫтаетаЩ
ЁТВГ,12083,letter,CUNEIFORM SIGN DUH,таЩтаетаУ
ЁТВД,12084,letter,CUNEIFORM SIGN DUN,таЩтаетаЭ
ЁТВЕ,12085,letter,CUNEIFORM SIGN DUN3,таЩтаетаЭтаТ
ЁТВЖ,12086,letter,CUNEIFORM SIGN DUN3 GUNU,таЩтаетаЭтаТ таЫтаетаЭтае
ЁТВЗ,12087,letter,CUNEIFORM SIGN DUN3 GUNU GUNU,таЩтаетаЭтаТ таЫтаетаЭтае таЫтаетаЭтае
ЁТВИ,12088,letter,CUNEIFORM SIGN DUN4,таЩтаетаЭта▓
ЁТВЙ,12089,letter,CUNEIFORM SIGN DUR2,таЩтаетаЧ
ЁТВК,1208A,letter,CUNEIFORM SIGN E,таС
ЁТВЛ,1208B,letter,CUNEIFORM SIGN E TIMES PAP,таСтабтаПтаБтаП
ЁТВМ,1208C,letter,CUNEIFORM SIGN E OVER E NUN OVER NUN,таСтаМтаС таЭтаетаЭтаМтаЭтаетаЭ
ЁТВН,1208D,letter,CUNEIFORM SIGN E2,таС
ЁТВО,1208E,letter,CUNEIFORM SIGN E2 TIMES A PLUS HA PLUS DA,таСтабтаБтамтаУтаБтамтаЩтаБ
ЁТВП,1208F,letter,CUNEIFORM SIGN E2 TIMES GAR,таСтабтаЫтаЬ
ЁТВР,12090,letter,CUNEIFORM SIGN E2 TIMES MI,таСтабтаНтаК
ЁТВС,12091,letter,CUNEIFORM SIGN E2 TIMES SAL,таСтабтаОтаБтаЗ
ЁТВТ,12092,letter,CUNEIFORM SIGN E2 TIMES SHE,таСтабтайтаС
ЁТВУ,12093,letter,CUNEIFORM SIGN E2 TIMES U,таСтабтае
ЁТВФ,12094,letter,CUNEIFORM SIGN EDIN,таСтаЩтаКтаЭ
ЁТВХ,12095,letter,CUNEIFORM SIGN EGIR,таСтаЫтаКтаЧ
ЁТВЦ,12096,letter,CUNEIFORM SIGN EL,таСтаЗ
ЁТВЧ,12097,letter,CUNEIFORM SIGN EN,таСтаЭ
ЁТВШ,12098,letter,CUNEIFORM SIGN EN TIMES GAN2,таСтаЭтабтаЫтаБтаЭ
ЁТВЩ,12099,letter,CUNEIFORM SIGN EN TIMES GAN2 TENU,таСтаЭтабтаЫтаБтаЭ таЮтаСтаЭтае
ЁТВЪ,1209A,letter,CUNEIFORM SIGN EN TIMES ME,таСтаЭтабтаНтаС
ЁТВЫ,1209B,letter,CUNEIFORM SIGN EN CROSSING EN,таСтаЭтаптаСтаЭ
ЁТВЬ,1209C,letter,CUNEIFORM SIGN EN OPPOSING EN,таСтаЭталтаСтаЭ
ЁТВЭ,1209D,letter,CUNEIFORM SIGN EN SQUARED,таСтаЭтаШта╕
ЁТВЮ,1209E,letter,CUNEIFORM SIGN EREN,таСтаЧтаСтаЭ
ЁТВЯ,1209F,letter,CUNEIFORM SIGN ERIN2,таСтаЧтаКтаЭ
ЁТВа,120A0,letter,CUNEIFORM SIGN ESH2,таСтай
ЁТВб,120A1,letter,CUNEIFORM SIGN EZEN,таСта╡таСтаЭ
ЁТВв,120A2,letter,CUNEIFORM SIGN EZEN TIMES A,таСта╡таСтаЭтабтаБ
ЁТВг,120A3,letter,CUNEIFORM SIGN EZEN TIMES A PLUS LAL,таСта╡таСтаЭтабтаБтамтаЗтаБтаЗ
ЁТВд,120A4,letter,CUNEIFORM SIGN EZEN TIMES A PLUS LAL TIMES LAL,таСта╡таСтаЭтабтаБтамтаЗтаБтаЗтабтаЗтаБтаЗ
ЁТВе,120A5,letter,CUNEIFORM SIGN EZEN TIMES AN,таСта╡таСтаЭтабтаБтаЭ
ЁТВж,120A6,letter,CUNEIFORM SIGN EZEN TIMES BAD,таСта╡таСтаЭтабтаГтаБтаЩ
ЁТВз,120A7,letter,CUNEIFORM SIGN EZEN TIMES DUN3 GUNU,таСта╡таСтаЭтабтаЩтаетаЭтаТ таЫтаетаЭтае
ЁТВи,120A8,letter,CUNEIFORM SIGN EZEN TIMES DUN3 GUNU GUNU,таСта╡таСтаЭтабтаЩтаетаЭтаТ таЫтаетаЭтае таЫтаетаЭтае
ЁТВй,120A9,letter,CUNEIFORM SIGN EZEN TIMES HA,таСта╡таСтаЭтабтаУтаБ
ЁТВк,120AA,letter,CUNEIFORM SIGN EZEN TIMES HA GUNU,таСта╡таСтаЭтабтаУтаБ таЫтаетаЭтае
ЁТВл,120AB,letter,CUNEIFORM SIGN EZEN TIMES IGI GUNU,таСта╡таСтаЭтабтаКтаЫтаК таЫтаетаЭтае
ЁТВм,120AC,letter,CUNEIFORM SIGN EZEN TIMES KASKAL,таСта╡таСтаЭтабтаЕтаБтаОтаЕтаБтаЗ
ЁТВн,120AD,letter,CUNEIFORM SIGN EZEN TIMES KASKAL SQUARED,таСта╡таСтаЭтабтаЕтаБтаОтаЕтаБтаЗтаШта╕
ЁТВо,120AE,letter,CUNEIFORM SIGN EZEN TIMES KU3,таСта╡таСтаЭтабтаЕтаетаТ
ЁТВп,120AF,letter,CUNEIFORM SIGN EZEN TIMES LA,таСта╡таСтаЭтабтаЗтаБ
ЁТВ░,120B0,letter,CUNEIFORM SIGN EZEN TIMES LAL TIMES LAL,таСта╡таСтаЭтабтаЗтаБтаЗтабтаЗтаБтаЗ
ЁТВ▒,120B1,letter,CUNEIFORM SIGN EZEN TIMES LI,таСта╡таСтаЭтабтаЗтаК
ЁТВ▓,120B2,letter,CUNEIFORM SIGN EZEN TIMES LU,таСта╡таСтаЭтабтаЗтае
ЁТВ│,120B3,letter,CUNEIFORM SIGN EZEN TIMES U2,таСта╡таСтаЭтабтае
ЁТВ┤,120B4,letter,CUNEIFORM SIGN EZEN TIMES UD,таСта╡таСтаЭтабтаетаЩ
ЁТВ╡,120B5,letter,CUNEIFORM SIGN GA,таЫтаБ
ЁТВ╢,120B6,letter,CUNEIFORM SIGN GA GUNU,таЫтаБ таЫтаетаЭтае
ЁТВ╖,120B7,letter,CUNEIFORM SIGN GA2,таЫтаБ
ЁТВ╕,120B8,letter,CUNEIFORM SIGN GA2 TIMES A PLUS DA PLUS HA,таЫтаБтабтаБтамтаЩтаБтамтаУтаБ
ЁТВ╣,120B9,letter,CUNEIFORM SIGN GA2 TIMES A PLUS HA,таЫтаБтабтаБтамтаУтаБ
ЁТВ║,120BA,letter,CUNEIFORM SIGN GA2 TIMES A PLUS IGI,таЫтаБтабтаБтамтаКтаЫтаК
ЁТВ╗,120BB,letter,CUNEIFORM SIGN GA2 TIMES AB2 TENU PLUS TAB,таЫтаБтабтаБтаГ таЮтаСтаЭтаетамтаЮтаБтаГ
ЁТВ╝,120BC,letter,CUNEIFORM SIGN GA2 TIMES AN,таЫтаБтабтаБтаЭ
ЁТВ╜,120BD,letter,CUNEIFORM SIGN GA2 TIMES ASH,таЫтаБтабтаБтай
ЁТВ╛,120BE,letter,CUNEIFORM SIGN GA2 TIMES ASH2 PLUS GAL,таЫтаБтабтаБтайтамтаЫтаБтаЗ
ЁТВ┐,120BF,letter,CUNEIFORM SIGN GA2 TIMES BAD,таЫтаБтабтаГтаБтаЩ
ЁТГА,120C0,letter,CUNEIFORM SIGN GA2 TIMES BAR PLUS RA,таЫтаБтабтаГтаЬтамтаЧтаБ
ЁТГБ,120C1,letter,CUNEIFORM SIGN GA2 TIMES BUR,таЫтаБтабтаГтаетаЧ
ЁТГВ,120C2,letter,CUNEIFORM SIGN GA2 TIMES BUR PLUS RA,таЫтаБтабтаГтаетаЧтамтаЧтаБ
ЁТГГ,120C3,letter,CUNEIFORM SIGN GA2 TIMES DA,таЫтаБтабтаЩтаБ
ЁТГД,120C4,letter,CUNEIFORM SIGN GA2 TIMES DI,таЫтаБтабтаЩтаК
ЁТГЕ,120C5,letter,CUNEIFORM SIGN GA2 TIMES DIM TIMES SHE,таЫтаБтабтаЩтаКтаНтабтайтаС
ЁТГЖ,120C6,letter,CUNEIFORM SIGN GA2 TIMES DUB,таЫтаБтабтаЩтаетаГ
ЁТГЗ,120C7,letter,CUNEIFORM SIGN GA2 TIMES EL,таЫтаБтабтаСтаЗ
ЁТГИ,120C8,letter,CUNEIFORM SIGN GA2 TIMES EL PLUS LA,таЫтаБтабтаСтаЗтамтаЗтаБ
ЁТГЙ,120C9,letter,CUNEIFORM SIGN GA2 TIMES EN,таЫтаБтабтаСтаЭ
ЁТГК,120CA,letter,CUNEIFORM SIGN GA2 TIMES EN TIMES GAN2 TENU,таЫтаБтабтаСтаЭтабтаЫтаБтаЭ таЮтаСтаЭтае
ЁТГЛ,120CB,letter,CUNEIFORM SIGN GA2 TIMES GAN2 TENU,таЫтаБтабтаЫтаБтаЭ таЮтаСтаЭтае
ЁТГМ,120CC,letter,CUNEIFORM SIGN GA2 TIMES GAR,таЫтаБтабтаЫтаЬ
ЁТГН,120CD,letter,CUNEIFORM SIGN GA2 TIMES GI,таЫтаБтабтаЫтаК
ЁТГО,120CE,letter,CUNEIFORM SIGN GA2 TIMES GI4,таЫтаБтабтаЫтаКта▓
ЁТГП,120CF,letter,CUNEIFORM SIGN GA2 TIMES GI4 PLUS A,таЫтаБтабтаЫтаКта▓тамтаБ
ЁТГР,120D0,letter,CUNEIFORM SIGN GA2 TIMES GIR2 PLUS SU,таЫтаБтабтаЫтаКтаЧтамтаОтае
ЁТГС,120D1,letter,CUNEIFORM SIGN GA2 TIMES HA PLUS LU PLUS ESH2,таЫтаБтабтаУтаБтамтаЗтаетамтаСтай
ЁТГТ,120D2,letter,CUNEIFORM SIGN GA2 TIMES HAL,таЫтаБтабтаУтаБтаЗ
ЁТГУ,120D3,letter,CUNEIFORM SIGN GA2 TIMES HAL PLUS LA,таЫтаБтабтаУтаБтаЗтамтаЗтаБ
ЁТГФ,120D4,letter,CUNEIFORM SIGN GA2 TIMES HI PLUS LI,таЫтаБтабтаУтаКтамтаЗтаК
ЁТГХ,120D5,letter,CUNEIFORM SIGN GA2 TIMES HUB2,таЫтаБтабтаУтаетаГ
ЁТГЦ,120D6,letter,CUNEIFORM SIGN GA2 TIMES IGI GUNU,таЫтаБтабтаКтаЫтаК таЫтаетаЭтае
ЁТГЧ,120D7,letter,CUNEIFORM SIGN GA2 TIMES ISH PLUS HU PLUS ASH,таЫтаБтабтаКтайтамтаУтаетамтаБтай
ЁТГШ,120D8,letter,CUNEIFORM SIGN GA2 TIMES KAK,таЫтаБтабтаЕтаБтаЕ
ЁТГЩ,120D9,letter,CUNEIFORM SIGN GA2 TIMES KASKAL,таЫтаБтабтаЕтаБтаОтаЕтаБтаЗ
ЁТГЪ,120DA,letter,CUNEIFORM SIGN GA2 TIMES KID,таЫтаБтабтаЕтаКтаЩ
ЁТГЫ,120DB,letter,CUNEIFORM SIGN GA2 TIMES KID PLUS LAL,таЫтаБтабтаЕтаКтаЩтамтаЗтаБтаЗ
ЁТГЬ,120DC,letter,CUNEIFORM SIGN GA2 TIMES KU3 PLUS AN,таЫтаБтабтаЕтаетаТтамтаБтаЭ
ЁТГЭ,120DD,letter,CUNEIFORM SIGN GA2 TIMES LA,таЫтаБтабтаЗтаБ
ЁТГЮ,120DE,letter,CUNEIFORM SIGN GA2 TIMES ME PLUS EN,таЫтаБтабтаНтаСтамтаСтаЭ
ЁТГЯ,120DF,letter,CUNEIFORM SIGN GA2 TIMES MI,таЫтаБтабтаНтаК
ЁТГа,120,letter,CUNEIFORM SIGN GA2 TIMES NUN,таЫтаБтабтаЭтаетаЭ
ЁТГб,1200,letter,CUNEIFORM SIGN GA2 TIMES NUN OVER NUN,таЫтаБтабтаЭтаетаЭтаМтаЭтаетаЭ
ЁТГв,12000,letter,CUNEIFORM SIGN GA2 TIMES PA,таЫтаБтабтаПтаБ
ЁТГг,120000,letter,CUNEIFORM SIGN GA2 TIMES SAL,таЫтаБтабтаОтаБтаЗ
ЁТГд,1200000,letter,CUNEIFORM SIGN GA2 TIMES SAR,таЫтаБтабтаОтаЬ
ЁТГе,12000000,letter,CUNEIFORM SIGN GA2 TIMES SHE,таЫтаБтабтайтаС
ЁТГж,120000000,letter,CUNEIFORM SIGN GA2 TIMES SHE PLUS TUR,таЫтаБтабтайтаСтамтаЮтаетаЧ
ЁТГз,1200000000,letter,CUNEIFORM SIGN GA2 TIMES SHID,таЫтаБтабтайтаКтаЩ
ЁТГи,12000000000,letter,CUNEIFORM SIGN GA2 TIMES SUM,таЫтаБтабтаОтаетаН
ЁТГй,120000000000,letter,CUNEIFORM SIGN GA2 TIMES TAK4,таЫтаБтабтаЮтаБтаЕта▓
ЁТГк,120EA,letter,CUNEIFORM SIGN GA2 TIMES U,таЫтаБтабтае
ЁТГл,120EB,letter,CUNEIFORM SIGN GA2 TIMES UD,таЫтаБтабтаетаЩ
ЁТГм,120EC,letter,CUNEIFORM SIGN GA2 TIMES UD PLUS DU,таЫтаБтабтаетаЩтамтаЩтае
ЁТГн,120ED,letter,CUNEIFORM SIGN GA2 OVER GA2,таЫтаБтаМтаЫтаБ
ЁТГо,120EE,letter,CUNEIFORM SIGN GABA,таЫтаБтаГтаБ
ЁТГп,120EF,letter,CUNEIFORM SIGN GABA CROSSING GABA,таЫтаБтаГтаБтаптаЫтаБтаГтаБ
ЁТГ░,120F0,letter,CUNEIFORM SIGN GAD,таЫтаБтаЩ
ЁТГ▒,120F1,letter,CUNEIFORM SIGN GAD OVER GAD GAR OVER GAR,таЫтаБтаЩтаМтаЫтаБтаЩ таЫтаЬтаМтаЫтаЬ
ЁТГ▓,120F2,letter,CUNEIFORM SIGN GAL,таЫтаБтаЗ
ЁТГ│,120F3,letter,CUNEIFORM SIGN GAL GAD OVER GAD GAR OVER GAR,таЫтаБтаЗ таЫтаБтаЩтаМтаЫтаБтаЩ таЫтаЬтаМтаЫтаЬ
ЁТГ┤,120F4,letter,CUNEIFORM SIGN GALAM,таЫтаБтаЗтаБтаН
ЁТГ╡,120F5,letter,CUNEIFORM SIGN GAM,таЫтаБтаН
ЁТГ╢,120F6,letter,CUNEIFORM SIGN GAN,таЫтаБтаЭ
ЁТГ╖,120F7,letter,CUNEIFORM SIGN GAN2,таЫтаБтаЭ
ЁТГ╕,120F8,letter,CUNEIFORM SIGN GAN2 TENU,таЫтаБтаЭ таЮтаСтаЭтае
ЁТГ╣,120F9,letter,CUNEIFORM SIGN GAN2 OVER GAN2,таЫтаБтаЭтаМтаЫтаБтаЭ
ЁТГ║,120FA,letter,CUNEIFORM SIGN GAN2 CROSSING GAN2,таЫтаБтаЭтаптаЫтаБтаЭ
ЁТГ╗,120FB,letter,CUNEIFORM SIGN GAR,таЫтаЬ
ЁТГ╝,120FC,letter,CUNEIFORM SIGN GAR3,таЫтаЬтаТ
ЁТГ╜,120FD,letter,CUNEIFORM SIGN GASHAN,таЫтаБтайтаБтаЭ
ЁТГ╛,120FE,letter,CUNEIFORM SIGN GESHTIN,таЫтаСтайтаЮтаКтаЭ
ЁТГ┐,120FF,letter,CUNEIFORM SIGN GESHTIN TIMES KUR,таЫтаСтайтаЮтаКтаЭтабтаЕтаетаЧ
ЁТДА,12100,letter,CUNEIFORM SIGN GI,таЫтаК
ЁТДБ,12101,letter,CUNEIFORM SIGN GI TIMES E,таЫтаКтабтаС
ЁТДВ,12102,letter,CUNEIFORM SIGN GI TIMES U,таЫтаКтабтае
ЁТДГ,12103,letter,CUNEIFORM SIGN GI CROSSING GI,таЫтаКтаптаЫтаК
ЁТДД,12104,letter,CUNEIFORM SIGN GI4,таЫтаКта▓
ЁТДЕ,12105,letter,CUNEIFORM SIGN GI4 OVER GI4,таЫтаКта▓таМтаЫтаКта▓
ЁТДЖ,12106,letter,CUNEIFORM SIGN GI4 CROSSING GI4,таЫтаКта▓таптаЫтаКта▓
ЁТДЗ,12107,letter,CUNEIFORM SIGN GIDIM,таЫтаКтаЩтаКтаН
ЁТДИ,12108,letter,CUNEIFORM SIGN GIR2,таЫтаКтаЧ
ЁТДЙ,12109,letter,CUNEIFORM SIGN GIR2 GUNU,таЫтаКтаЧ таЫтаетаЭтае
ЁТДК,1210A,letter,CUNEIFORM SIGN GIR3,таЫтаКтаЧтаТ
ЁТДЛ,1210B,letter,CUNEIFORM SIGN GIR3 TIMES A PLUS IGI,таЫтаКтаЧтаТтабтаБтамтаКтаЫтаК
ЁТДМ,1210C,letter,CUNEIFORM SIGN GIR3 TIMES GAN2 TENU,таЫтаКтаЧтаТтабтаЫтаБтаЭ таЮтаСтаЭтае
ЁТДН,1210D,letter,CUNEIFORM SIGN GIR3 TIMES IGI,таЫтаКтаЧтаТтабтаКтаЫтаК
ЁТДО,1210E,letter,CUNEIFORM SIGN GIR3 TIMES LU PLUS IGI,таЫтаКтаЧтаТтабтаЗтаетамтаКтаЫтаК
ЁТДП,1210F,letter,CUNEIFORM SIGN GIR3 TIMES PA,таЫтаКтаЧтаТтабтаПтаБ
ЁТДР,12110,letter,CUNEIFORM SIGN GISAL,таЫтаКтаОтаБтаЗ
ЁТДС,12111,letter,CUNEIFORM SIGN GISH,таЫтаКтай
ЁТДТ,12112,letter,CUNEIFORM SIGN GISH CROSSING GISH,таЫтаКтайтаптаЫтаКтай
ЁТДУ,12113,letter,CUNEIFORM SIGN GISH TIMES BAD,таЫтаКтайтабтаГтаБтаЩ
ЁТДФ,12114,letter,CUNEIFORM SIGN GISH TIMES TAK4,таЫтаКтайтабтаЮтаБтаЕта▓
ЁТДХ,12115,letter,CUNEIFORM SIGN GISH TENU,таЫтаКтай таЮтаСтаЭтае
ЁТДЦ,12116,letter,CUNEIFORM SIGN GU,таЫтае
ЁТДЧ,12117,letter,CUNEIFORM SIGN GU CROSSING GU,таЫтаетаптаЫтае
