Character,Hex,Type,Name,Braille
ЁТДШ,12118,letter,CUNEIFORM SIGN GU2,таЫтае
ЁТДЩ,12119,letter,CUNEIFORM SIGN GU2 TIMES KAK,таЫтаетабтаЕтаБтаЕ
ЁТДЪ,1211A,letter,CUNEIFORM SIGN GU2 TIMES KAK TIMES IGI GUNU,таЫтаетабтаЕтаБтаЕтабтаКтаЫтаК таЫтаетаЭтае
ЁТДЫ,1211B,letter,CUNEIFORM SIGN GU2 TIMES NUN,таЫтаетабтаЭтаетаЭ
ЁТДЬ,1211C,letter,CUNEIFORM SIGN GU2 TIMES SAL PLUS TUG2,таЫтаетабтаОтаБтаЗтамтаЮтаетаЫ
ЁТДЭ,1211D,letter,CUNEIFORM SIGN GU2 GUNU,таЫтае таЫтаетаЭтае
ЁТДЮ,1211E,letter,CUNEIFORM SIGN GUD,таЫтаетаЩ
ЁТДЯ,1211F,letter,CUNEIFORM SIGN GUD TIMES A PLUS KUR,таЫтаетаЩтабтаБтамтаЕтаетаЧ
ЁТДа,12120,letter,CUNEIFORM SIGN GUD TIMES KUR,таЫтаетаЩтабтаЕтаетаЧ
ЁТДб,12121,letter,CUNEIFORM SIGN GUD OVER GUD LUGAL,таЫтаетаЩтаМтаЫтаетаЩ таЗтаетаЫтаБтаЗ
ЁТДв,12122,letter,CUNEIFORM SIGN GUL,таЫтаетаЗ
ЁТДг,12123,letter,CUNEIFORM SIGN GUM,таЫтаетаН
ЁТДд,12124,letter,CUNEIFORM SIGN GUM TIMES SHE,таЫтаетаНтабтайтаС
ЁТДе,12125,letter,CUNEIFORM SIGN GUR,таЫтаетаЧ
ЁТДж,12126,letter,CUNEIFORM SIGN GUR7,таЫтаетаЧта╢
ЁТДз,12127,letter,CUNEIFORM SIGN GURUN,таЫтаетаЧтаетаЭ
ЁТДи,12128,letter,CUNEIFORM SIGN GURUSH,таЫтаетаЧтаетай
ЁТДй,12129,letter,CUNEIFORM SIGN HA,таУтаБ
ЁТДк,1212A,letter,CUNEIFORM SIGN HA TENU,таУтаБ таЮтаСтаЭтае
ЁТДл,1212B,letter,CUNEIFORM SIGN HA GUNU,таУтаБ таЫтаетаЭтае
ЁТДм,1212C,letter,CUNEIFORM SIGN HAL,таУтаБтаЗ
ЁТДн,1212D,letter,CUNEIFORM SIGN HI,таУтаК
ЁТДо,1212E,letter,CUNEIFORM SIGN HI TIMES ASH,таУтаКтабтаБтай
ЁТДп,1212F,letter,CUNEIFORM SIGN HI TIMES ASH2,таУтаКтабтаБтай
ЁТД░,12130,letter,CUNEIFORM SIGN HI TIMES BAD,таУтаКтабтаГтаБтаЩ
ЁТД▒,12131,letter,CUNEIFORM SIGN HI TIMES DISH,таУтаКтабтаЩтаКтай
ЁТД▓,12132,letter,CUNEIFORM SIGN HI TIMES GAD,таУтаКтабтаЫтаБтаЩ
ЁТД│,12133,letter,CUNEIFORM SIGN HI TIMES KIN,таУтаКтабтаЕтаКтаЭ
ЁТД┤,12134,letter,CUNEIFORM SIGN HI TIMES NUN,таУтаКтабтаЭтаетаЭ
ЁТД╡,12135,letter,CUNEIFORM SIGN HI TIMES SHE,таУтаКтабтайтаС
ЁТД╢,12136,letter,CUNEIFORM SIGN HI TIMES U,таУтаКтабтае
ЁТД╖,12137,letter,CUNEIFORM SIGN HU,таУтае
ЁТД╕,12138,letter,CUNEIFORM SIGN HUB2,таУтаетаГ
ЁТД╣,12139,letter,CUNEIFORM SIGN HUB2 TIMES AN,таУтаетаГтабтаБтаЭ
ЁТД║,1213A,letter,CUNEIFORM SIGN HUB2 TIMES HAL,таУтаетаГтабтаУтаБтаЗ
ЁТД╗,1213B,letter,CUNEIFORM SIGN HUB2 TIMES KASKAL,таУтаетаГтабтаЕтаБтаОтаЕтаБтаЗ
ЁТД╝,1213C,letter,CUNEIFORM SIGN HUB2 TIMES LISH,таУтаетаГтабтаЗтаКтай
ЁТД╜,1213D,letter,CUNEIFORM SIGN HUB2 TIMES UD,таУтаетаГтабтаетаЩ
ЁТД╛,1213E,letter,CUNEIFORM SIGN HUL2,таУтаетаЗ
ЁТД┐,1213F,letter,CUNEIFORM SIGN I,таК
ЁТЕА,12140,letter,CUNEIFORM SIGN I A,таК таБ
ЁТЕБ,12141,letter,CUNEIFORM SIGN IB,таКтаГ
ЁТЕВ,12142,letter,CUNEIFORM SIGN IDIM,таКтаЩтаКтаН
ЁТЕГ,12143,letter,CUNEIFORM SIGN IDIM OVER IDIM BUR,таКтаЩтаКтаНтаМтаКтаЩтаКтаН таГтаетаЧ
ЁТЕД,12144,letter,CUNEIFORM SIGN IDIM OVER IDIM SQUARED,таКтаЩтаКтаНтаМтаКтаЩтаКтаНтаШта╕
ЁТЕЕ,12145,letter,CUNEIFORM SIGN IG,таКтаЫ
ЁТЕЖ,12146,letter,CUNEIFORM SIGN IGI,таКтаЫтаК
ЁТЕЗ,12147,letter,CUNEIFORM SIGN IGI DIB,таКтаЫтаК таЩтаКтаГ
ЁТЕИ,12148,letter,CUNEIFORM SIGN IGI RI,таКтаЫтаК таЧтаК
ЁТЕЙ,12149,letter,CUNEIFORM SIGN IGI OVER IGI SHIR OVER SHIR UD OVER UD,таКтаЫтаКтаМтаКтаЫтаК тайтаКтаЧтаМтайтаКтаЧ таетаЩтаМтаетаЩ
ЁТЕК,1214A,letter,CUNEIFORM SIGN IGI GUNU,таКтаЫтаК таЫтаетаЭтае
ЁТЕЛ,1214B,letter,CUNEIFORM SIGN IL,таКтаЗ
ЁТЕМ,1214C,letter,CUNEIFORM SIGN IL TIMES GAN2 TENU,таКтаЗтабтаЫтаБтаЭ таЮтаСтаЭтае
ЁТЕН,1214D,letter,CUNEIFORM SIGN IL2,таКтаЗ
ЁТЕО,1214E,letter,CUNEIFORM SIGN IM,таКтаН
ЁТЕП,1214F,letter,CUNEIFORM SIGN IM TIMES TAK4,таКтаНтабтаЮтаБтаЕта▓
ЁТЕР,12150,letter,CUNEIFORM SIGN IM CROSSING IM,таКтаНтаптаКтаН
ЁТЕС,12151,letter,CUNEIFORM SIGN IM OPPOSING IM,таКтаНталтаКтаН
ЁТЕТ,12152,letter,CUNEIFORM SIGN IM SQUARED,таКтаНтаШта╕
ЁТЕУ,12153,letter,CUNEIFORM SIGN IMIN,таКтаНтаКтаЭ
ЁТЕФ,12154,letter,CUNEIFORM SIGN IN,таКтаЭ
ЁТЕХ,12155,letter,CUNEIFORM SIGN IR,таКтаЧ
ЁТЕЦ,12156,letter,CUNEIFORM SIGN ISH,таКтай
ЁТЕЧ,12157,letter,CUNEIFORM SIGN KA,таЕтаБ
ЁТЕШ,12158,letter,CUNEIFORM SIGN KA TIMES A,таЕтаБтабтаБ
ЁТЕЩ,12159,letter,CUNEIFORM SIGN KA TIMES AD,таЕтаБтабтаБтаЩ
ЁТЕЪ,1215A,letter,CUNEIFORM SIGN KA TIMES AD PLUS KU3,таЕтаБтабтаБтаЩтамтаЕтаетаТ
ЁТЕЫ,1215B,letter,CUNEIFORM SIGN KA TIMES ASH2,таЕтаБтабтаБтай
ЁТЕЬ,1215C,letter,CUNEIFORM SIGN KA TIMES BAD,таЕтаБтабтаГтаБтаЩ
ЁТЕЭ,1215D,letter,CUNEIFORM SIGN KA TIMES BALAG,таЕтаБтабтаГтаБтаЗтаБтаЫ
ЁТЕЮ,1215E,letter,CUNEIFORM SIGN KA TIMES BAR,таЕтаБтабтаГтаЬ
ЁТЕЯ,1215F,letter,CUNEIFORM SIGN KA TIMES BI,таЕтаБтабтаГтаК
ЁТЕа,12160,letter,CUNEIFORM SIGN KA TIMES ERIN2,таЕтаБтабтаСтаЧтаКтаЭ
ЁТЕб,12161,letter,CUNEIFORM SIGN KA TIMES ESH2,таЕтаБтабтаСтай
ЁТЕв,12162,letter,CUNEIFORM SIGN KA TIMES GA,таЕтаБтабтаЫтаБ
ЁТЕг,12163,letter,CUNEIFORM SIGN KA TIMES GAL,таЕтаБтабтаЫтаБтаЗ
ЁТЕд,12164,letter,CUNEIFORM SIGN KA TIMES GAN2 TENU,таЕтаБтабтаЫтаБтаЭ таЮтаСтаЭтае
ЁТЕе,12165,letter,CUNEIFORM SIGN KA TIMES GAR,таЕтаБтабтаЫтаЬ
ЁТЕж,12166,letter,CUNEIFORM SIGN KA TIMES GAR PLUS SHA3 PLUS A,таЕтаБтабтаЫтаЬтамтайтаБтаТтамтаБ
ЁТЕз,12167,letter,CUNEIFORM SIGN KA TIMES GI,таЕтаБтабтаЫтаК
ЁТЕи,12168,letter,CUNEIFORM SIGN KA TIMES GIR2,таЕтаБтабтаЫтаКтаЧ
ЁТЕй,12169,letter,CUNEIFORM SIGN KA TIMES GISH PLUS SAR,таЕтаБтабтаЫтаКтайтамтаОтаЬ
ЁТЕк,1216A,letter,CUNEIFORM SIGN KA TIMES GISH CROSSING GISH,таЕтаБтабтаЫтаКтайтаптаЫтаКтай
ЁТЕл,1216B,letter,CUNEIFORM SIGN KA TIMES GU,таЕтаБтабтаЫтае
ЁТЕм,1216C,letter,CUNEIFORM SIGN KA TIMES GUR7,таЕтаБтабтаЫтаетаЧта╢
ЁТЕн,1216D,letter,CUNEIFORM SIGN KA TIMES IGI,таЕтаБтабтаКтаЫтаК
ЁТЕо,1216E,letter,CUNEIFORM SIGN KA TIMES IM,таЕтаБтабтаКтаН
ЁТЕп,1216F,letter,CUNEIFORM SIGN KA TIMES KAK,таЕтаБтабтаЕтаБтаЕ
ЁТЕ░,12170,letter,CUNEIFORM SIGN KA TIMES KI,таЕтаБтабтаЕтаК
ЁТЕ▒,12171,letter,CUNEIFORM SIGN KA TIMES KID,таЕтаБтабтаЕтаКтаЩ
ЁТЕ▓,12172,letter,CUNEIFORM SIGN KA TIMES LI,таЕтаБтабтаЗтаК
ЁТЕ│,12173,letter,CUNEIFORM SIGN KA TIMES LU,таЕтаБтабтаЗтае
ЁТЕ┤,12174,letter,CUNEIFORM SIGN KA TIMES ME,таЕтаБтабтаНтаС
ЁТЕ╡,12175,letter,CUNEIFORM SIGN KA TIMES ME PLUS DU,таЕтаБтабтаНтаСтамтаЩтае
ЁТЕ╢,12176,letter,CUNEIFORM SIGN KA TIMES ME PLUS GI,таЕтаБтабтаНтаСтамтаЫтаК
ЁТЕ╖,12177,letter,CUNEIFORM SIGN KA TIMES ME PLUS TE,таЕтаБтабтаНтаСтамтаЮтаС
ЁТЕ╕,12178,letter,CUNEIFORM SIGN KA TIMES MI,таЕтаБтабтаНтаК
ЁТЕ╣,12179,letter,CUNEIFORM SIGN KA TIMES MI PLUS NUNUZ,таЕтаБтабтаНтаКтамтаЭтаетаЭтае
ЁТЕ║,1217A,letter,CUNEIFORM SIGN KA TIMES NE,таЕтаБтабтаЭтаС
ЁТЕ╗,1217B,letter,CUNEIFORM SIGN KA TIMES NUN,таЕтаБтабтаЭтаетаЭ
ЁТЕ╝,1217C,letter,CUNEIFORM SIGN KA TIMES PI,таЕтаБтабтаПтаК
ЁТЕ╜,1217D,letter,CUNEIFORM SIGN KA TIMES RU,таЕтаБтабтаЧтае
ЁТЕ╛,1217E,letter,CUNEIFORM SIGN KA TIMES SA,таЕтаБтабтаОтаБ
ЁТЕ┐,1217F,letter,CUNEIFORM SIGN KA TIMES SAR,таЕтаБтабтаОтаЬ
ЁТЖА,12180,letter,CUNEIFORM SIGN KA TIMES SHA,таЕтаБтабтайтаБ
ЁТЖБ,12181,letter,CUNEIFORM SIGN KA TIMES SHE,таЕтаБтабтайтаС
ЁТЖВ,12182,letter,CUNEIFORM SIGN KA TIMES SHID,таЕтаБтабтайтаКтаЩ
ЁТЖГ,12183,letter,CUNEIFORM SIGN KA TIMES SHU,таЕтаБтабтайтае
ЁТЖД,12184,letter,CUNEIFORM SIGN KA TIMES SIG,таЕтаБтабтаОтаКтаЫ
ЁТЖЕ,12185,letter,CUNEIFORM SIGN KA TIMES SUHUR,таЕтаБтабтаОтаетаУтаетаЧ
ЁТЖЖ,12186,letter,CUNEIFORM SIGN KA TIMES TAR,таЕтаБтабтаЮтаЬ
ЁТЖЗ,12187,letter,CUNEIFORM SIGN KA TIMES U,таЕтаБтабтае
ЁТЖИ,12188,letter,CUNEIFORM SIGN KA TIMES U2,таЕтаБтабтае
ЁТЖЙ,12189,letter,CUNEIFORM SIGN KA TIMES UD,таЕтаБтабтаетаЩ
ЁТЖК,1218A,letter,CUNEIFORM SIGN KA TIMES UMUM TIMES PA,таЕтаБтабтаетаНтаетаНтабтаПтаБ
ЁТЖЛ,1218B,letter,CUNEIFORM SIGN KA TIMES USH,таЕтаБтабтаетай
ЁТЖМ,1218C,letter,CUNEIFORM SIGN KA TIMES ZI,таЕтаБтабта╡таК
ЁТЖН,1218D,letter,CUNEIFORM SIGN KA2,таЕтаБ
ЁТЖО,1218E,letter,CUNEIFORM SIGN KA2 CROSSING KA2,таЕтаБтаптаЕтаБ
ЁТЖП,1218F,letter,CUNEIFORM SIGN KAB,таЕтаБтаГ
ЁТЖР,12190,letter,CUNEIFORM SIGN KAD2,таЕтаБтаЩ
ЁТЖС,12191,letter,CUNEIFORM SIGN KAD3,таЕтаБтаЩтаТ
ЁТЖТ,12192,letter,CUNEIFORM SIGN KAD4,таЕтаБтаЩта▓
ЁТЖУ,12193,letter,CUNEIFORM SIGN KAD5,таЕтаБтаЩтав
ЁТЖФ,12194,letter,CUNEIFORM SIGN KAD5 OVER KAD5,таЕтаБтаЩтавтаМтаЕтаБтаЩтав
ЁТЖХ,12195,letter,CUNEIFORM SIGN KAK,таЕтаБтаЕ
ЁТЖЦ,12196,letter,CUNEIFORM SIGN KAK TIMES IGI GUNU,таЕтаБтаЕтабтаКтаЫтаК таЫтаетаЭтае
ЁТЖЧ,12197,letter,CUNEIFORM SIGN KAL,таЕтаБтаЗ
ЁТЖШ,12198,letter,CUNEIFORM SIGN KAL TIMES BAD,таЕтаБтаЗтабтаГтаБтаЩ
ЁТЖЩ,12199,letter,CUNEIFORM SIGN KAL CROSSING KAL,таЕтаБтаЗтаптаЕтаБтаЗ
ЁТЖЪ,1219A,letter,CUNEIFORM SIGN KAM2,таЕтаБтаН
ЁТЖЫ,1219B,letter,CUNEIFORM SIGN KAM4,таЕтаБтаНта▓
ЁТЖЬ,1219C,letter,CUNEIFORM SIGN KASKAL,таЕтаБтаОтаЕтаБтаЗ
ЁТЖЭ,1219D,letter,CUNEIFORM SIGN KASKAL LAGAB TIMES U OVER LAGAB TIMES U,таЕтаБтаОтаЕтаБтаЗ таЗтаБтаЫтаБтаГтабтаетаМтаЗтаБтаЫтаБтаГтабтае
ЁТЖЮ,1219E,letter,CUNEIFORM SIGN KASKAL OVER KASKAL LAGAB TIMES U OVER LAGAB TIMES U,таЕтаБтаОтаЕтаБтаЗтаМтаЕтаБтаОтаЕтаБтаЗ таЗтаБтаЫтаБтаГтабтаетаМтаЗтаБтаЫтаБтаГтабтае
ЁТЖЯ,1219F,letter,CUNEIFORM SIGN KESH2,таЕтаСтай
ЁТЖа,121A0,letter,CUNEIFORM SIGN KI,таЕтаК
ЁТЖб,121A1,letter,CUNEIFORM SIGN KI TIMES BAD,таЕтаКтабтаГтаБтаЩ
ЁТЖв,121A2,letter,CUNEIFORM SIGN KI TIMES U,таЕтаКтабтае
ЁТЖг,121A3,letter,CUNEIFORM SIGN KI TIMES UD,таЕтаКтабтаетаЩ
ЁТЖд,121A4,letter,CUNEIFORM SIGN KID,таЕтаКтаЩ
ЁТЖе,121A5,letter,CUNEIFORM SIGN KIN,таЕтаКтаЭ
ЁТЖж,121A6,letter,CUNEIFORM SIGN KISAL,таЕтаКтаОтаБтаЗ
ЁТЖз,121A7,letter,CUNEIFORM SIGN KISH,таЕтаКтай
ЁТЖи,121A8,letter,CUNEIFORM SIGN KISIM5,таЕтаКтаОтаКтаНтав
ЁТЖй,121A9,letter,CUNEIFORM SIGN KISIM5 OVER KISIM5,таЕтаКтаОтаКтаНтавтаМтаЕтаКтаОтаКтаНтав
ЁТЖк,121AA,letter,CUNEIFORM SIGN KU,таЕтае
ЁТЖл,121AB,letter,CUNEIFORM SIGN KU OVER HI TIMES ASH2 KU OVER HI TIMES ASH2,таЕтаетаМтаУтаКтабтаБтай таЕтаетаМтаУтаКтабтаБтай
ЁТЖм,121AC,letter,CUNEIFORM SIGN KU3,таЕтаетаТ
ЁТЖн,121AD,letter,CUNEIFORM SIGN KU4,таЕтаета▓
ЁТЖо,121AE,letter,CUNEIFORM SIGN KU4 VARIANT FORM,таЕтаета▓ тазтаЬтаКтаБтаЭтаЮ таЛтаХтаЧтаН
ЁТЖп,121AF,letter,CUNEIFORM SIGN KU7,таЕтаета╢
ЁТЖ░,121B0,letter,CUNEIFORM SIGN KUL,таЕтаетаЗ
ЁТЖ▒,121B1,letter,CUNEIFORM SIGN KUL GUNU,таЕтаетаЗ таЫтаетаЭтае
ЁТЖ▓,121B2,letter,CUNEIFORM SIGN KUN,таЕтаетаЭ
ЁТЖ│,121B3,letter,CUNEIFORM SIGN KUR,таЕтаетаЧ
ЁТЖ┤,121B4,letter,CUNEIFORM SIGN KUR OPPOSING KUR,таЕтаетаЧталтаЕтаетаЧ
ЁТЖ╡,121B5,letter,CUNEIFORM SIGN KUSHU2,таЕтаетайтае
ЁТЖ╢,121B6,letter,CUNEIFORM SIGN KWU318,таЕта║таетаТтаВтаж
ЁТЖ╖,121B7,letter,CUNEIFORM SIGN LA,таЗтаБ
ЁТЖ╕,121B8,letter,CUNEIFORM SIGN LAGAB,таЗтаБтаЫтаБтаГ
ЁТЖ╣,121B9,letter,CUNEIFORM SIGN LAGAB TIMES A,таЗтаБтаЫтаБтаГтабтаБ
ЁТЖ║,121BA,letter,CUNEIFORM SIGN LAGAB TIMES A PLUS DA PLUS HA,таЗтаБтаЫтаБтаГтабтаБтамтаЩтаБтамтаУтаБ
ЁТЖ╗,121BB,letter,CUNEIFORM SIGN LAGAB TIMES A PLUS GAR,таЗтаБтаЫтаБтаГтабтаБтамтаЫтаЬ
ЁТЖ╝,121BC,letter,CUNEIFORM SIGN LAGAB TIMES A PLUS LAL,таЗтаБтаЫтаБтаГтабтаБтамтаЗтаБтаЗ
ЁТЖ╜,121BD,letter,CUNEIFORM SIGN LAGAB TIMES AL,таЗтаБтаЫтаБтаГтабтаБтаЗ
ЁТЖ╛,121BE,letter,CUNEIFORM SIGN LAGAB TIMES AN,таЗтаБтаЫтаБтаГтабтаБтаЭ
ЁТЖ┐,121BF,letter,CUNEIFORM SIGN LAGAB TIMES ASH ZIDA TENU,таЗтаБтаЫтаБтаГтабтаБтай та╡таКтаЩтаБ таЮтаСтаЭтае
ЁТЗА,121C0,letter,CUNEIFORM SIGN LAGAB TIMES BAD,таЗтаБтаЫтаБтаГтабтаГтаБтаЩ
ЁТЗБ,121C1,letter,CUNEIFORM SIGN LAGAB TIMES BI,таЗтаБтаЫтаБтаГтабтаГтаК
ЁТЗВ,121C2,letter,CUNEIFORM SIGN LAGAB TIMES DAR,таЗтаБтаЫтаБтаГтабтаЩтаЬ
ЁТЗГ,121C3,letter,CUNEIFORM SIGN LAGAB TIMES EN,таЗтаБтаЫтаБтаГтабтаСтаЭ
ЁТЗД,121C4,letter,CUNEIFORM SIGN LAGAB TIMES GA,таЗтаБтаЫтаБтаГтабтаЫтаБ
ЁТЗЕ,121C5,letter,CUNEIFORM SIGN LAGAB TIMES GAR,таЗтаБтаЫтаБтаГтабтаЫтаЬ
ЁТЗЖ,121C6,letter,CUNEIFORM SIGN LAGAB TIMES GUD,таЗтаБтаЫтаБтаГтабтаЫтаетаЩ
ЁТЗЗ,121C7,letter,CUNEIFORM SIGN LAGAB TIMES GUD PLUS GUD,таЗтаБтаЫтаБтаГтабтаЫтаетаЩтамтаЫтаетаЩ
ЁТЗИ,121C8,letter,CUNEIFORM SIGN LAGAB TIMES HA,таЗтаБтаЫтаБтаГтабтаУтаБ
ЁТЗЙ,121C9,letter,CUNEIFORM SIGN LAGAB TIMES HAL,таЗтаБтаЫтаБтаГтабтаУтаБтаЗ
ЁТЗК,121CA,letter,CUNEIFORM SIGN LAGAB TIMES HI TIMES NUN,таЗтаБтаЫтаБтаГтабтаУтаКтабтаЭтаетаЭ
ЁТЗЛ,121CB,letter,CUNEIFORM SIGN LAGAB TIMES IGI GUNU,таЗтаБтаЫтаБтаГтабтаКтаЫтаК таЫтаетаЭтае
ЁТЗМ,121CC,letter,CUNEIFORM SIGN LAGAB TIMES IM,таЗтаБтаЫтаБтаГтабтаКтаН
ЁТЗН,121CD,letter,CUNEIFORM SIGN LAGAB TIMES IM PLUS HA,таЗтаБтаЫтаБтаГтабтаКтаНтамтаУтаБ
ЁТЗО,121CE,letter,CUNEIFORM SIGN LAGAB TIMES IM PLUS LU,таЗтаБтаЫтаБтаГтабтаКтаНтамтаЗтае
ЁТЗП,121CF,letter,CUNEIFORM SIGN LAGAB TIMES KI,таЗтаБтаЫтаБтаГтабтаЕтаК
ЁТЗР,121D0,letter,CUNEIFORM SIGN LAGAB TIMES KIN,таЗтаБтаЫтаБтаГтабтаЕтаКтаЭ
ЁТЗС,121D1,letter,CUNEIFORM SIGN LAGAB TIMES KU3,таЗтаБтаЫтаБтаГтабтаЕтаетаТ
ЁТЗТ,121D2,letter,CUNEIFORM SIGN LAGAB TIMES KUL,таЗтаБтаЫтаБтаГтабтаЕтаетаЗ
ЁТЗУ,121D3,letter,CUNEIFORM SIGN LAGAB TIMES KUL PLUS HI PLUS A,таЗтаБтаЫтаБтаГтабтаЕтаетаЗтамтаУтаКтамтаБ
ЁТЗФ,121D4,letter,CUNEIFORM SIGN LAGAB TIMES LAGAB,таЗтаБтаЫтаБтаГтабтаЗтаБтаЫтаБтаГ
ЁТЗХ,121D5,letter,CUNEIFORM SIGN LAGAB TIMES LISH,таЗтаБтаЫтаБтаГтабтаЗтаКтай
ЁТЗЦ,121D6,letter,CUNEIFORM SIGN LAGAB TIMES LU,таЗтаБтаЫтаБтаГтабтаЗтае
ЁТЗЧ,121D7,letter,CUNEIFORM SIGN LAGAB TIMES LUL,таЗтаБтаЫтаБтаГтабтаЗтаетаЗ
ЁТЗШ,121D8,letter,CUNEIFORM SIGN LAGAB TIMES ME,таЗтаБтаЫтаБтаГтабтаНтаС
ЁТЗЩ,121D9,letter,CUNEIFORM SIGN LAGAB TIMES ME PLUS EN,таЗтаБтаЫтаБтаГтабтаНтаСтамтаСтаЭ
ЁТЗЪ,121DA,letter,CUNEIFORM SIGN LAGAB TIMES MUSH,таЗтаБтаЫтаБтаГтабтаНтаетай
ЁТЗЫ,121DB,letter,CUNEIFORM SIGN LAGAB TIMES NE,таЗтаБтаЫтаБтаГтабтаЭтаС
ЁТЗЬ,121DC,letter,CUNEIFORM SIGN LAGAB TIMES SHE PLUS SUM,таЗтаБтаЫтаБтаГтабтайтаСтамтаОтаетаН
ЁТЗЭ,121DD,letter,CUNEIFORM SIGN LAGAB TIMES SHITA PLUS GISH PLUS ERIN2,таЗтаБтаЫтаБтаГтабтайтаКтаЮтаБтамтаЫтаКтайтамтаСтаЧтаКтаЭ
ЁТЗЮ,121DE,letter,CUNEIFORM SIGN LAGAB TIMES SHITA PLUS GISH TENU,таЗтаБтаЫтаБтаГтабтайтаКтаЮтаБтамтаЫтаКтай таЮтаСтаЭтае
ЁТЗЯ,121DF,letter,CUNEIFORM SIGN LAGAB TIMES SHU2,таЗтаБтаЫтаБтаГтабтайтае
ЁТЗа,121,letter,CUNEIFORM SIGN LAGAB TIMES SHU2 PLUS SHU2,таЗтаБтаЫтаБтаГтабтайтаетамтайтае
ЁТЗб,1210,letter,CUNEIFORM SIGN LAGAB TIMES SUM,таЗтаБтаЫтаБтаГтабтаОтаетаН
ЁТЗв,12100,letter,CUNEIFORM SIGN LAGAB TIMES TAG,таЗтаБтаЫтаБтаГтабтаЮтаБтаЫ
ЁТЗг,121000,letter,CUNEIFORM SIGN LAGAB TIMES TAK4,таЗтаБтаЫтаБтаГтабтаЮтаБтаЕта▓
ЁТЗд,1210000,letter,CUNEIFORM SIGN LAGAB TIMES TE PLUS A PLUS SU PLUS NA,таЗтаБтаЫтаБтаГтабтаЮтаСтамтаБтамтаОтаетамтаЭтаБ
ЁТЗе,12100000,letter,CUNEIFORM SIGN LAGAB TIMES U,таЗтаБтаЫтаБтаГтабтае
ЁТЗж,121000000,letter,CUNEIFORM SIGN LAGAB TIMES U PLUS A,таЗтаБтаЫтаБтаГтабтаетамтаБ
ЁТЗз,1210000000,letter,CUNEIFORM SIGN LAGAB TIMES U PLUS U PLUS U,таЗтаБтаЫтаБтаГтабтаетамтаетамтае
ЁТЗи,12100000000,letter,CUNEIFORM SIGN LAGAB TIMES U2 PLUS ASH,таЗтаБтаЫтаБтаГтабтаетамтаБтай
ЁТЗй,121000000000,letter,CUNEIFORM SIGN LAGAB TIMES UD,таЗтаБтаЫтаБтаГтабтаетаЩ
ЁТЗк,121EA,letter,CUNEIFORM SIGN LAGAB TIMES USH,таЗтаБтаЫтаБтаГтабтаетай
ЁТЗл,121EB,letter,CUNEIFORM SIGN LAGAB SQUARED,таЗтаБтаЫтаБтаГтаШта╕
ЁТЗм,121EC,letter,CUNEIFORM SIGN LAGAR,таЗтаБтаЫтаЬ
ЁТЗн,121ED,letter,CUNEIFORM SIGN LAGAR TIMES SHE,таЗтаБтаЫтаЬтабтайтаС
ЁТЗо,121EE,letter,CUNEIFORM SIGN LAGAR TIMES SHE PLUS SUM,таЗтаБтаЫтаЬтабтайтаСтамтаОтаетаН
ЁТЗп,121EF,letter,CUNEIFORM SIGN LAGAR GUNU,таЗтаБтаЫтаЬ таЫтаетаЭтае
ЁТЗ░,121F0,letter,CUNEIFORM SIGN LAGAR GUNU OVER LAGAR GUNU SHE,таЗтаБтаЫтаЬ таЫтаетаЭтаетаМтаЗтаБтаЫтаЬ таЫтаетаЭтае тайтаС
ЁТЗ▒,121F1,letter,CUNEIFORM SIGN LAHSHU,таЗтаБтаУтайтае
ЁТЗ▓,121F2,letter,CUNEIFORM SIGN LAL,таЗтаБтаЗ
ЁТЗ│,121F3,letter,CUNEIFORM SIGN LAL TIMES LAL,таЗтаБтаЗтабтаЗтаБтаЗ
ЁТЗ┤,121F4,letter,CUNEIFORM SIGN LAM,таЗтаБтаН
ЁТЗ╡,121F5,letter,CUNEIFORM SIGN LAM TIMES KUR,таЗтаБтаНтабтаЕтаетаЧ
ЁТЗ╢,121F6,letter,CUNEIFORM SIGN LAM TIMES KUR PLUS RU,таЗтаБтаНтабтаЕтаетаЧтамтаЧтае
ЁТЗ╖,121F7,letter,CUNEIFORM SIGN LI,таЗтаК
ЁТЗ╕,121F8,letter,CUNEIFORM SIGN LIL,таЗтаКтаЗ
ЁТЗ╣,121F9,letter,CUNEIFORM SIGN LIMMU2,таЗтаКтаНтаНтае
ЁТЗ║,121FA,letter,CUNEIFORM SIGN LISH,таЗтаКтай
ЁТЗ╗,121FB,letter,CUNEIFORM SIGN LU,таЗтае
ЁТЗ╝,121FC,letter,CUNEIFORM SIGN LU TIMES BAD,таЗтаетабтаГтаБтаЩ
ЁТЗ╜,121FD,letter,CUNEIFORM SIGN LU2,таЗтае
ЁТЗ╛,121FE,letter,CUNEIFORM SIGN LU2 TIMES AL,таЗтаетабтаБтаЗ
ЁТЗ┐,121FF,letter,CUNEIFORM SIGN LU2 TIMES BAD,таЗтаетабтаГтаБтаЩ
ЁТИА,12200,letter,CUNEIFORM SIGN LU2 TIMES ESH2,таЗтаетабтаСтай
ЁТИБ,12201,letter,CUNEIFORM SIGN LU2 TIMES ESH2 TENU,таЗтаетабтаСтай таЮтаСтаЭтае
ЁТИВ,12202,letter,CUNEIFORM SIGN LU2 TIMES GAN2 TENU,таЗтаетабтаЫтаБтаЭ таЮтаСтаЭтае
ЁТИГ,12203,letter,CUNEIFORM SIGN LU2 TIMES HI TIMES BAD,таЗтаетабтаУтаКтабтаГтаБтаЩ
ЁТИД,12204,letter,CUNEIFORM SIGN LU2 TIMES IM,таЗтаетабтаКтаН
ЁТИЕ,12205,letter,CUNEIFORM SIGN LU2 TIMES KAD2,таЗтаетабтаЕтаБтаЩ
ЁТИЖ,12206,letter,CUNEIFORM SIGN LU2 TIMES KAD3,таЗтаетабтаЕтаБтаЩтаТ
ЁТИЗ,12207,letter,CUNEIFORM SIGN LU2 TIMES KAD3 PLUS ASH,таЗтаетабтаЕтаБтаЩтаТтамтаБтай
ЁТИИ,12208,letter,CUNEIFORM SIGN LU2 TIMES KI,таЗтаетабтаЕтаК
ЁТИЙ,12209,letter,CUNEIFORM SIGN LU2 TIMES LA PLUS ASH,таЗтаетабтаЗтаБтамтаБтай
ЁТИК,1220A,letter,CUNEIFORM SIGN LU2 TIMES LAGAB,таЗтаетабтаЗтаБтаЫтаБтаГ
ЁТИЛ,1220B,letter,CUNEIFORM SIGN LU2 TIMES ME PLUS EN,таЗтаетабтаНтаСтамтаСтаЭ
ЁТИМ,1220C,letter,CUNEIFORM SIGN LU2 TIMES NE,таЗтаетабтаЭтаС
ЁТИН,1220D,letter,CUNEIFORM SIGN LU2 TIMES NU,таЗтаетабтаЭтае
ЁТИО,1220E,letter,CUNEIFORM SIGN LU2 TIMES SI PLUS ASH,таЗтаетабтаОтаКтамтаБтай
ЁТИП,1220F,letter,CUNEIFORM SIGN LU2 TIMES SIK2 PLUS BU,таЗтаетабтаОтаКтаЕтамтаГтае
ЁТИР,12210,letter,CUNEIFORM SIGN LU2 TIMES TUG2,таЗтаетабтаЮтаетаЫ
ЁТИС,12211,letter,CUNEIFORM SIGN LU2 TENU,таЗтае таЮтаСтаЭтае
ЁТИТ,12212,letter,CUNEIFORM SIGN LU2 CROSSING LU2,таЗтаетаптаЗтае
ЁТИУ,12213,letter,CUNEIFORM SIGN LU2 OPPOSING LU2,таЗтаеталтаЗтае
ЁТИФ,12214,letter,CUNEIFORM SIGN LU2 SQUARED,таЗтаетаШта╕
ЁТИХ,12215,letter,CUNEIFORM SIGN LU2 SHESHIG,таЗтае тайтаСтайтаКтаЫ
ЁТИЦ,12216,letter,CUNEIFORM SIGN LU3,таЗтаетаТ
ЁТИЧ,12217,letter,CUNEIFORM SIGN LUGAL,таЗтаетаЫтаБтаЗ
ЁТИШ,12218,letter,CUNEIFORM SIGN LUGAL OVER LUGAL,таЗтаетаЫтаБтаЗтаМтаЗтаетаЫтаБтаЗ
ЁТИЩ,12219,letter,CUNEIFORM SIGN LUGAL OPPOSING LUGAL,таЗтаетаЫтаБтаЗталтаЗтаетаЫтаБтаЗ
ЁТИЪ,1221A,letter,CUNEIFORM SIGN LUGAL SHESHIG,таЗтаетаЫтаБтаЗ тайтаСтайтаКтаЫ
ЁТИЫ,1221B,letter,CUNEIFORM SIGN LUH,таЗтаетаУ
ЁТИЬ,1221C,letter,CUNEIFORM SIGN LUL,таЗтаетаЗ
ЁТИЭ,1221D,letter,CUNEIFORM SIGN LUM,таЗтаетаН
ЁТИЮ,1221E,letter,CUNEIFORM SIGN LUM OVER LUM,таЗтаетаНтаМтаЗтаетаН
ЁТИЯ,1221F,letter,CUNEIFORM SIGN LUM OVER LUM GAR OVER GAR,таЗтаетаНтаМтаЗтаетаН таЫтаЬтаМтаЫтаЬ
ЁТИа,12220,letter,CUNEIFORM SIGN MA,таНтаБ
ЁТИб,12221,letter,CUNEIFORM SIGN MA TIMES TAK4,таНтаБтабтаЮтаБтаЕта▓
ЁТИв,12222,letter,CUNEIFORM SIGN MA GUNU,таНтаБ таЫтаетаЭтае
ЁТИг,12223,letter,CUNEIFORM SIGN MA2,таНтаБ
ЁТИд,12224,letter,CUNEIFORM SIGN MAH,таНтаБтаУ
ЁТИе,12225,letter,CUNEIFORM SIGN MAR,таНтаЬ
ЁТИж,12226,letter,CUNEIFORM SIGN MASH,таНтаБтай
ЁТИз,12227,letter,CUNEIFORM SIGN MASH2,таНтаБтай
ЁТИи,12228,letter,CUNEIFORM SIGN ME,таНтаС
ЁТИй,12229,letter,CUNEIFORM SIGN MES,таНтаСтаО
ЁТИк,1222A,letter,CUNEIFORM SIGN MI,таНтаК
ЁТИл,1222B,letter,CUNEIFORM SIGN MIN,таНтаКтаЭ
ЁТИм,1222C,letter,CUNEIFORM SIGN MU,таНтае
ЁТИн,1222D,letter,CUNEIFORM SIGN MU OVER MU,таНтаетаМтаНтае
ЁТИо,1222E,letter,CUNEIFORM SIGN MUG,таНтаетаЫ
ЁТИп,1222F,letter,CUNEIFORM SIGN MUG GUNU,таНтаетаЫ таЫтаетаЭтае
ЁТИ░,12230,letter,CUNEIFORM SIGN MUNSUB,таНтаетаЭтаОтаетаГ
ЁТИ▒,12231,letter,CUNEIFORM SIGN MURGU2,таНтаетаЧтаЫтае
ЁТИ▓,12232,letter,CUNEIFORM SIGN MUSH,таНтаетай
ЁТИ│,12233,letter,CUNEIFORM SIGN MUSH TIMES A,таНтаетайтабтаБ
ЁТИ┤,12234,letter,CUNEIFORM SIGN MUSH TIMES KUR,таНтаетайтабтаЕтаетаЧ
ЁТИ╡,12235,letter,CUNEIFORM SIGN MUSH TIMES ZA,таНтаетайтабта╡таБ
