Character,Hex,Type,Name,Braille
ЁТИ╢,12236,letter,CUNEIFORM SIGN MUSH OVER MUSH,таНтаетайтаМтаНтаетай
ЁТИ╖,12237,letter,CUNEIFORM SIGN MUSH OVER MUSH TIMES A PLUS NA,таНтаетайтаМтаНтаетайтабтаБтамтаЭтаБ
ЁТИ╕,12238,letter,CUNEIFORM SIGN MUSH CROSSING MUSH,таНтаетайтаптаНтаетай
ЁТИ╣,12239,letter,CUNEIFORM SIGN MUSH3,таНтаетайтаТ
ЁТИ║,1223A,letter,CUNEIFORM SIGN MUSH3 TIMES A,таНтаетайтаТтабтаБ
ЁТИ╗,1223B,letter,CUNEIFORM SIGN MUSH3 TIMES A PLUS DI,таНтаетайтаТтабтаБтамтаЩтаК
ЁТИ╝,1223C,letter,CUNEIFORM SIGN MUSH3 TIMES DI,таНтаетайтаТтабтаЩтаК
ЁТИ╜,1223D,letter,CUNEIFORM SIGN MUSH3 GUNU,таНтаетайтаТ таЫтаетаЭтае
ЁТИ╛,1223E,letter,CUNEIFORM SIGN NA,таЭтаБ
ЁТИ┐,1223F,letter,CUNEIFORM SIGN NA2,таЭтаБ
ЁТЙА,12240,letter,CUNEIFORM SIGN NAGA,таЭтаБтаЫтаБ
ЁТЙБ,12241,letter,CUNEIFORM SIGN NAGA INVERTED,таЭтаБтаЫтаБ таКтаЭтазтаСтаЧтаЮтаСтаЩ
ЁТЙВ,12242,letter,CUNEIFORM SIGN NAGA TIMES SHU TENU,таЭтаБтаЫтаБтабтайтае таЮтаСтаЭтае
ЁТЙГ,12243,letter,CUNEIFORM SIGN NAGA OPPOSING NAGA,таЭтаБтаЫтаБталтаЭтаБтаЫтаБ
ЁТЙД,12244,letter,CUNEIFORM SIGN NAGAR,таЭтаБтаЫтаЬ
ЁТЙЕ,12245,letter,CUNEIFORM SIGN NAM NUTILLU,таЭтаБтаН таЭтаетаЮтаКтаЗтаЗтае
ЁТЙЖ,12246,letter,CUNEIFORM SIGN NAM,таЭтаБтаН
ЁТЙЗ,12247,letter,CUNEIFORM SIGN NAM2,таЭтаБтаН
ЁТЙИ,12248,letter,CUNEIFORM SIGN NE,таЭтаС
ЁТЙЙ,12249,letter,CUNEIFORM SIGN NE TIMES A,таЭтаСтабтаБ
ЁТЙК,1224A,letter,CUNEIFORM SIGN NE TIMES UD,таЭтаСтабтаетаЩ
ЁТЙЛ,1224B,letter,CUNEIFORM SIGN NE SHESHIG,таЭтаС тайтаСтайтаКтаЫ
ЁТЙМ,1224C,letter,CUNEIFORM SIGN NI,таЭтаК
ЁТЙН,1224D,letter,CUNEIFORM SIGN NI TIMES E,таЭтаКтабтаС
ЁТЙО,1224E,letter,CUNEIFORM SIGN NI2,таЭтаК
ЁТЙП,1224F,letter,CUNEIFORM SIGN NIM,таЭтаКтаН
ЁТЙР,12250,letter,CUNEIFORM SIGN NIM TIMES GAN2 TENU,таЭтаКтаНтабтаЫтаБтаЭ таЮтаСтаЭтае
ЁТЙС,12251,letter,CUNEIFORM SIGN NIM TIMES GAR PLUS GAN2 TENU,таЭтаКтаНтабтаЫтаЬтамтаЫтаБтаЭ таЮтаСтаЭтае
ЁТЙТ,12252,letter,CUNEIFORM SIGN NINDA2,таЭтаКтаЭтаЩтаБ
ЁТЙУ,12253,letter,CUNEIFORM SIGN NINDA2 TIMES AN,таЭтаКтаЭтаЩтаБтабтаБтаЭ
ЁТЙФ,12254,letter,CUNEIFORM SIGN NINDA2 TIMES ASH,таЭтаКтаЭтаЩтаБтабтаБтай
ЁТЙХ,12255,letter,CUNEIFORM SIGN NINDA2 TIMES ASH PLUS ASH,таЭтаКтаЭтаЩтаБтабтаБтайтамтаБтай
ЁТЙЦ,12256,letter,CUNEIFORM SIGN NINDA2 TIMES GUD,таЭтаКтаЭтаЩтаБтабтаЫтаетаЩ
ЁТЙЧ,12257,letter,CUNEIFORM SIGN NINDA2 TIMES ME PLUS GAN2 TENU,таЭтаКтаЭтаЩтаБтабтаНтаСтамтаЫтаБтаЭ таЮтаСтаЭтае
ЁТЙШ,12258,letter,CUNEIFORM SIGN NINDA2 TIMES NE,таЭтаКтаЭтаЩтаБтабтаЭтаС
ЁТЙЩ,12259,letter,CUNEIFORM SIGN NINDA2 TIMES NUN,таЭтаКтаЭтаЩтаБтабтаЭтаетаЭ
ЁТЙЪ,1225A,letter,CUNEIFORM SIGN NINDA2 TIMES SHE,таЭтаКтаЭтаЩтаБтабтайтаС
ЁТЙЫ,1225B,letter,CUNEIFORM SIGN NINDA2 TIMES SHE PLUS A AN,таЭтаКтаЭтаЩтаБтабтайтаСтамтаБ таБтаЭ
ЁТЙЬ,1225C,letter,CUNEIFORM SIGN NINDA2 TIMES SHE PLUS ASH,таЭтаКтаЭтаЩтаБтабтайтаСтамтаБтай
ЁТЙЭ,1225D,letter,CUNEIFORM SIGN NINDA2 TIMES SHE PLUS ASH PLUS ASH,таЭтаКтаЭтаЩтаБтабтайтаСтамтаБтайтамтаБтай
ЁТЙЮ,1225E,letter,CUNEIFORM SIGN NINDA2 TIMES U2 PLUS ASH,таЭтаКтаЭтаЩтаБтабтаетамтаБтай
ЁТЙЯ,1225F,letter,CUNEIFORM SIGN NINDA2 TIMES USH,таЭтаКтаЭтаЩтаБтабтаетай
ЁТЙа,12260,letter,CUNEIFORM SIGN NISAG,таЭтаКтаОтаБтаЫ
ЁТЙб,12261,letter,CUNEIFORM SIGN NU,таЭтае
ЁТЙв,12262,letter,CUNEIFORM SIGN NU11,таЭтаетаВтаВ
ЁТЙг,12263,letter,CUNEIFORM SIGN NUN,таЭтаетаЭ
ЁТЙд,12264,letter,CUNEIFORM SIGN NUN LAGAR TIMES GAR,таЭтаетаЭ таЗтаБтаЫтаЬтабтаЫтаЬ
ЁТЙе,12265,letter,CUNEIFORM SIGN NUN LAGAR TIMES MASH,таЭтаетаЭ таЗтаБтаЫтаЬтабтаНтаБтай
ЁТЙж,12266,letter,CUNEIFORM SIGN NUN LAGAR TIMES SAL,таЭтаетаЭ таЗтаБтаЫтаЬтабтаОтаБтаЗ
ЁТЙз,12267,letter,CUNEIFORM SIGN NUN LAGAR TIMES SAL OVER NUN LAGAR TIMES SAL,таЭтаетаЭ таЗтаБтаЫтаЬтабтаОтаБтаЗтаМтаЭтаетаЭ таЗтаБтаЫтаЬтабтаОтаБтаЗ
ЁТЙи,12268,letter,CUNEIFORM SIGN NUN LAGAR TIMES USH,таЭтаетаЭ таЗтаБтаЫтаЬтабтаетай
ЁТЙй,12269,letter,CUNEIFORM SIGN NUN TENU,таЭтаетаЭ таЮтаСтаЭтае
ЁТЙк,1226A,letter,CUNEIFORM SIGN NUN OVER NUN,таЭтаетаЭтаМтаЭтаетаЭ
ЁТЙл,1226B,letter,CUNEIFORM SIGN NUN CROSSING NUN,таЭтаетаЭтаптаЭтаетаЭ
ЁТЙм,1226C,letter,CUNEIFORM SIGN NUN CROSSING NUN LAGAR OVER LAGAR,таЭтаетаЭтаптаЭтаетаЭ таЗтаБтаЫтаЬтаМтаЗтаБтаЫтаЬ
ЁТЙн,1226D,letter,CUNEIFORM SIGN NUNUZ,таЭтаетаЭтае
ЁТЙо,1226E,letter,CUNEIFORM SIGN NUNUZ AB2 TIMES ASHGAB,таЭтаетаЭтаета╡ таБтаГтабтаБтайтаЫтаБтаГ
ЁТЙп,1226F,letter,CUNEIFORM SIGN NUNUZ AB2 TIMES BI,таЭтаетаЭтаета╡ таБтаГтабтаГтаК
ЁТЙ░,12270,letter,CUNEIFORM SIGN NUNUZ AB2 TIMES DUG,таЭтаетаЭтаета╡ таБтаГтабтаЩтаетаЫ
ЁТЙ▒,12271,letter,CUNEIFORM SIGN NUNUZ AB2 TIMES GUD,таЭтаетаЭтаета╡ таБтаГтабтаЫтаетаЩ
ЁТЙ▓,12272,letter,CUNEIFORM SIGN NUNUZ AB2 TIMES IGI GUNU,таЭтаетаЭтаета╡ таБтаГтабтаКтаЫтаК таЫтаетаЭтае
ЁТЙ│,12273,letter,CUNEIFORM SIGN NUNUZ AB2 TIMES KAD3,таЭтаетаЭтаета╡ таБтаГтабтаЕтаБтаЩтаТ
ЁТЙ┤,12274,letter,CUNEIFORM SIGN NUNUZ AB2 TIMES LA,таЭтаетаЭтаета╡ таБтаГтабтаЗтаБ
ЁТЙ╡,12275,letter,CUNEIFORM SIGN NUNUZ AB2 TIMES NE,таЭтаетаЭтаета╡ таБтаГтабтаЭтаС
ЁТЙ╢,12276,letter,CUNEIFORM SIGN NUNUZ AB2 TIMES SILA3,таЭтаетаЭтаета╡ таБтаГтабтаОтаКтаЗтаБтаТ
ЁТЙ╖,12277,letter,CUNEIFORM SIGN NUNUZ AB2 TIMES U2,таЭтаетаЭтаета╡ таБтаГтабтае
ЁТЙ╕,12278,letter,CUNEIFORM SIGN NUNUZ KISIM5 TIMES BI,таЭтаетаЭтаета╡ таЕтаКтаОтаКтаНтавтабтаГтаК
ЁТЙ╣,12279,letter,CUNEIFORM SIGN NUNUZ KISIM5 TIMES BI U,таЭтаетаЭтаета╡ таЕтаКтаОтаКтаНтавтабтаГтаК тае
ЁТЙ║,1227A,letter,CUNEIFORM SIGN PA,таПтаБ
ЁТЙ╗,1227B,letter,CUNEIFORM SIGN PAD,таПтаБтаЩ
ЁТЙ╝,1227C,letter,CUNEIFORM SIGN PAN,таПтаБтаЭ
ЁТЙ╜,1227D,letter,CUNEIFORM SIGN PAP,таПтаБтаП
ЁТЙ╛,1227E,letter,CUNEIFORM SIGN PESH2,таПтаСтай
ЁТЙ┐,1227F,letter,CUNEIFORM SIGN PI,таПтаК
ЁТКА,12280,letter,CUNEIFORM SIGN PI TIMES A,таПтаКтабтаБ
ЁТКБ,12281,letter,CUNEIFORM SIGN PI TIMES AB,таПтаКтабтаБтаГ
ЁТКВ,12282,letter,CUNEIFORM SIGN PI TIMES BI,таПтаКтабтаГтаК
ЁТКГ,12283,letter,CUNEIFORM SIGN PI TIMES BU,таПтаКтабтаГтае
ЁТКД,12284,letter,CUNEIFORM SIGN PI TIMES E,таПтаКтабтаС
ЁТКЕ,12285,letter,CUNEIFORM SIGN PI TIMES I,таПтаКтабтаК
ЁТКЖ,12286,letter,CUNEIFORM SIGN PI TIMES IB,таПтаКтабтаКтаГ
ЁТКЗ,12287,letter,CUNEIFORM SIGN PI TIMES U,таПтаКтабтае
ЁТКИ,12288,letter,CUNEIFORM SIGN PI TIMES U2,таПтаКтабтае
ЁТКЙ,12289,letter,CUNEIFORM SIGN PI CROSSING PI,таПтаКтаптаПтаК
ЁТКК,1228A,letter,CUNEIFORM SIGN PIRIG,таПтаКтаЧтаКтаЫ
ЁТКЛ,1228B,letter,CUNEIFORM SIGN PIRIG TIMES KAL,таПтаКтаЧтаКтаЫтабтаЕтаБтаЗ
ЁТКМ,1228C,letter,CUNEIFORM SIGN PIRIG TIMES UD,таПтаКтаЧтаКтаЫтабтаетаЩ
ЁТКН,1228D,letter,CUNEIFORM SIGN PIRIG TIMES ZA,таПтаКтаЧтаКтаЫтабта╡таБ
ЁТКО,1228E,letter,CUNEIFORM SIGN PIRIG OPPOSING PIRIG,таПтаКтаЧтаКтаЫталтаПтаКтаЧтаКтаЫ
ЁТКП,1228F,letter,CUNEIFORM SIGN RA,таЧтаБ
ЁТКР,12290,letter,CUNEIFORM SIGN RAB,таЧтаБтаГ
ЁТКС,12291,letter,CUNEIFORM SIGN RI,таЧтаК
ЁТКТ,12292,letter,CUNEIFORM SIGN RU,таЧтае
ЁТКУ,12293,letter,CUNEIFORM SIGN SA,таОтаБ
ЁТКФ,12294,letter,CUNEIFORM SIGN SAG NUTILLU,таОтаБтаЫ таЭтаетаЮтаКтаЗтаЗтае
ЁТКХ,12295,letter,CUNEIFORM SIGN SAG,таОтаБтаЫ
ЁТКЦ,12296,letter,CUNEIFORM SIGN SAG TIMES A,таОтаБтаЫтабтаБ
ЁТКЧ,12297,letter,CUNEIFORM SIGN SAG TIMES DU,таОтаБтаЫтабтаЩтае
ЁТКШ,12298,letter,CUNEIFORM SIGN SAG TIMES DUB,таОтаБтаЫтабтаЩтаетаГ
ЁТКЩ,12299,letter,CUNEIFORM SIGN SAG TIMES HA,таОтаБтаЫтабтаУтаБ
ЁТКЪ,1229A,letter,CUNEIFORM SIGN SAG TIMES KAK,таОтаБтаЫтабтаЕтаБтаЕ
ЁТКЫ,1229B,letter,CUNEIFORM SIGN SAG TIMES KUR,таОтаБтаЫтабтаЕтаетаЧ
ЁТКЬ,1229C,letter,CUNEIFORM SIGN SAG TIMES LUM,таОтаБтаЫтабтаЗтаетаН
ЁТКЭ,1229D,letter,CUNEIFORM SIGN SAG TIMES MI,таОтаБтаЫтабтаНтаК
ЁТКЮ,1229E,letter,CUNEIFORM SIGN SAG TIMES NUN,таОтаБтаЫтабтаЭтаетаЭ
ЁТКЯ,1229F,letter,CUNEIFORM SIGN SAG TIMES SAL,таОтаБтаЫтабтаОтаБтаЗ
ЁТКа,122A0,letter,CUNEIFORM SIGN SAG TIMES SHID,таОтаБтаЫтабтайтаКтаЩ
ЁТКб,122A1,letter,CUNEIFORM SIGN SAG TIMES TAB,таОтаБтаЫтабтаЮтаБтаГ
ЁТКв,122A2,letter,CUNEIFORM SIGN SAG TIMES U2,таОтаБтаЫтабтае
ЁТКг,122A3,letter,CUNEIFORM SIGN SAG TIMES UB,таОтаБтаЫтабтаетаГ
ЁТКд,122A4,letter,CUNEIFORM SIGN SAG TIMES UM,таОтаБтаЫтабтаетаН
ЁТКе,122A5,letter,CUNEIFORM SIGN SAG TIMES UR,таОтаБтаЫтабтаетаЧ
ЁТКж,122A6,letter,CUNEIFORM SIGN SAG TIMES USH,таОтаБтаЫтабтаетай
ЁТКз,122A7,letter,CUNEIFORM SIGN SAG OVER SAG,таОтаБтаЫтаМтаОтаБтаЫ
ЁТКи,122A8,letter,CUNEIFORM SIGN SAG GUNU,таОтаБтаЫ таЫтаетаЭтае
ЁТКй,122A9,letter,CUNEIFORM SIGN SAL,таОтаБтаЗ
ЁТКк,122AA,letter,CUNEIFORM SIGN SAL LAGAB TIMES ASH2,таОтаБтаЗ таЗтаБтаЫтаБтаГтабтаБтай
ЁТКл,122AB,letter,CUNEIFORM SIGN SANGA2,таОтаБтаЭтаЫтаБ
ЁТКм,122AC,letter,CUNEIFORM SIGN SAR,таОтаЬ
ЁТКн,122AD,letter,CUNEIFORM SIGN SHA,тайтаБ
ЁТКо,122AE,letter,CUNEIFORM SIGN SHA3,тайтаБтаТ
ЁТКп,122AF,letter,CUNEIFORM SIGN SHA3 TIMES A,тайтаБтаТтабтаБ
ЁТК░,122B0,letter,CUNEIFORM SIGN SHA3 TIMES BAD,тайтаБтаТтабтаГтаБтаЩ
ЁТК▒,122B1,letter,CUNEIFORM SIGN SHA3 TIMES GISH,тайтаБтаТтабтаЫтаКтай
ЁТК▓,122B2,letter,CUNEIFORM SIGN SHA3 TIMES NE,тайтаБтаТтабтаЭтаС
ЁТК│,122B3,letter,CUNEIFORM SIGN SHA3 TIMES SHU2,тайтаБтаТтабтайтае
ЁТК┤,122B4,letter,CUNEIFORM SIGN SHA3 TIMES TUR,тайтаБтаТтабтаЮтаетаЧ
ЁТК╡,122B5,letter,CUNEIFORM SIGN SHA3 TIMES U,тайтаБтаТтабтае
ЁТК╢,122B6,letter,CUNEIFORM SIGN SHA3 TIMES U PLUS A,тайтаБтаТтабтаетамтаБ
ЁТК╖,122B7,letter,CUNEIFORM SIGN SHA6,тайтаБтаЦ
ЁТК╕,122B8,letter,CUNEIFORM SIGN SHAB6,тайтаБтаГтаЦ
ЁТК╣,122B9,letter,CUNEIFORM SIGN SHAR2,тайтаЬ
ЁТК║,122BA,letter,CUNEIFORM SIGN SHE,тайтаС
ЁТК╗,122BB,letter,CUNEIFORM SIGN SHE HU,тайтаС таУтае
ЁТК╝,122BC,letter,CUNEIFORM SIGN SHE OVER SHE GAD OVER GAD GAR OVER GAR,тайтаСтаМтайтаС таЫтаБтаЩтаМтаЫтаБтаЩ таЫтаЬтаМтаЫтаЬ
ЁТК╜,122BD,letter,CUNEIFORM SIGN SHE OVER SHE TAB OVER TAB GAR OVER GAR,тайтаСтаМтайтаС таЮтаБтаГтаМтаЮтаБтаГ таЫтаЬтаМтаЫтаЬ
ЁТК╛,122BE,letter,CUNEIFORM SIGN SHEG9,тайтаСтаЫтаФ
ЁТК┐,122BF,letter,CUNEIFORM SIGN SHEN,тайтаСтаЭ
ЁТЛА,122C0,letter,CUNEIFORM SIGN SHESH,тайтаСтай
ЁТЛБ,122C1,letter,CUNEIFORM SIGN SHESH2,тайтаСтай
ЁТЛВ,122C2,letter,CUNEIFORM SIGN SHESHLAM,тайтаСтайтаЗтаБтаН
ЁТЛГ,122C3,letter,CUNEIFORM SIGN SHID,тайтаКтаЩ
ЁТЛД,122C4,letter,CUNEIFORM SIGN SHID TIMES A,тайтаКтаЩтабтаБ
ЁТЛЕ,122C5,letter,CUNEIFORM SIGN SHID TIMES IM,тайтаКтаЩтабтаКтаН
ЁТЛЖ,122C6,letter,CUNEIFORM SIGN SHIM,тайтаКтаН
ЁТЛЗ,122C7,letter,CUNEIFORM SIGN SHIM TIMES A,тайтаКтаНтабтаБ
ЁТЛИ,122C8,letter,CUNEIFORM SIGN SHIM TIMES BAL,тайтаКтаНтабтаГтаБтаЗ
ЁТЛЙ,122C9,letter,CUNEIFORM SIGN SHIM TIMES BULUG,тайтаКтаНтабтаГтаетаЗтаетаЫ
ЁТЛК,122CA,letter,CUNEIFORM SIGN SHIM TIMES DIN,тайтаКтаНтабтаЩтаКтаЭ
ЁТЛЛ,122CB,letter,CUNEIFORM SIGN SHIM TIMES GAR,тайтаКтаНтабтаЫтаЬ
ЁТЛМ,122CC,letter,CUNEIFORM SIGN SHIM TIMES IGI,тайтаКтаНтабтаКтаЫтаК
ЁТЛН,122CD,letter,CUNEIFORM SIGN SHIM TIMES IGI GUNU,тайтаКтаНтабтаКтаЫтаК таЫтаетаЭтае
ЁТЛО,122CE,letter,CUNEIFORM SIGN SHIM TIMES KUSHU2,тайтаКтаНтабтаЕтаетайтае
ЁТЛП,122CF,letter,CUNEIFORM SIGN SHIM TIMES LUL,тайтаКтаНтабтаЗтаетаЗ
ЁТЛР,122D0,letter,CUNEIFORM SIGN SHIM TIMES MUG,тайтаКтаНтабтаНтаетаЫ
ЁТЛС,122D1,letter,CUNEIFORM SIGN SHIM TIMES SAL,тайтаКтаНтабтаОтаБтаЗ
ЁТЛТ,122D2,letter,CUNEIFORM SIGN SHINIG,тайтаКтаЭтаКтаЫ
ЁТЛУ,122D3,letter,CUNEIFORM SIGN SHIR,тайтаКтаЧ
ЁТЛФ,122D4,letter,CUNEIFORM SIGN SHIR TENU,тайтаКтаЧ таЮтаСтаЭтае
ЁТЛХ,122D5,letter,CUNEIFORM SIGN SHIR OVER SHIR BUR OVER BUR,тайтаКтаЧтаМтайтаКтаЧ таГтаетаЧтаМтаГтаетаЧ
ЁТЛЦ,122D6,letter,CUNEIFORM SIGN SHITA,тайтаКтаЮтаБ
ЁТЛЧ,122D7,letter,CUNEIFORM SIGN SHU,тайтае
ЁТЛШ,122D8,letter,CUNEIFORM SIGN SHU OVER INVERTED SHU,тайтаетаМтаКтаЭтазтаСтаЧтаЮтаСтаЩ тайтае
ЁТЛЩ,122D9,letter,CUNEIFORM SIGN SHU2,тайтае
ЁТЛЪ,122DA,letter,CUNEIFORM SIGN SHUBUR,тайтаетаГтаетаЧ
ЁТЛЫ,122DB,letter,CUNEIFORM SIGN SI,таОтаК
ЁТЛЬ,122DC,letter,CUNEIFORM SIGN SI GUNU,таОтаК таЫтаетаЭтае
ЁТЛЭ,122DD,letter,CUNEIFORM SIGN SIG,таОтаКтаЫ
ЁТЛЮ,122DE,letter,CUNEIFORM SIGN SIG4,таОтаКтаЫта▓
ЁТЛЯ,122DF,letter,CUNEIFORM SIGN SIG4 OVER SIG4 SHU2,таОтаКтаЫта▓таМтаОтаКтаЫта▓ тайтае
ЁТЛа,122,letter,CUNEIFORM SIGN SIK2,таОтаКтаЕ
ЁТЛб,1220,letter,CUNEIFORM SIGN SILA3,таОтаКтаЗтаБтаТ
ЁТЛв,12200,letter,CUNEIFORM SIGN SU,таОтае
ЁТЛг,122000,letter,CUNEIFORM SIGN SU OVER SU,таОтаетаМтаОтае
ЁТЛд,1220000,letter,CUNEIFORM SIGN SUD,таОтаетаЩ
ЁТЛе,12200000,letter,CUNEIFORM SIGN SUD2,таОтаетаЩ
ЁТЛж,122000000,letter,CUNEIFORM SIGN SUHUR,таОтаетаУтаетаЧ
ЁТЛз,1220000000,letter,CUNEIFORM SIGN SUM,таОтаетаН
ЁТЛи,12200000000,letter,CUNEIFORM SIGN SUMASH,таОтаетаНтаБтай
ЁТЛй,122000000000,letter,CUNEIFORM SIGN SUR,таОтаетаЧ
ЁТЛк,122EA,letter,CUNEIFORM SIGN SUR9,таОтаетаЧтаФ
ЁТЛл,122EB,letter,CUNEIFORM SIGN TA,таЮтаБ
ЁТЛм,122EC,letter,CUNEIFORM SIGN TA ASTERISK,таЮтаБтаб
ЁТЛн,122ED,letter,CUNEIFORM SIGN TA TIMES HI,таЮтаБтабтаУтаК
ЁТЛо,122EE,letter,CUNEIFORM SIGN TA TIMES MI,таЮтаБтабтаНтаК
ЁТЛп,122EF,letter,CUNEIFORM SIGN TA GUNU,таЮтаБ таЫтаетаЭтае
ЁТЛ░,122F0,letter,CUNEIFORM SIGN TAB,таЮтаБтаГ
ЁТЛ▒,122F1,letter,CUNEIFORM SIGN TAB OVER TAB NI OVER NI DISH OVER DISH,таЮтаБтаГтаМтаЮтаБтаГ таЭтаКтаМтаЭтаК таЩтаКтайтаМтаЩтаКтай
ЁТЛ▓,122F2,letter,CUNEIFORM SIGN TAB SQUARED,таЮтаБтаГтаШта╕
ЁТЛ│,122F3,letter,CUNEIFORM SIGN TAG,таЮтаБтаЫ
ЁТЛ┤,122F4,letter,CUNEIFORM SIGN TAG TIMES BI,таЮтаБтаЫтабтаГтаК
ЁТЛ╡,122F5,letter,CUNEIFORM SIGN TAG TIMES GUD,таЮтаБтаЫтабтаЫтаетаЩ
ЁТЛ╢,122F6,letter,CUNEIFORM SIGN TAG TIMES SHE,таЮтаБтаЫтабтайтаС
ЁТЛ╖,122F7,letter,CUNEIFORM SIGN TAG TIMES SHU,таЮтаБтаЫтабтайтае
ЁТЛ╕,122F8,letter,CUNEIFORM SIGN TAG TIMES TUG2,таЮтаБтаЫтабтаЮтаетаЫ
ЁТЛ╣,122F9,letter,CUNEIFORM SIGN TAG TIMES UD,таЮтаБтаЫтабтаетаЩ
ЁТЛ║,122FA,letter,CUNEIFORM SIGN TAK4,таЮтаБтаЕта▓
ЁТЛ╗,122FB,letter,CUNEIFORM SIGN TAR,таЮтаЬ
ЁТЛ╝,122FC,letter,CUNEIFORM SIGN TE,таЮтаС
ЁТЛ╜,122FD,letter,CUNEIFORM SIGN TE GUNU,таЮтаС таЫтаетаЭтае
ЁТЛ╛,122FE,letter,CUNEIFORM SIGN TI,таЮтаК
ЁТЛ┐,122FF,letter,CUNEIFORM SIGN TI TENU,таЮтаК таЮтаСтаЭтае
ЁТМА,12300,letter,CUNEIFORM SIGN TIL,таЮтаКтаЗ
ЁТМБ,12301,letter,CUNEIFORM SIGN TIR,таЮтаКтаЧ
ЁТМВ,12302,letter,CUNEIFORM SIGN TIR TIMES TAK4,таЮтаКтаЧтабтаЮтаБтаЕта▓
ЁТМГ,12303,letter,CUNEIFORM SIGN TIR OVER TIR,таЮтаКтаЧтаМтаЮтаКтаЧ
ЁТМД,12304,letter,CUNEIFORM SIGN TIR OVER TIR GAD OVER GAD GAR OVER GAR,таЮтаКтаЧтаМтаЮтаКтаЧ таЫтаБтаЩтаМтаЫтаБтаЩ таЫтаЬтаМтаЫтаЬ
ЁТМЕ,12305,letter,CUNEIFORM SIGN TU,таЮтае
ЁТМЖ,12306,letter,CUNEIFORM SIGN TUG2,таЮтаетаЫ
ЁТМЗ,12307,letter,CUNEIFORM SIGN TUK,таЮтаетаЕ
ЁТМИ,12308,letter,CUNEIFORM SIGN TUM,таЮтаетаН
ЁТМЙ,12309,letter,CUNEIFORM SIGN TUR,таЮтаетаЧ
ЁТМК,1230A,letter,CUNEIFORM SIGN TUR OVER TUR ZA OVER ZA,таЮтаетаЧтаМтаЮтаетаЧ та╡таБтаМта╡таБ
ЁТМЛ,1230B,letter,CUNEIFORM SIGN U,тае
ЁТММ,1230C,letter,CUNEIFORM SIGN U GUD,тае таЫтаетаЩ
ЁТМН,1230D,letter,CUNEIFORM SIGN U U U,тае тае тае
ЁТМО,1230E,letter,CUNEIFORM SIGN U OVER U PA OVER PA GAR OVER GAR,таетаМтае таПтаБтаМтаПтаБ таЫтаЬтаМтаЫтаЬ
ЁТМП,1230F,letter,CUNEIFORM SIGN U OVER U SUR OVER SUR,таетаМтае таОтаетаЧтаМтаОтаетаЧ
ЁТМР,12310,letter,CUNEIFORM SIGN U OVER U U REVERSED OVER U REVERSED,таетаМтае таетаптаЗтаЮта░таМтаетаптаЗтаЮта░
ЁТМС,12311,letter,CUNEIFORM SIGN U2,тае
ЁТМТ,12312,letter,CUNEIFORM SIGN UB,таетаГ
ЁТМУ,12313,letter,CUNEIFORM SIGN UD,таетаЩ
ЁТМФ,12314,letter,CUNEIFORM SIGN UD KUSHU2,таетаЩ таЕтаетайтае
ЁТМХ,12315,letter,CUNEIFORM SIGN UD TIMES BAD,таетаЩтабтаГтаБтаЩ
ЁТМЦ,12316,letter,CUNEIFORM SIGN UD TIMES MI,таетаЩтабтаНтаК
ЁТМЧ,12317,letter,CUNEIFORM SIGN UD TIMES U PLUS U PLUS U,таетаЩтабтаетамтаетамтае
ЁТМШ,12318,letter,CUNEIFORM SIGN UD TIMES U PLUS U PLUS U GUNU,таетаЩтабтаетамтаетамтае таЫтаетаЭтае
ЁТМЩ,12319,letter,CUNEIFORM SIGN UD GUNU,таетаЩ таЫтаетаЭтае
ЁТМЪ,1231A,letter,CUNEIFORM SIGN UD SHESHIG,таетаЩ тайтаСтайтаКтаЫ
ЁТМЫ,1231B,letter,CUNEIFORM SIGN UD SHESHIG TIMES BAD,таетаЩ тайтаСтайтаКтаЫтабтаГтаБтаЩ
ЁТМЬ,1231C,letter,CUNEIFORM SIGN UDUG,таетаЩтаетаЫ
ЁТМЭ,1231D,letter,CUNEIFORM SIGN UM,таетаН
ЁТМЮ,1231E,letter,CUNEIFORM SIGN UM TIMES LAGAB,таетаНтабтаЗтаБтаЫтаБтаГ
ЁТМЯ,1231F,letter,CUNEIFORM SIGN UM TIMES ME PLUS DA,таетаНтабтаНтаСтамтаЩтаБ
ЁТМа,12320,letter,CUNEIFORM SIGN UM TIMES SHA3,таетаНтабтайтаБтаТ
ЁТМб,12321,letter,CUNEIFORM SIGN UM TIMES U,таетаНтабтае
ЁТМв,12322,letter,CUNEIFORM SIGN UMBIN,таетаНтаГтаКтаЭ
ЁТМг,12323,letter,CUNEIFORM SIGN UMUM,таетаНтаетаН
ЁТМд,12324,letter,CUNEIFORM SIGN UMUM TIMES KASKAL,таетаНтаетаНтабтаЕтаБтаОтаЕтаБтаЗ
ЁТМе,12325,letter,CUNEIFORM SIGN UMUM TIMES PA,таетаНтаетаНтабтаПтаБ
ЁТМж,12326,letter,CUNEIFORM SIGN UN,таетаЭ
ЁТМз,12327,letter,CUNEIFORM SIGN UN GUNU,таетаЭ таЫтаетаЭтае
ЁТМи,12328,letter,CUNEIFORM SIGN UR,таетаЧ
ЁТМй,12329,letter,CUNEIFORM SIGN UR CROSSING UR,таетаЧтаптаетаЧ
ЁТМк,1232A,letter,CUNEIFORM SIGN UR SHESHIG,таетаЧ тайтаСтайтаКтаЫ
ЁТМл,1232B,letter,CUNEIFORM SIGN UR2,таетаЧ
ЁТМм,1232C,letter,CUNEIFORM SIGN UR2 TIMES A PLUS HA,таетаЧтабтаБтамтаУтаБ
ЁТМн,1232D,letter,CUNEIFORM SIGN UR2 TIMES A PLUS NA,таетаЧтабтаБтамтаЭтаБ
ЁТМо,1232E,letter,CUNEIFORM SIGN UR2 TIMES AL,таетаЧтабтаБтаЗ
ЁТМп,1232F,letter,CUNEIFORM SIGN UR2 TIMES HA,таетаЧтабтаУтаБ
ЁТМ░,12330,letter,CUNEIFORM SIGN UR2 TIMES NUN,таетаЧтабтаЭтаетаЭ
ЁТМ▒,12331,letter,CUNEIFORM SIGN UR2 TIMES U2,таетаЧтабтае
ЁТМ▓,12332,letter,CUNEIFORM SIGN UR2 TIMES U2 PLUS ASH,таетаЧтабтаетамтаБтай
ЁТМ│,12333,letter,CUNEIFORM SIGN UR2 TIMES U2 PLUS BI,таетаЧтабтаетамтаГтаК
ЁТМ┤,12334,letter,CUNEIFORM SIGN UR4,таетаЧта▓
ЁТМ╡,12335,letter,CUNEIFORM SIGN URI,таетаЧтаК
ЁТМ╢,12336,letter,CUNEIFORM SIGN URI3,таетаЧтаКтаТ
ЁТМ╖,12337,letter,CUNEIFORM SIGN URU,таетаЧтае
ЁТМ╕,12338,letter,CUNEIFORM SIGN URU TIMES A,таетаЧтаетабтаБ
ЁТМ╣,12339,letter,CUNEIFORM SIGN URU TIMES ASHGAB,таетаЧтаетабтаБтайтаЫтаБтаГ
ЁТМ║,1233A,letter,CUNEIFORM SIGN URU TIMES BAR,таетаЧтаетабтаГтаЬ
ЁТМ╗,1233B,letter,CUNEIFORM SIGN URU TIMES DUN,таетаЧтаетабтаЩтаетаЭ
ЁТМ╝,1233C,letter,CUNEIFORM SIGN URU TIMES GA,таетаЧтаетабтаЫтаБ
ЁТМ╜,1233D,letter,CUNEIFORM SIGN URU TIMES GAL,таетаЧтаетабтаЫтаБтаЗ
ЁТМ╛,1233E,letter,CUNEIFORM SIGN URU TIMES GAN2 TENU,таетаЧтаетабтаЫтаБтаЭ таЮтаСтаЭтае
ЁТМ┐,1233F,letter,CUNEIFORM SIGN URU TIMES GAR,таетаЧтаетабтаЫтаЬ
ЁТНА,12340,letter,CUNEIFORM SIGN URU TIMES GU,таетаЧтаетабтаЫтае
ЁТНБ,12341,letter,CUNEIFORM SIGN URU TIMES HA,таетаЧтаетабтаУтаБ
ЁТНВ,12342,letter,CUNEIFORM SIGN URU TIMES IGI,таетаЧтаетабтаКтаЫтаК
ЁТНГ,12343,letter,CUNEIFORM SIGN URU TIMES IM,таетаЧтаетабтаКтаН
ЁТНД,12344,letter,CUNEIFORM SIGN URU TIMES ISH,таетаЧтаетабтаКтай
ЁТНЕ,12345,letter,CUNEIFORM SIGN URU TIMES KI,таетаЧтаетабтаЕтаК
ЁТНЖ,12346,letter,CUNEIFORM SIGN URU TIMES LUM,таетаЧтаетабтаЗтаетаН
ЁТНЗ,12347,letter,CUNEIFORM SIGN URU TIMES MIN,таетаЧтаетабтаНтаКтаЭ
ЁТНИ,12348,letter,CUNEIFORM SIGN URU TIMES PA,таетаЧтаетабтаПтаБ
ЁТНЙ,12349,letter,CUNEIFORM SIGN URU TIMES SHE,таетаЧтаетабтайтаС
ЁТНК,1234A,letter,CUNEIFORM SIGN URU TIMES SIG4,таетаЧтаетабтаОтаКтаЫта▓
ЁТНЛ,1234B,letter,CUNEIFORM SIGN URU TIMES TU,таетаЧтаетабтаЮтае
ЁТНМ,1234C,letter,CUNEIFORM SIGN URU TIMES U PLUS GUD,таетаЧтаетабтаетамтаЫтаетаЩ
ЁТНН,1234D,letter,CUNEIFORM SIGN URU TIMES UD,таетаЧтаетабтаетаЩ
ЁТНО,1234E,letter,CUNEIFORM SIGN URU TIMES URUDA,таетаЧтаетабтаетаЧтаетаЩтаБ
ЁТНП,1234F,letter,CUNEIFORM SIGN URUDA,таетаЧтаетаЩтаБ
ЁТНР,12350,letter,CUNEIFORM SIGN URUDA TIMES U,таетаЧтаетаЩтаБтабтае
ЁТНС,12351,letter,CUNEIFORM SIGN USH,таетай
ЁТНТ,12352,letter,CUNEIFORM SIGN USH TIMES A,таетайтабтаБ
ЁТНУ,12353,letter,CUNEIFORM SIGN USH TIMES KU,таетайтабтаЕтае
ЁТНФ,12354,letter,CUNEIFORM SIGN USH TIMES KUR,таетайтабтаЕтаетаЧ
ЁТНХ,12355,letter,CUNEIFORM SIGN USH TIMES TAK4,таетайтабтаЮтаБтаЕта▓
ЁТНЦ,12356,letter,CUNEIFORM SIGN USHX,таетайтан
ЁТНЧ,12357,letter,CUNEIFORM SIGN USH2,таетай
ЁТНШ,12358,letter,CUNEIFORM SIGN USHUMX,таетайтаетаНтан
ЁТНЩ,12359,letter,CUNEIFORM SIGN UTUKI,таетаЮтаетаЕтаК
ЁТНЪ,1235A,letter,CUNEIFORM SIGN UZ3,таета╡таТ
