,Character(decimal),Decimal,Character(hex),Hex,Name,Braille
219,­њЃЏ,73947,­њЃЏ,120DB,CUNEIFORM SIGN GA2 TIMES KID PLUS LAL,РаЏРаЂРа╝РаЃРаљРадРаЁРаіРаЎРаљРаќРаЄРаЂРаЄ
220,­њЃю,73948,­њЃю,120DC,CUNEIFORM SIGN GA2 TIMES KU3 PLUS AN,РаЏРаЂРа╝РаЃРаљРадРаЁРаЦРа╝РаЅРаљРаќРаЂРаЮ
221,­њЃЮ,73949,­њЃЮ,120DD,CUNEIFORM SIGN GA2 TIMES LA,РаЏРаЂРа╝РаЃРаљРадРаЄРаЂ
222,­њЃъ,73950,­њЃъ,120DE,CUNEIFORM SIGN GA2 TIMES ME PLUS EN,РаЏРаЂРа╝РаЃРаљРадРаЇРаЉРаљРаќРаЉРаЮ
223,­њЃЪ,73951,­њЃЪ,120DF,CUNEIFORM SIGN GA2 TIMES MI,РаЏРаЂРа╝РаЃРаљРадРаЇРаі
224,­њЃа,73952,­њЃа,120E0,CUNEIFORM SIGN GA2 TIMES NUN,РаЏРаЂРа╝РаЃРаљРадРаЮРаЦРаЮ
225,­њЃА,73953,­њЃА,120E1,CUNEIFORM SIGN GA2 TIMES NUN OVER NUN,РаЏРаЂРа╝РаЃРаљРадРаЮРаЦРаЮРаљРаїРаЮРаЦРаЮ
226,­њЃб,73954,­њЃб,120E2,CUNEIFORM SIGN GA2 TIMES PA,РаЏРаЂРа╝РаЃРаљРадРаЈРаЂ
227,­њЃБ,73955,­њЃБ,120E3,CUNEIFORM SIGN GA2 TIMES SAL,РаЏРаЂРа╝РаЃРаљРадРајРаЂРаЄ
228,­њЃц,73956,­њЃц,120E4,CUNEIFORM SIGN GA2 TIMES SAR,РаЏРаЂРа╝РаЃРаљРадРајРаЂРаЌ
229,­њЃЦ,73957,­њЃЦ,120E5,CUNEIFORM SIGN GA2 TIMES SHE,РаЏРаЂРа╝РаЃРаљРадРајРаЊРаЉ
230,­њЃд,73958,­њЃд,120E6,CUNEIFORM SIGN GA2 TIMES SHE PLUS TUR,РаЏРаЂРа╝РаЃРаљРадРајРаЊРаЉРаљРаќРаъРаЦРаЌ
231,­њЃД,73959,­њЃД,120E7,CUNEIFORM SIGN GA2 TIMES SHID,РаЏРаЂРа╝РаЃРаљРадРајРаЊРаіРаЎ
232,­њЃе,73960,­њЃе,120E8,CUNEIFORM SIGN GA2 TIMES SUM,РаЏРаЂРа╝РаЃРаљРадРајРаЦРаЇ
233,­њЃЕ,73961,­њЃЕ,120E9,CUNEIFORM SIGN GA2 TIMES TAK4,РаЏРаЂРа╝РаЃРаљРадРаъРаЂРаЁРа╝РаЎ
234,­њЃф,73962,­њЃф,120EA,CUNEIFORM SIGN GA2 TIMES U,РаЏРаЂРа╝РаЃРаљРадРаЦ
235,­њЃФ,73963,­њЃФ,120EB,CUNEIFORM SIGN GA2 TIMES UD,РаЏРаЂРа╝РаЃРаљРадРаЦРаЎ
236,­њЃг,73964,­њЃг,120EC,CUNEIFORM SIGN GA2 TIMES UD PLUS DU,РаЏРаЂРа╝РаЃРаљРадРаЦРаЎРаљРаќРаЎРаЦ
237,­њЃГ,73965,­њЃГ,120ED,CUNEIFORM SIGN GA2 OVER GA2,РаЏРаЂРа╝РаЃРаљРаїРаЏРаЂРа╝РаЃ
238,­њЃ«,73966,­њЃ«,120EE,CUNEIFORM SIGN GABA,РаЏРаЂРаЃРаЂ
239,­њЃ»,73967,­њЃ»,120EF,CUNEIFORM SIGN GABA CROSSING GABA,РаЏРаЂРаЃРаЂРаѕРа»РаЏРаЂРаЃРаЂ
240,­њЃ░,73968,­њЃ░,120F0,CUNEIFORM SIGN GAD,РаЏРаЂРаЎ
241,­њЃ▒,73969,­њЃ▒,120F1,CUNEIFORM SIGN GAD OVER GAD GAR OVER GAR,РаЏРаЂРаЎРаљРаїРаЏРаЂРаЎ РаЏРаЂРаЌРаљРаїРаЏРаЂРаЌ
242,­њЃ▓,73970,­њЃ▓,120F2,CUNEIFORM SIGN GAL,РаЏРаЂРаЄ
243,­њЃ│,73971,­њЃ│,120F3,CUNEIFORM SIGN GAL GAD OVER GAD GAR OVER GAR,РаЏРаЂРаЄ РаЏРаЂРаЎРаљРаїРаЏРаЂРаЎ РаЏРаЂРаЌРаљРаїРаЏРаЂРаЌ
244,­њЃ┤,73972,­њЃ┤,120F4,CUNEIFORM SIGN GALAM,РаЏРаЂРаЄРаЂРаЇ
245,­њЃх,73973,­њЃх,120F5,CUNEIFORM SIGN GAM,РаЏРаЂРаЇ
246,­њЃХ,73974,­њЃХ,120F6,CUNEIFORM SIGN GAN,РаЏРаЂРаЮ
247,­њЃи,73975,­њЃи,120F7,CUNEIFORM SIGN GAN2,РаЏРаЂРаЮРа╝РаЃ
248,­њЃИ,73976,­њЃИ,120F8,CUNEIFORM SIGN GAN2 TENU,РаЏРаЂРаЮРа╝РаЃ РаъРаЉРаЮРаЦ
249,­њЃ╣,73977,­њЃ╣,120F9,CUNEIFORM SIGN GAN2 OVER GAN2,РаЏРаЂРаЮРа╝РаЃРаљРаїРаЏРаЂРаЮРа╝РаЃ
250,­њЃ║,73978,­њЃ║,120FA,CUNEIFORM SIGN GAN2 CROSSING GAN2,РаЏРаЂРаЮРа╝РаЃРаѕРа»РаЏРаЂРаЮРа╝РаЃ
251,­њЃ╗,73979,­њЃ╗,120FB,CUNEIFORM SIGN GAR,РаЏРаЂРаЌ
252,­њЃ╝,73980,­њЃ╝,120FC,CUNEIFORM SIGN GAR3,РаЏРаЂРаЌРа╝РаЅ
253,­њЃй,73981,­њЃй,120FD,CUNEIFORM SIGN GASHAN,РаЏРаЂРајРаЊРаЂРаЮ
254,­њЃЙ,73982,­њЃЙ,120FE,CUNEIFORM SIGN GESHTIN,РаЏРаЉРајРаЊРаъРаіРаЮ
255,­њЃ┐,73983,­њЃ┐,120FF,CUNEIFORM SIGN GESHTIN TIMES KUR,РаЏРаЉРајРаЊРаъРаіРаЮРаљРадРаЁРаЦРаЌ
256,­њёђ,73984,­њёђ,12100,CUNEIFORM SIGN GI,РаЏРаі
257,­њёЂ,73985,­њёЂ,12101,CUNEIFORM SIGN GI TIMES E,РаЏРаіРаљРадРаЉ
258,­њёѓ,73986,­њёѓ,12102,CUNEIFORM SIGN GI TIMES U,РаЏРаіРаљРадРаЦ
259,­њёЃ,73987,­њёЃ,12103,CUNEIFORM SIGN GI CROSSING GI,РаЏРаіРаѕРа»РаЏРаі
260,­њёё,73988,­њёё,12104,CUNEIFORM SIGN GI4,РаЏРаіРа╝РаЎ
261,­њёЁ,73989,­њёЁ,12105,CUNEIFORM SIGN GI4 OVER GI4,РаЏРаіРа╝РаЎРаљРаїРаЏРаіРа╝РаЎ
262,­њёє,73990,­њёє,12106,CUNEIFORM SIGN GI4 CROSSING GI4,РаЏРаіРа╝РаЎРаѕРа»РаЏРаіРа╝РаЎ
263,­њёЄ,73991,­њёЄ,12107,CUNEIFORM SIGN GIDIM,РаЏРаіРаЎРаіРаЇ
264,­њёѕ,73992,­њёѕ,12108,CUNEIFORM SIGN GIR2,РаЏРаіРаЌРа╝РаЃ
265,­њёЅ,73993,­њёЅ,12109,CUNEIFORM SIGN GIR2 GUNU,РаЏРаіРаЌРа╝РаЃ РаЏРаЦРаЮРаЦ
266,­њёі,73994,­њёі,1210A,CUNEIFORM SIGN GIR3,РаЏРаіРаЌРа╝РаЅ
267,­њёІ,73995,­њёІ,1210B,CUNEIFORM SIGN GIR3 TIMES A PLUS IGI,РаЏРаіРаЌРа╝РаЅРаљРадРаЂРаљРаќРаіРаЏРаі
268,­њёї,73996,­њёї,1210C,CUNEIFORM SIGN GIR3 TIMES GAN2 TENU,РаЏРаіРаЌРа╝РаЅРаљРадРаЏРаЂРаЮРа╝РаЃ РаъРаЉРаЮРаЦ
269,­њёЇ,73997,­њёЇ,1210D,CUNEIFORM SIGN GIR3 TIMES IGI,РаЏРаіРаЌРа╝РаЅРаљРадРаіРаЏРаі
270,­њёј,73998,­њёј,1210E,CUNEIFORM SIGN GIR3 TIMES LU PLUS IGI,РаЏРаіРаЌРа╝РаЅРаљРадРаЄРаЦРаљРаќРаіРаЏРаі
271,­њёЈ,73999,­њёЈ,1210F,CUNEIFORM SIGN GIR3 TIMES PA,РаЏРаіРаЌРа╝РаЅРаљРадРаЈРаЂ
272,­њёљ,74000,­њёљ,12110,CUNEIFORM SIGN GISAL,РаЏРаіРајРаЂРаЄ
273,­њёЉ,74001,­њёЉ,12111,CUNEIFORM SIGN GISH,РаЏРаіРајРаЊ
274,­њёњ,74002,­њёњ,12112,CUNEIFORM SIGN GISH CROSSING GISH,РаЏРаіРајРаЊРаѕРа»РаЏРаіРајРаЊ
275,­њёЊ,74003,­њёЊ,12113,CUNEIFORM SIGN GISH TIMES BAD,РаЏРаіРајРаЊРаљРадРаЃРаЂРаЎ
276,­њёћ,74004,­њёћ,12114,CUNEIFORM SIGN GISH TIMES TAK4,РаЏРаіРајРаЊРаљРадРаъРаЂРаЁРа╝РаЎ
277,­њёЋ,74005,­њёЋ,12115,CUNEIFORM SIGN GISH TENU,РаЏРаіРајРаЊ РаъРаЉРаЮРаЦ
278,­њёќ,74006,­њёќ,12116,CUNEIFORM SIGN GU,РаЏРаЦ
279,­њёЌ,74007,­њёЌ,12117,CUNEIFORM SIGN GU CROSSING GU,РаЏРаЦРаѕРа»РаЏРаЦ
280,­њёў,74008,­њёў,12118,CUNEIFORM SIGN GU2,РаЏРаЦРа╝РаЃ
281,­њёЎ,74009,­њёЎ,12119,CUNEIFORM SIGN GU2 TIMES KAK,РаЏРаЦРа╝РаЃРаљРадРаЁРаЂРаЁ
282,­њёџ,74010,­њёџ,1211A,CUNEIFORM SIGN GU2 TIMES KAK TIMES IGI GUNU,РаЏРаЦРа╝РаЃРаљРадРаЁРаЂРаЁРаљРадРаіРаЏРаі РаЏРаЦРаЮРаЦ
283,­њёЏ,74011,­њёЏ,1211B,CUNEIFORM SIGN GU2 TIMES NUN,РаЏРаЦРа╝РаЃРаљРадРаЮРаЦРаЮ
284,­њёю,74012,­њёю,1211C,CUNEIFORM SIGN GU2 TIMES SAL PLUS TUG2,РаЏРаЦРа╝РаЃРаљРадРајРаЂРаЄРаљРаќРаъРаЦРаЏРа╝РаЃ
285,­њёЮ,74013,­њёЮ,1211D,CUNEIFORM SIGN GU2 GUNU,РаЏРаЦРа╝РаЃ РаЏРаЦРаЮРаЦ
286,­њёъ,74014,­њёъ,1211E,CUNEIFORM SIGN GUD,РаЏРаЦРаЎ
287,­њёЪ,74015,­њёЪ,1211F,CUNEIFORM SIGN GUD TIMES A PLUS KUR,РаЏРаЦРаЎРаљРадРаЂРаљРаќРаЁРаЦРаЌ
288,­њёа,74016,­њёа,12120,CUNEIFORM SIGN GUD TIMES KUR,РаЏРаЦРаЎРаљРадРаЁРаЦРаЌ
289,­њёА,74017,­њёА,12121,CUNEIFORM SIGN GUD OVER GUD LUGAL,РаЏРаЦРаЎРаљРаїРаЏРаЦРаЎ РаЄРаЦРаЏРаЂРаЄ
290,­њёб,74018,­њёб,12122,CUNEIFORM SIGN GUL,РаЏРаЦРаЄ
291,­њёБ,74019,­њёБ,12123,CUNEIFORM SIGN GUM,РаЏРаЦРаЇ
292,­њёц,74020,­њёц,12124,CUNEIFORM SIGN GUM TIMES SHE,РаЏРаЦРаЇРаљРадРајРаЊРаЉ
293,­њёЦ,74021,­њёЦ,12125,CUNEIFORM SIGN GUR,РаЏРаЦРаЌ
294,­њёд,74022,­њёд,12126,CUNEIFORM SIGN GUR7,РаЏРаЦРаЌРа╝РаЏ
295,­њёД,74023,­њёД,12127,CUNEIFORM SIGN GURUN,РаЏРаЦРаЌРаЦРаЮ
296,­њёе,74024,­њёе,12128,CUNEIFORM SIGN GURUSH,РаЏРаЦРаЌРаЦРајРаЊ
297,­њёЕ,74025,­њёЕ,12129,CUNEIFORM SIGN HA,РаЊРаЂ
298,­њёф,74026,­њёф,1212A,CUNEIFORM SIGN HA TENU,РаЊРаЂ РаъРаЉРаЮРаЦ
299,­њёФ,74027,­њёФ,1212B,CUNEIFORM SIGN HA GUNU,РаЊРаЂ РаЏРаЦРаЮРаЦ
300,­њёг,74028,­њёг,1212C,CUNEIFORM SIGN HAL,РаЊРаЂРаЄ
301,­њёГ,74029,­њёГ,1212D,CUNEIFORM SIGN HI,РаЊРаі
302,­њё«,74030,­њё«,1212E,CUNEIFORM SIGN HI TIMES ASH,РаЊРаіРаљРадРаЂРајРаЊ
303,­њё»,74031,­њё»,1212F,CUNEIFORM SIGN HI TIMES ASH2,РаЊРаіРаљРадРаЂРајРаЊРа╝РаЃ
304,­њё░,74032,­њё░,12130,CUNEIFORM SIGN HI TIMES BAD,РаЊРаіРаљРадРаЃРаЂРаЎ
305,­њё▒,74033,­њё▒,12131,CUNEIFORM SIGN HI TIMES DISH,РаЊРаіРаљРадРаЎРаіРајРаЊ
306,­њё▓,74034,­њё▓,12132,CUNEIFORM SIGN HI TIMES GAD,РаЊРаіРаљРадРаЏРаЂРаЎ
307,­њё│,74035,­њё│,12133,CUNEIFORM SIGN HI TIMES KIN,РаЊРаіРаљРадРаЁРаіРаЮ
308,­њё┤,74036,­њё┤,12134,CUNEIFORM SIGN HI TIMES NUN,РаЊРаіРаљРадРаЮРаЦРаЮ
309,­њёх,74037,­њёх,12135,CUNEIFORM SIGN HI TIMES SHE,РаЊРаіРаљРадРајРаЊРаЉ
310,­њёХ,74038,­њёХ,12136,CUNEIFORM SIGN HI TIMES U,РаЊРаіРаљРадРаЦ
311,­њёи,74039,­њёи,12137,CUNEIFORM SIGN HU,РаЊРаЦ
312,­њёИ,74040,­њёИ,12138,CUNEIFORM SIGN HUB2,РаЊРаЦРаЃРа╝РаЃ
313,­њё╣,74041,­њё╣,12139,CUNEIFORM SIGN HUB2 TIMES AN,РаЊРаЦРаЃРа╝РаЃРаљРадРаЂРаЮ
314,­њё║,74042,­њё║,1213A,CUNEIFORM SIGN HUB2 TIMES HAL,РаЊРаЦРаЃРа╝РаЃРаљРадРаЊРаЂРаЄ
315,­њё╗,74043,­њё╗,1213B,CUNEIFORM SIGN HUB2 TIMES KASKAL,РаЊРаЦРаЃРа╝РаЃРаљРадРаЁРаЂРајРаЁРаЂРаЄ
316,­њё╝,74044,­њё╝,1213C,CUNEIFORM SIGN HUB2 TIMES LISH,РаЊРаЦРаЃРа╝РаЃРаљРадРаЄРаіРајРаЊ
317,­њёй,74045,­њёй,1213D,CUNEIFORM SIGN HUB2 TIMES UD,РаЊРаЦРаЃРа╝РаЃРаљРадРаЦРаЎ
318,­њёЙ,74046,­њёЙ,1213E,CUNEIFORM SIGN HUL2,РаЊРаЦРаЄРа╝РаЃ
319,­њё┐,74047,­њё┐,1213F,CUNEIFORM SIGN I,Раі
320,­њЁђ,74048,­њЁђ,12140,CUNEIFORM SIGN I A,Раі РаЂ
321,­њЁЂ,74049,­њЁЂ,12141,CUNEIFORM SIGN IB,РаіРаЃ
322,­њЁѓ,74050,­њЁѓ,12142,CUNEIFORM SIGN IDIM,РаіРаЎРаіРаЇ
323,­њЁЃ,74051,­њЁЃ,12143,CUNEIFORM SIGN IDIM OVER IDIM BUR,РаіРаЎРаіРаЇРаљРаїРаіРаЎРаіРаЇ РаЃРаЦРаЌ
324,­њЁё,74052,­њЁё,12144,CUNEIFORM SIGN IDIM OVER IDIM SQUARED,РаіРаЎРаіРаЇРаљРаїРаіРаЎРаіРаЇРаћРа╝РаЃ
325,­њЁЁ,74053,­њЁЁ,12145,CUNEIFORM SIGN IG,РаіРаЏ
326,­њЁє,74054,­њЁє,12146,CUNEIFORM SIGN IGI,РаіРаЏРаі
327,­њЁЄ,74055,­њЁЄ,12147,CUNEIFORM SIGN IGI DIB,РаіРаЏРаі РаЎРаіРаЃ
328,­њЁѕ,74056,­њЁѕ,12148,CUNEIFORM SIGN IGI RI,РаіРаЏРаі РаЌРаі
329,­њЁЅ,74057,­њЁЅ,12149,CUNEIFORM SIGN IGI OVER IGI SHIR OVER SHIR UD OVER UD,РаіРаЏРаіРаљРаїРаіРаЏРаі РајРаЊРаіРаЌРаљРаїРајРаЊРаіРаЌ РаЦРаЎРаљРаїРаЦРаЎ
330,­њЁі,74058,­њЁі,1214A,CUNEIFORM SIGN IGI GUNU,РаіРаЏРаі РаЏРаЦРаЮРаЦ
331,­њЁІ,74059,­њЁІ,1214B,CUNEIFORM SIGN IL,РаіРаЄ
332,­њЁї,74060,­њЁї,1214C,CUNEIFORM SIGN IL TIMES GAN2 TENU,РаіРаЄРаљРадРаЏРаЂРаЮРа╝РаЃ РаъРаЉРаЮРаЦ
333,­њЁЇ,74061,­њЁЇ,1214D,CUNEIFORM SIGN IL2,РаіРаЄРа╝РаЃ
334,­њЁј,74062,­њЁј,1214E,CUNEIFORM SIGN IM,РаіРаЇ
335,­њЁЈ,74063,­њЁЈ,1214F,CUNEIFORM SIGN IM TIMES TAK4,РаіРаЇРаљРадРаъРаЂРаЁРа╝РаЎ
336,­њЁљ,74064,­њЁљ,12150,CUNEIFORM SIGN IM CROSSING IM,РаіРаЇРаѕРа»РаіРаЇ
337,­њЁЉ,74065,­њЁЉ,12151,CUNEIFORM SIGN IM OPPOSING IM,РаіРаЇРаѕРајРаіРаЇ
338,­њЁњ,74066,­њЁњ,12152,CUNEIFORM SIGN IM SQUARED,РаіРаЇРаћРа╝РаЃ
339,­њЁЊ,74067,­њЁЊ,12153,CUNEIFORM SIGN IMIN,РаіРаЇРаіРаЮ
340,­њЁћ,74068,­њЁћ,12154,CUNEIFORM SIGN IN,РаіРаЮ
341,­њЁЋ,74069,­њЁЋ,12155,CUNEIFORM SIGN IR,РаіРаЌ
342,­њЁќ,74070,­њЁќ,12156,CUNEIFORM SIGN ISH,РаіРајРаЊ
343,­њЁЌ,74071,­њЁЌ,12157,CUNEIFORM SIGN KA,РаЁРаЂ
344,­њЁў,74072,­њЁў,12158,CUNEIFORM SIGN KA TIMES A,РаЁРаЂРаљРадРаЂ
345,­њЁЎ,74073,­њЁЎ,12159,CUNEIFORM SIGN KA TIMES AD,РаЁРаЂРаљРадРаЂРаЎ
346,­њЁџ,74074,­њЁџ,1215A,CUNEIFORM SIGN KA TIMES AD PLUS KU3,РаЁРаЂРаљРадРаЂРаЎРаљРаќРаЁРаЦРа╝РаЅ
347,­њЁЏ,74075,­њЁЏ,1215B,CUNEIFORM SIGN KA TIMES ASH2,РаЁРаЂРаљРадРаЂРајРаЊРа╝РаЃ
348,­њЁю,74076,­њЁю,1215C,CUNEIFORM SIGN KA TIMES BAD,РаЁРаЂРаљРадРаЃРаЂРаЎ
349,­њЁЮ,74077,­њЁЮ,1215D,CUNEIFORM SIGN KA TIMES BALAG,РаЁРаЂРаљРадРаЃРаЂРаЄРаЂРаЏ
350,­њЁъ,74078,­њЁъ,1215E,CUNEIFORM SIGN KA TIMES BAR,РаЁРаЂРаљРадРаЃРаЂРаЌ
351,­њЁЪ,74079,­њЁЪ,1215F,CUNEIFORM SIGN KA TIMES BI,РаЁРаЂРаљРадРаЃРаі
352,­њЁа,74080,­њЁа,12160,CUNEIFORM SIGN KA TIMES ERIN2,РаЁРаЂРаљРадРаЉРаЌРаіРаЮРа╝РаЃ
353,­њЁА,74081,­њЁА,12161,CUNEIFORM SIGN KA TIMES ESH2,РаЁРаЂРаљРадРаЉРајРаЊРа╝РаЃ
354,­њЁб,74082,­њЁб,12162,CUNEIFORM SIGN KA TIMES GA,РаЁРаЂРаљРадРаЏРаЂ
355,­њЁБ,74083,­њЁБ,12163,CUNEIFORM SIGN KA TIMES GAL,РаЁРаЂРаљРадРаЏРаЂРаЄ
356,­њЁц,74084,­њЁц,12164,CUNEIFORM SIGN KA TIMES GAN2 TENU,РаЁРаЂРаљРадРаЏРаЂРаЮРа╝РаЃ РаъРаЉРаЮРаЦ
357,­њЁЦ,74085,­њЁЦ,12165,CUNEIFORM SIGN KA TIMES GAR,РаЁРаЂРаљРадРаЏРаЂРаЌ
358,­њЁд,74086,­њЁд,12166,CUNEIFORM SIGN KA TIMES GAR PLUS SHA3 PLUS A,РаЁРаЂРаљРадРаЏРаЂРаЌРаљРаќРајРаЊРаЂРа╝РаЅРаљРаќРаЂ
359,­њЁД,74087,­њЁД,12167,CUNEIFORM SIGN KA TIMES GI,РаЁРаЂРаљРадРаЏРаі
360,­њЁе,74088,­њЁе,12168,CUNEIFORM SIGN KA TIMES GIR2,РаЁРаЂРаљРадРаЏРаіРаЌРа╝РаЃ
361,­њЁЕ,74089,­њЁЕ,12169,CUNEIFORM SIGN KA TIMES GISH PLUS SAR,РаЁРаЂРаљРадРаЏРаіРајРаЊРаљРаќРајРаЂРаЌ
362,­њЁф,74090,­њЁф,1216A,CUNEIFORM SIGN KA TIMES GISH CROSSING GISH,РаЁРаЂРаљРадРаЏРаіРајРаЊРаѕРа»РаЏРаіРајРаЊ
363,­њЁФ,74091,­њЁФ,1216B,CUNEIFORM SIGN KA TIMES GU,РаЁРаЂРаљРадРаЏРаЦ
364,­њЁг,74092,­њЁг,1216C,CUNEIFORM SIGN KA TIMES GUR7,РаЁРаЂРаљРадРаЏРаЦРаЌРа╝РаЏ
365,­њЁГ,74093,­њЁГ,1216D,CUNEIFORM SIGN KA TIMES IGI,РаЁРаЂРаљРадРаіРаЏРаі
366,­њЁ«,74094,­њЁ«,1216E,CUNEIFORM SIGN KA TIMES IM,РаЁРаЂРаљРадРаіРаЇ
367,­њЁ»,74095,­њЁ»,1216F,CUNEIFORM SIGN KA TIMES KAK,РаЁРаЂРаљРадРаЁРаЂРаЁ
368,­њЁ░,74096,­њЁ░,12170,CUNEIFORM SIGN KA TIMES KI,РаЁРаЂРаљРадРаЁРаі
369,­њЁ▒,74097,­њЁ▒,12171,CUNEIFORM SIGN KA TIMES KID,РаЁРаЂРаљРадРаЁРаіРаЎ
370,­њЁ▓,74098,­њЁ▓,12172,CUNEIFORM SIGN KA TIMES LI,РаЁРаЂРаљРадРаЄРаі
371,­њЁ│,74099,­њЁ│,12173,CUNEIFORM SIGN KA TIMES LU,РаЁРаЂРаљРадРаЄРаЦ
372,­њЁ┤,74100,­њЁ┤,12174,CUNEIFORM SIGN KA TIMES ME,РаЁРаЂРаљРадРаЇРаЉ
373,­њЁх,74101,­њЁх,12175,CUNEIFORM SIGN KA TIMES ME PLUS DU,РаЁРаЂРаљРадРаЇРаЉРаљРаќРаЎРаЦ
374,­њЁХ,74102,­њЁХ,12176,CUNEIFORM SIGN KA TIMES ME PLUS GI,РаЁРаЂРаљРадРаЇРаЉРаљРаќРаЏРаі
375,­њЁи,74103,­њЁи,12177,CUNEIFORM SIGN KA TIMES ME PLUS TE,РаЁРаЂРаљРадРаЇРаЉРаљРаќРаъРаЉ
376,­њЁИ,74104,­њЁИ,12178,CUNEIFORM SIGN KA TIMES MI,РаЁРаЂРаљРадРаЇРаі
377,­њЁ╣,74105,­њЁ╣,12179,CUNEIFORM SIGN KA TIMES MI PLUS NUNUZ,РаЁРаЂРаљРадРаЇРаіРаљРаќРаЮРаЦРаЮРаЦ
378,­њЁ║,74106,­њЁ║,1217A,CUNEIFORM SIGN KA TIMES NE,РаЁРаЂРаљРадРаЮРаЉ
379,­њЁ╗,74107,­њЁ╗,1217B,CUNEIFORM SIGN KA TIMES NUN,РаЁРаЂРаљРадРаЮРаЦРаЮ
380,­њЁ╝,74108,­њЁ╝,1217C,CUNEIFORM SIGN KA TIMES PI,РаЁРаЂРаљРадРаЈРаі
381,­њЁй,74109,­њЁй,1217D,CUNEIFORM SIGN KA TIMES RU,РаЁРаЂРаљРадРаЌРаЦ
382,­њЁЙ,74110,­њЁЙ,1217E,CUNEIFORM SIGN KA TIMES SA,РаЁРаЂРаљРадРајРаЂ
383,­њЁ┐,74111,­њЁ┐,1217F,CUNEIFORM SIGN KA TIMES SAR,РаЁРаЂРаљРадРајРаЂРаЌ
384,­њєђ,74112,­њєђ,12180,CUNEIFORM SIGN KA TIMES SHA,РаЁРаЂРаљРадРајРаЊРаЂ
385,­њєЂ,74113,­њєЂ,12181,CUNEIFORM SIGN KA TIMES SHE,РаЁРаЂРаљРадРајРаЊРаЉ
386,­њєѓ,74114,­њєѓ,12182,CUNEIFORM SIGN KA TIMES SHID,РаЁРаЂРаљРадРајРаЊРаіРаЎ
387,­њєЃ,74115,­њєЃ,12183,CUNEIFORM SIGN KA TIMES SHU,РаЁРаЂРаљРадРајРаЊРаЦ
388,­њєё,74116,­њєё,12184,CUNEIFORM SIGN KA TIMES SIG,РаЁРаЂРаљРадРајРаіРаЏ
389,­њєЁ,74117,­њєЁ,12185,CUNEIFORM SIGN KA TIMES SUHUR,РаЁРаЂРаљРадРајРаЦРаЊРаЦРаЌ
390,­њєє,74118,­њєє,12186,CUNEIFORM SIGN KA TIMES TAR,РаЁРаЂРаљРадРаъРаЂРаЌ
391,­њєЄ,74119,­њєЄ,12187,CUNEIFORM SIGN KA TIMES U,РаЁРаЂРаљРадРаЦ
392,­њєѕ,74120,­њєѕ,12188,CUNEIFORM SIGN KA TIMES U2,РаЁРаЂРаљРадРаЦРа╝РаЃ
393,­њєЅ,74121,­њєЅ,12189,CUNEIFORM SIGN KA TIMES UD,РаЁРаЂРаљРадРаЦРаЎ
394,­њєі,74122,­њєі,1218A,CUNEIFORM SIGN KA TIMES UMUM TIMES PA,РаЁРаЂРаљРадРаЦРаЇРаЦРаЇРаљРадРаЈРаЂ
395,­њєІ,74123,­њєІ,1218B,CUNEIFORM SIGN KA TIMES USH,РаЁРаЂРаљРадРаЦРајРаЊ
396,­њєї,74124,­њєї,1218C,CUNEIFORM SIGN KA TIMES ZI,РаЁРаЂРаљРадРахРаі
397,­њєЇ,74125,­њєЇ,1218D,CUNEIFORM SIGN KA2,РаЁРаЂРа╝РаЃ
398,­њєј,74126,­њєј,1218E,CUNEIFORM SIGN KA2 CROSSING KA2,РаЁРаЂРа╝РаЃРаѕРа»РаЁРаЂРа╝РаЃ
399,­њєЈ,74127,­њєЈ,1218F,CUNEIFORM SIGN KAB,РаЁРаЂРаЃ
400,­њєљ,74128,­њєљ,12190,CUNEIFORM SIGN KAD2,РаЁРаЂРаЎРа╝РаЃ
401,­њєЉ,74129,­њєЉ,12191,CUNEIFORM SIGN KAD3,РаЁРаЂРаЎРа╝РаЅ
402,­њєњ,74130,­њєњ,12192,CUNEIFORM SIGN KAD4,РаЁРаЂРаЎРа╝РаЎ
403,­њєЊ,74131,­њєЊ,12193,CUNEIFORM SIGN KAD5,РаЁРаЂРаЎРа╝РаЉ
404,­њєћ,74132,­њєћ,12194,CUNEIFORM SIGN KAD5 OVER KAD5,РаЁРаЂРаЎРа╝РаЉРаљРаїРаЁРаЂРаЎРа╝РаЉ
405,­њєЋ,74133,­њєЋ,12195,CUNEIFORM SIGN KAK,РаЁРаЂРаЁ
406,­њєќ,74134,­њєќ,12196,CUNEIFORM SIGN KAK TIMES IGI GUNU,РаЁРаЂРаЁРаљРадРаіРаЏРаі РаЏРаЦРаЮРаЦ
407,­њєЌ,74135,­њєЌ,12197,CUNEIFORM SIGN KAL,РаЁРаЂРаЄ
408,­њєў,74136,­њєў,12198,CUNEIFORM SIGN KAL TIMES BAD,РаЁРаЂРаЄРаљРадРаЃРаЂРаЎ
409,­њєЎ,74137,­њєЎ,12199,CUNEIFORM SIGN KAL CROSSING KAL,РаЁРаЂРаЄРаѕРа»РаЁРаЂРаЄ
410,­њєџ,74138,­њєџ,1219A,CUNEIFORM SIGN KAM2,РаЁРаЂРаЇРа╝РаЃ
411,­њєЏ,74139,­њєЏ,1219B,CUNEIFORM SIGN KAM4,РаЁРаЂРаЇРа╝РаЎ
412,­њєю,74140,­њєю,1219C,CUNEIFORM SIGN KASKAL,РаЁРаЂРајРаЁРаЂРаЄ
413,­њєЮ,74141,­њєЮ,1219D,CUNEIFORM SIGN KASKAL LAGAB TIMES U OVER LAGAB TIMES U,РаЁРаЂРајРаЁРаЂРаЄ РаЄРаЂРаЏРаЂРаЃРаљРадРаЦРаљРаїРаЄРаЂРаЏРаЂРаЃРаљРадРаЦ
414,­њєъ,74142,­њєъ,1219E,CUNEIFORM SIGN KASKAL OVER KASKAL LAGAB TIMES U OVER LAGAB TIMES U,РаЁРаЂРајРаЁРаЂРаЄРаљРаїРаЁРаЂРајРаЁРаЂРаЄ РаЄРаЂРаЏРаЂРаЃРаљРадРаЦРаљРаїРаЄРаЂРаЏРаЂРаЃРаљРадРаЦ
415,­њєЪ,74143,­њєЪ,1219F,CUNEIFORM SIGN KESH2,РаЁРаЉРајРаЊРа╝РаЃ
416,­њєа,74144,­њєа,121A0,CUNEIFORM SIGN KI,РаЁРаі
417,­њєА,74145,­њєА,121A1,CUNEIFORM SIGN KI TIMES BAD,РаЁРаіРаљРадРаЃРаЂРаЎ
418,­њєб,74146,­њєб,121A2,CUNEIFORM SIGN KI TIMES U,РаЁРаіРаљРадРаЦ
419,­њєБ,74147,­њєБ,121A3,CUNEIFORM SIGN KI TIMES UD,РаЁРаіРаљРадРаЦРаЎ
420,­њєц,74148,­њєц,121A4,CUNEIFORM SIGN KID,РаЁРаіРаЎ
421,­њєЦ,74149,­њєЦ,121A5,CUNEIFORM SIGN KIN,РаЁРаіРаЮ
422,­њєд,74150,­њєд,121A6,CUNEIFORM SIGN KISAL,РаЁРаіРајРаЂРаЄ
423,­њєД,74151,­њєД,121A7,CUNEIFORM SIGN KISH,РаЁРаіРајРаЊ
424,­њєе,74152,­њєе,121A8,CUNEIFORM SIGN KISIM5,РаЁРаіРајРаіРаЇРа╝РаЉ
425,­њєЕ,74153,­њєЕ,121A9,CUNEIFORM SIGN KISIM5 OVER KISIM5,РаЁРаіРајРаіРаЇРа╝РаЉРаљРаїРаЁРаіРајРаіРаЇРа╝РаЉ
426,­њєф,74154,­њєф,121AA,CUNEIFORM SIGN KU,РаЁРаЦ
427,­њєФ,74155,­њєФ,121AB,CUNEIFORM SIGN KU OVER HI TIMES ASH2 KU OVER HI TIMES ASH2,РаЁРаЦРаљРаїРаЊРаіРаљРадРаЂРајРаЊРа╝РаЃ РаЁРаЦРаљРаїРаЊРаіРаљРадРаЂРајРаЊРа╝РаЃ
428,­њєг,74156,­њєг,121AC,CUNEIFORM SIGN KU3,РаЁРаЦРа╝РаЅ
429,­њєГ,74157,­њєГ,121AD,CUNEIFORM SIGN KU4,РаЁРаЦРа╝РаЎ
430,­њє«,74158,­њє«,121AE,CUNEIFORM SIGN KU4 VARIANT FORM,РаЁРаЦРа╝РаЎ РаДРаЂРаЌРаіРаЂРаЮРаъ РаІРаЋРаЌРаЇ
431,­њє»,74159,­њє»,121AF,CUNEIFORM SIGN KU7,РаЁРаЦРа╝РаЏ
432,­њє░,74160,­њє░,121B0,CUNEIFORM SIGN KUL,РаЁРаЦРаЄ
433,­њє▒,74161,­њє▒,121B1,CUNEIFORM SIGN KUL GUNU,РаЁРаЦРаЄ РаЏРаЦРаЮРаЦ
434,­њє▓,74162,­њє▓,121B2,CUNEIFORM SIGN KUN,РаЁРаЦРаЮ
435,­њє│,74163,­њє│,121B3,CUNEIFORM SIGN KUR,РаЁРаЦРаЌ
436,­њє┤,74164,­њє┤,121B4,CUNEIFORM SIGN KUR OPPOSING KUR,РаЁРаЦРаЌРаѕРајРаЁРаЦРаЌ
437,­њєх,74165,­њєх,121B5,CUNEIFORM SIGN KUSHU2,РаЁРаЦРајРаЊРаЦРа╝РаЃ
438,­њєХ,74166,­њєХ,121B6,CUNEIFORM SIGN KWU318,РаЁРа║РаЦРа╝РаЅРа╝РаЂРа╝РаЊ
439,­њєи,74167,­њєи,121B7,CUNEIFORM SIGN LA,РаЄРаЂ
440,­њєИ,74168,­њєИ,121B8,CUNEIFORM SIGN LAGAB,РаЄРаЂРаЏРаЂРаЃ
441,­њє╣,74169,­њє╣,121B9,CUNEIFORM SIGN LAGAB TIMES A,РаЄРаЂРаЏРаЂРаЃРаљРадРаЂ
442,­њє║,74170,­њє║,121BA,CUNEIFORM SIGN LAGAB TIMES A PLUS DA PLUS HA,РаЄРаЂРаЏРаЂРаЃРаљРадРаЂРаљРаќРаЎРаЂРаљРаќРаЊРаЂ
443,­њє╗,74171,­њє╗,121BB,CUNEIFORM SIGN LAGAB TIMES A PLUS GAR,РаЄРаЂРаЏРаЂРаЃРаљРадРаЂРаљРаќРаЏРаЂРаЌ
444,­њє╝,74172,­њє╝,121BC,CUNEIFORM SIGN LAGAB TIMES A PLUS LAL,РаЄРаЂРаЏРаЂРаЃРаљРадРаЂРаљРаќРаЄРаЂРаЄ
445,­њєй,74173,­њєй,121BD,CUNEIFORM SIGN LAGAB TIMES AL,РаЄРаЂРаЏРаЂРаЃРаљРадРаЂРаЄ
446,­њєЙ,74174,­њєЙ,121BE,CUNEIFORM SIGN LAGAB TIMES AN,РаЄРаЂРаЏРаЂРаЃРаљРадРаЂРаЮ
447,­њє┐,74175,­њє┐,121BF,CUNEIFORM SIGN LAGAB TIMES ASH ZIDA TENU,РаЄРаЂРаЏРаЂРаЃРаљРадРаЂРајРаЊ РахРаіРаЎРаЂ РаъРаЉРаЮРаЦ
448,­њЄђ,74176,­њЄђ,121C0,CUNEIFORM SIGN LAGAB TIMES BAD,РаЄРаЂРаЏРаЂРаЃРаљРадРаЃРаЂРаЎ
449,­њЄЂ,74177,­њЄЂ,121C1,CUNEIFORM SIGN LAGAB TIMES BI,РаЄРаЂРаЏРаЂРаЃРаљРадРаЃРаі
450,­њЄѓ,74178,­њЄѓ,121C2,CUNEIFORM SIGN LAGAB TIMES DAR,РаЄРаЂРаЏРаЂРаЃРаљРадРаЎРаЂРаЌ
451,­њЄЃ,74179,­њЄЃ,121C3,CUNEIFORM SIGN LAGAB TIMES EN,РаЄРаЂРаЏРаЂРаЃРаљРадРаЉРаЮ
452,­њЄё,74180,­њЄё,121C4,CUNEIFORM SIGN LAGAB TIMES GA,РаЄРаЂРаЏРаЂРаЃРаљРадРаЏРаЂ
453,­њЄЁ,74181,­њЄЁ,121C5,CUNEIFORM SIGN LAGAB TIMES GAR,РаЄРаЂРаЏРаЂРаЃРаљРадРаЏРаЂРаЌ
454,­њЄє,74182,­њЄє,121C6,CUNEIFORM SIGN LAGAB TIMES GUD,РаЄРаЂРаЏРаЂРаЃРаљРадРаЏРаЦРаЎ
